Title,Year,Genre,Plot,Language,Poster,IMDBRating,Director,Production
Black Jack: The Two Doctors in Black,2005,"16, 18","The mega-corporate Daedalus Group is under attack by a small group of activists known as the Ghost of Icarus. While taking care of some of the victims of the bombing, Black Jack encounters Dr. Kiriko, also known as Death Incarnate, who just like him, asks his patients huge sums of money but instead of saving them, he offers them a painless death. When the activist group requests both doctors’ collaboration, Black Jack finds himself caught in a spiral of life, death and treason while trying to save his patients' lives and avoid the breaking of a biological war that could destroy humanity.",ja,https://image.tmdb.org/t/p/w500/c3ut5CbzJCIh15YYdW6kfUDFF03.jpg,6,Satoshi Kuwabara,"Yomiuri Telecasting Corporation, dentsu Music And Entertainment, TOHO, Tezuka Productions, Avex Entertainment"
Locos de la bandera,2005,99,"The story of the relatives of the 649 Argentine fallen in the Malvinas War, who as soon as the military conflict ended, found themselves alone with their pain and prevented from approaching the grave of their loved ones, either because their bodies were left in the Cemetery of Darwin, in the Malvinas, or because they disappeared without being identified.",es,https://image.tmdb.org/t/p/w500/1gwPqth3dliSRchHqic4M3YA0Lg.jpg,0,Júlio Cardoso,"Comisión de Familiares de Caídos en Malvinas e Islas del Atlántico Sur, INCAA"
Mein ganz gewöhnliches Leben,2005,18,,de,N/A,0,Dominik Bechtel,
Nana,2005,"10749, 18, 10402","Two girls named Nana meet on a train to Tokyo. Nana K. aims to reunite with her boyfriend and Nana O. hopes to make it big in the music business. Despite their differences, the pair hit it off and become roommates.",ja,https://image.tmdb.org/t/p/w500/1RMroK0KvR1lws3ukpKkVxv3uwo.jpg,6.7,Kentaro Otani,"Aniplex, IMJ Entertainment, TBS, TOHO, Sedic International, Shueisha, MBS"
Seven Invisible Men,2005,18,"A group of drop-outs, losers and criminals are travelling in a stolen Mercedes seemingly aimlessly along numerous derelict houses and impassable roads to eventually end up on an old decaying state farm in Crimea, the southern tip of the former Soviet Union, where the mother, wife and daughter of one of them live. The men kill time with smoking, drinking and staring in front of them, but an undercurrent tension is brewing. On the last night they have a party that is equally destructive as their life",lt,https://image.tmdb.org/t/p/w500/k2GRU7WaitfMOQV3v7sueEpQ86O.jpg,5.6,Šarūnas Bartas,"Madragoa Filmes, Gemini Films, Studio Kinema, CNC, Roaring Films"
Land of Glass,2005,,"A woman lives with her seven-year-old daughter and newborn son in an isolated house in the middle of a mournful landscape; it seems as if winter has encased everything in a bluish, glass-like shell. The nervous woman is filled with a sense of dread and fear, which she tries to sate by taking walks in the woods. Her husband doesn't get home till late, the baby is sick, and she worries about his welfare until she is absolutely frantic. Not understanding his wife's problems, her husband suspects her of exaggerating her mental breakdown. He is unwilling to admit that even his daughter's behavior has altered.",lt,https://image.tmdb.org/t/p/w500/hK7NaJ9zHuU3yaHrTTGICQCuwp8.jpg,6,Janina Lapinskaitė,
Beauty and the Bastard,2005,"10402, 10749, 18","Modern finnish movie about two very different young adults that after a chance meeting end up making music together and fall in love.  While Nellis parents have the perfect career and man planned, she dreams of becoming a singer. Through a chance meeting at the studio, she meets the young and grungy Hip Hop music artist Sunen and asks him to help her make a demo tape.  Not only is the ensuing story about differences growing closer and the difficulties that have to be overcome, well told. Also the music is exceptionally well made. It is quite unbelievable that this is the first feature of the director.",fi,https://image.tmdb.org/t/p/w500/mFI69H3mY45zjMO1isfy3qGtOAM.jpg,6.2,Dome Karukoski,Helsinki-filmi
Comatose,N/A,,A bunch of friends get together for a house party in this slasher thriller. Something goes badly wrong and a girl seems to die while having sex. Then the rest of the party goers start dropping like flies - one by one...,en,N/A,0,Michael Merrill,
Gisela,2005,18,"Gisela is a young wife and mother, living in a working class German Housing Scheme. She is a supermarket cashier, her husband a delivery driver. The marriage is stale but together they are working their way up into the middle class.  George and Gisela evidently knew each other as teenagers. They live on the same scheme and George introduces her to his friend Paul. There is instant mutual attraction. Gisela spontaneously goes to a party that they invite her to that evening, where she and Paul begin a sexual relationship.",de,https://image.tmdb.org/t/p/w500/8r0eSdUDlVuIl7jEi65TlvnmdDm.jpg,5.2,Isabelle Stever,"TAG/TRAUM Filmproduktion, WDR"
Iron Island,2005,18,"Squatters live on a mothballed oil tanker in the Persian Gulf. The children attend a school on board; men harvest scrap metal and old oil in the hull; women keep house and raise children and Captain Nemat runs it all with an iron hand. We follow a lad who rescues fish trapped in the hull, an old man who stares at the sun, the idealistic teacher, and Ahmad, the Captain's assistant who has fallen in love with a young woman whose father wants to marry her to someone of means. What future has this sinking city?",fa,https://image.tmdb.org/t/p/w500/mUOyoK60x811aehBQwhSEcu0xYN.jpg,7.3,Mohammad Rasoulof,"Sheherazad Media International, Farabi Cinema"
James Dean: Forever Young,2005,99,"A brief career. A timeless stardom. In just three major movie roles, James Dean became an icon for the ages. Now his legacy shines even brighter thanks to this fascinating film that, filled with an astonishing treasure trove of newfound or rare glimpses of Dean's TV performances, is like a road map to his meteoric success. Michael J. Sheridan directs and Martin Sheen narrates this revealing documentary showcased at the 2005 Cannes Film Festival. Movie clips, romances, photos that are part of our national DNA (and the stories behind them), and the small-screen work that paved the way to the big screen are all part of the James Dean you couldn't see until now. Forever young. Endlessly fascinating.",en,https://image.tmdb.org/t/p/w500/r1sicppx7UFVk146g3GhASStpr8.jpg,4.8,Michael J. Sheridan,
The Man Who Couldn't,2005,"35, 18, 10749",A young Los Angeles cinephile falls in love with a woman but has that love tested by the all-seeing eye of the Internet.,en,https://image.tmdb.org/t/p/w500/jPPjS0clbnwI9grnuAqmozti1B8.jpg,0,Brandon Wilson,GeniusBastard Film Arts
The Marey Project,2005,,"A mysterious mix of loss and longing that investigates a man's imaginings, taking him to the edge of the abyss before he discovers what it is he needs most. Experimenting with a host of strange phenomena including phantoms from his past and present, Walter Hey confronts a power that could hold the key to his deepest dreams... or darkest nightmares. THE MAREY PROJECT is a challenging new work inspired by the photographic and chrono-photographic experiments of the 19th century French physiologist E. J. Marey. It is an eerie work, with intriguing whispers, reminiscent of Chris Marker’s ‘La Jetee’ (1962) in its clash of science with humanity.",en,N/A,0,James Clayden,
Moses - Fallen in the City of Angels,2005,28,"A tale of a fallen angel who was sentenced to a human life sentence... Moses, the angel of life is haunted by the visions of a dead child works as an assassin for Mrs. Mier whose true identity is Gabriel the Arc Angel... the assassination of Lucky Palermo was a mistake. Julius Palermo, Lucky's brother whose true identity is The dark angel...",en,https://image.tmdb.org/t/p/w500/bxAfedCAUyVcb5SH0rF1XRtmGiH.jpg,0,Ben Maccabee,
Die Quereinsteigerinnen,2005,"18, 35",Two young women kidnap the manager of the German telephone provider and start making strange demands while getting to know their captive a little better,de,https://image.tmdb.org/t/p/w500/m1zqMAqIp2W9y7nwepw5kmZ74Z3.jpg,5,Rainer Knepperges,Knipperges and Mrasek Filmproduktion
Radiant,2005,"27, 878","A genetically-engineered virus, meant for good, but never before tested on humans, has found a host. This is the story of four desperate people who, in their search for medical answers, were exposed to this created virus, called radiant, and the solitary lab assistant who becomes their only witness.",en,https://image.tmdb.org/t/p/w500/vAjrE1UjcMJOIHHgkF0jNBPXZPN.jpg,6,Steve Mahone,
11.59,2005,"9648, 53","Too much celebrating after scoring the year's biggest story leads to 24 missing hours in the life of photojournalist Aaron Doherty. Awakening in a wheat field with no memory of the previous day, Aaron struggles to account for the gap. Sent back in time when the phenomenon recurs, the progressively disoriented Aaron is left to untangle the vast political conspiracy that's behind it all.",en,https://image.tmdb.org/t/p/w500/zxOgjGDU38mR26rOzbnwoZr5WXV.jpg,5.4,Jamin Winans,
Kordavision: The man who shot Che Guevara,2005,,"Alberto Díaz Korda delivered intense photography experiences throughout his 40-year career. KordaVision traces this brilliant career from his beginning in Havana, Cuba, until he became Fidel Castro's personal photographer from 1959 through 1968.",en,https://image.tmdb.org/t/p/w500/dv7R7AN7CXQJHdIAmGNKgwBRqAT.jpg,0,N/A,
Quoi? L'éternité.,2005,99,"Fifty-eight minutes of mixed images from yesterday and today and about twenty voices of men and women, real Rimbaud lovers, known or unknown, disturbed by the reading of extracts of his poems or his letters, like a magic ceremony, bewitching, provoking the heart by the emotion of the senses, arousing the spirit, awakening the soul.",fr,https://image.tmdb.org/t/p/w500/625lKbNu63afeMRrfEWzldZO6B6.jpg,0,Étienne Faure,Eivissa Productions
Gol & Gincu,2005,"10749, 35, 18","Putri is determined to win back her sports-mad ex-boyfriend, Eddy by turning into a futsal heroine herself. Facing prejudice and ridicule, and discovering, through her motley futsal team, the many difficulties faced by women in sports, Putri gradually finds within herself the strength and values of a true winner, on and off the pitch.",ms,https://image.tmdb.org/t/p/w500/kaEy0EfI8gTE8RsXFTDG1O6N4oI.jpg,8,Bernard Chauly,
Infection,2005,27,"A meteor carrying an unknown infection, lands outside a Small Californian community, bringing terror and death. Just after midnight, a local rancher named Larry Jenkins discovers the meteor and calls the police. Inspector Bardo is sent to the scene to investigate. The small Lawton police department is short-handed, as it is the night of the high school prom. Arriving at a desolate forest road miles out of town, Bardo discovers that Jenkins has been infected by the alien organism. The officer is savagely attacked and infected. Both men head towards Lawton, terrorizing and contaminating everyone they encounter. Meanwhile, Cheryl and Timmy have left the prom and are parked atop Lover's Lane. Bardo comes upon the lovebirds and attacks them, infecting Timmy. Now Cheryl must run for her life through the pitch-black forest, escaping her pursuers and trying to reach the authorities before the infection spreads to L.A.",en,https://image.tmdb.org/t/p/w500/6mEmhon5P1UfKOHGn07z8zlbeK1.jpg,3.875,Albert Pyun,Filmwerks
A Dog's Dream,2005,14,"During a strange night, a prostitute, an opera singer, a fortune teller, a travel agent, a police chief and an insomniac meet by chance.",el,https://image.tmdb.org/t/p/w500/qXjMX5ivro4lk0KdyTszV3pClBt.jpg,4.1,Angelos Frantzis,"Max Productions, CL Productions, Greek Film Centre"
Piano 17,2006,"28, 35, 80","A man is hired to place a bomb inside a high-rise building to destroy some compromising documents, but he gets stuck in the elevator with two unaware workers, while the timer on the bomb keeps ticking.",it,https://image.tmdb.org/t/p/w500/7USynWsOzXW0OOOtzMZMxtvUdFN.jpg,5.9,Antonio Manetti,"Moviemax, Gamp Produzioni"
Magic Mirror,2006,18,"Luciano, fresh out of jail, was taken by his brother, Flórido, to serve in the home of wealthy Alfreda. He was surprised when she told him that her greatest desire was to see the Virgin Mary. Now comes this rich land owner with her sublime pretensions. Isn't it enough for her to have an Aston Martin and a Jaguar in the garage and ten different dresses per season? It was all professor Heschel's fault. Or someone else's. Anyway, to go beyond the promise is heresy. Alfreda said that she wouldn't rest until she saw the Virgin and made her some questions. Filipe Quinta, the Forger, says he has a solution. Meanwhile, Bahia, her husband, listens do music.",pt,https://image.tmdb.org/t/p/w500/mh5Fe3VE7Wi01of4p4ZLTgr5PcN.jpg,6.4,Manoel de Oliveira,Filbox Produções
Four Weeks in June,2005,18,"Sandra comes to a new town after being convicted of assault after a fight with her boyfriend. She moves into an apartment where her 80-year old neighbor, Lilly, becomes her friend. But Lilly’s life is based on a lie, and as their friendship grows Sandra gets to know more of Lilly’s secrets.",sv,https://image.tmdb.org/t/p/w500/fkhaXLFZmpg5U1v9ROVTpcYfdGw.jpg,6.2,Henry Meyer,HOBAB
Homesick,2005,18,"17-year-old Sami has an accident which resulted in him reluctantly sent to closed psychiatric hospital. Sami refuses to speak or show his feelings, even when the nurse Taneli is trying everything in order to understand how the crash really happened. While Sami's and his roommate's Rude's eccentric friendships gradually increases, the truth of past events begin to unravel.",fi,https://image.tmdb.org/t/p/w500/AmUEGRbp658I7k1i4XdgIFSUNkQ.jpg,4.7,Petri Kotwica,Making Movies
Scrap Heaven,2005,"18, 53","The lives of a young cop, a sanitation worker and a brooding pharmacist violently intersect on a bus that's hijacked by a suicidal political flunky, then cross paths again months later.",ja,https://image.tmdb.org/t/p/w500/2rQrLxryhr17WAuMNHomU09J9a6.jpg,7,Lee Sang-il,Bandai Visual
Il silenzio dell'allodola,2005,18,,it,N/A,5,David Ballerini,
Telma demain,2005,18,"Telma, twelve years old, is passionate about literature. She assiduously prepares a competition for budding writers. But her mother has other ambitions for her. Telma and her mother clash...",fr,https://image.tmdb.org/t/p/w500/zp7PWx2ttLd3AGhbXfzLVnlHwCa.jpg,0,Anna da Palma,
Thunder and Hurricane,2005,,"This comedy follows the adventures of two simple-minded cousins, Rufus and Silas, who are hoping to escape their less-than-average existence by moonlighting as 'superheroes.' They believe the power rings they purchase from a shady pawnshop salesman are their one shot at becoming somebody. 'Thunder' and 'Hurricane,' Rufus and Silas' alter egos, quickly set off for superhero-dom only to fail at their several heroic attempts. However, their fate seems to change when they meet a self-proclaimed, retired superhero who offers to train them to become the heroes they long to be. It isn't long until their newly acquired training is put to the test when they find themselves mixed up in a crime spree that plagues the town. Through turmoil, romance, deception, and imprisonment, Rufus and Silas are in for the ride of their lives.",en,https://image.tmdb.org/t/p/w500/hgQRJIV1s8NjWxu6D08eAjIRaGF.jpg,0,N/A,
The Torturer,2005,"53, 27","The gorgeous young actress Ginette auditions for the lead role in the first long feature film of the controversial artist Alex Sherba and she's almost immediately submitted to a long series of harassing questions and indecent proposals. Alex quickly turns out to be a mentally unstable and potentially dangerous man, and when she finds an earring belonging to a missing friend of hers, Ginette even suspects that he might be a killer and starts her very own private investigation. Meanwhile, the torturing of other poor girls cheerfully continues in the dungeon of Alex' parental house.",it,https://image.tmdb.org/t/p/w500/ww2NXW118wp8d1P1VUAnas3VJFW.jpg,3.8,Lamberto Bava,"Dania Film, Due P.T. Cinematografica S.r.l., Surf Film"
Remote Area,2005,99,"""Remote Area"" is a ""Heimatfilm"" about a strange world in front of our own doorstep. Only 20 minutes away from the Cologne Cathedral into the foothills by tram – one of those areas you drive through in order to spend some time somewhere else. Squeezed in between Cologne and Bonn, neither urban nor rural – unsightly, faceless, arbitrary.",de,https://image.tmdb.org/t/p/w500/cnjNgh1yAT3bxpX8ehQrcPg8ONY.jpg,7,Alexandra Sell,"ZDF, 2Pilots Filmproduction"
Attentive,2005,18,"Before leaving to settle abroad, Ahmad accepts one last job. He must audition actors for the new National Palestinian Theatre. On the road with interviewer Bissan and her cameraman Loumir, Ahmad goes in search of talent in the numerous refugee camps of Jordan, Syria and Lebanon. Hopefully for the last time, Ahmad experiences the insurmountable difficulties of life in Palestine: harassing searches at check points and borders, barricades, constant tension. He realizes the destiny of all waiting refugees is much the same as his own. He ends up guiding the auditioning actors into dramatizing what best embodies their destiny. But with the chance to catch his plane at risk, Ahmad could see the opportunity for his long-awaited exile slip away.",ar,https://image.tmdb.org/t/p/w500/hnIpJ9Xll7dimMCOrvQTZJGWzm3.jpg,0,Rashid Masharawi,"Silkroad Production, ARTE"
"The Rough River, the Placid Sea",2004,18,"A modern parable about three brothers whom life has divided as they each went their separate ways. Of their happy childhood and adolescent years together, only a black-and-white photograph remains, capturing the three young men at a table in front of their family home, and memories of the greenhouse that was their father's pride.",ru,https://image.tmdb.org/t/p/w500/4IJlv54hRzzhrfmppzDULptIWhP.jpg,0,Marat Sarulu,
Love Me Tomorrow,2005,"35, 18, 10749","Three years have passed since Elling moved to town together with Kjell Bjarne, his roommate from the institution at Brøynes. Elling now lives on his own in the apartment. Kjell Bjarne has moved up one floor, to Reidun and her little daughter Mojo. Elling feels like an outsider, and he isolates himself more and more. He observes humankind with astonishment, and wonders at how everyone else seems to be adjusting so well. Finally, Kjell Bjarne takes care of the situation. Elling protests, but he is still pretty happy as he is transformed into a new man, clean, fully rested and well dressed. Deep inside, he also knows what's lacking, and one evening he finally finds the woman he knows is able to fill the void in his life. He's willing to do anything to win her trust and conquer her love. But when he is invited home to his new girlfriend for dinner, a few objections appear to Elling, and the story doesn't end quite the way he had thought it would.",no,https://image.tmdb.org/t/p/w500/6tXmNkuZP73LLCaGBhLJefWu616.jpg,6.7,Petter Næss,
The Fatalist,2005,18,"The complex relationship between master and servant is explored in director João Botelho's adaptation of Denis Diderot's popular novel Jacques le Fataliste et Son Maître. As Tiago (Rogério Samora) drives his master (André Gomes) through the Portuguese countryside to an unspecified destination, the traveling pair embark on a series of highly philosophical discussions. Flowing with tales of his life in the military and previous sexual escapades, Tiago trades a series of tales with his rapt passenger, including the story of a vengeful spurned lover who plots revenge on the nobleman who rejected her by transforming a prostitute into a society lady and convincing him to marry the tainted bride.",pt,https://image.tmdb.org/t/p/w500/zCsbX1HW49VZW6XHu8IjArgZ3PB.jpg,3.6,João Botelho,"Instituto do Cinema, Audiovisual e Multimédia, Madragoa Filmes, Gemini Films"
Johanna,2005,18,"Johanna, a young drug addict, falls into a deep coma after an accident. Doctors miraculously manage to save her from death's doorstep. Touched by grace, Johanna cures patients by offering her body. The head doctor is frustrated by her continued rejection of him and allies himself with the outraged hospital authorities. They wage war against her but the grateful patients join forces to protect her. This is a filmic and musical interpretation of the Passion of Joan of Arc.",hu,https://image.tmdb.org/t/p/w500/jVFb2uQnbg8dsBgCl4sRPCuFP5c.jpg,4.6,Kornél Mundruczó,"Proton Cinema, TT Filmmûhely, Coproduction Office"
The Kukumi,2005,"35, 18","Story happens in the first days after NATO troops enter Kosova. After the signing of the military agreement in Kumanovo, in the house of the retarded, the guards and employees leave their places and flee. Inmates are all retarded but they have a special philosophy of life, they have their wishes and their dreams. Being free gives them a chance to make dreams come true, but they are confronted with a reality and environment, which in one way or another is very different. From the moment of getting out the fences, they are conflicted with people that call themselves free. Gradually this conflict roughens and with it degenerates the meaning of freedom. There are three main characters, Kukum, Mara and Hasan.",sq,https://image.tmdb.org/t/p/w500/ioHdpRuhafdbaZhbbzCjP3JjLf8.jpg,5.2,Isa Qosja,Kosovo Film
Persona non grata,2005,18,A Polish ambassador (Zbigniew Zapasiewicz) finds his life falling into ruin following the death of his wife.,pl,https://image.tmdb.org/t/p/w500/3x45U4HIymPb8rF5fiw9yMqca7I.jpg,4.8,Krzysztof Zanussi,"Canal+, Agencja Produkcji Filmowej, Istituto Luce Cinecittà, sintra S.R.L, Studio Trite, Studio Filmowe Tor"
"Sleep Sweet, My Darling",2005,"35, 18","""Sleep Sweet, My Darling"" shows a bittersweet coming of age of  Tomica Skrinjar, starting at the tail end of World War II in 1945.",hr,https://image.tmdb.org/t/p/w500/sN5DHzmKjCnwZ9ns2cADCNilZOQ.jpg,6.3,Hrvoje Hitrec,Hrvatska Radiotelevizija
Giuliani Time,2006,99,A documentary that investigates the 'new' New York City that then-Mayor Rudy Giuliani claimed he helped create.,en,N/A,6.3,Kevin Keating,
Die große Depression,2005,"35, 99",,de,https://image.tmdb.org/t/p/w500/baMre5c6MdC2APUdj4G3NHz6o36.jpg,0,Konstantin Faigle,
Happy End.,2005,"27, 18","""Happy End"" is about a young writer who moves into an old suburban house because of his writing blockade. He wants to start a new life there. Searching for the right story for his new novel, he discovers a well secured secret in which his strange neighbors and the preceding tenant are involved. Joana, the little daughter who died in a car accident 7 years ago, seems to play an important role in this mystery. In the end, everything turns out different from what he expected.",de,https://image.tmdb.org/t/p/w500/9H2o4Z7FDelDj2eMMJXRNyD9s84.jpg,5.4,Daniel Stieglitz,"Ich kann nicht fliegen Bilder, Kunsthochschule Kassel"
Hell to Pay,2005,37,"Ten legendary Western stars are reunited in this action-packed tale of brothers at odds-one a decorated soldier and reluctant hero, the other a gambler who keeps company with card sharks and corrupt women-in a small mining town torn apart by civil war. When they fall for the same woman, the brothers become divided; and one man is left to face a band of ruthless killers on his own. A tribute to the great American Western, Hell to Pay is a gritty and mesmerizing tale of love, honor, duty, treachery and betrayal.",en,https://image.tmdb.org/t/p/w500/gatJjo8lFTFZzY2rGbs7m3jRnHG.jpg,6.3,Chris McIntyre,HTP Productions
Manhater,2005,27,"Vonda Madding has a history of bad relationships with men. The last man she married abused her and that was the last straw - she swore all men were scum. But what can she do? Eileen Trost has the answer: a witch's potion to free Vonda of her hateful thoughts and make her forget them once and for all. Suddenly her ex-boyfriends are being murdered and the police's only suspect is Vonda. But they don't know about Enyo, and they won't believe what is really happening...",en,https://image.tmdb.org/t/p/w500/evlXi2YJ3GKCKyp5x1MVzufnxkl.jpg,6,Anthony Doublin,
Meet The Family,2005,35,"An African-American family sits down for supper and all hell breaks loose in this independent comedy. Humphrey Rump (Clent Bowers) has told his parents (Beau Billingslea and Marilyn Sue Perry) that he's bringing someone special over for Sunday dinner at their place, hoping to introduce them to his fiancée Lacy (Jennifer Alden) under calm and quiet circumstances. However, when he arrives, Humphrey discovers that's hardly how the evening is going to play out -- his folks decided to also invite his brother Darnell (Donn Carl Harper), sister Eve (Alisa Banks), their grandparents (John Gipsun and Sheridan French) and a handful of cousins and other distant relations. The Rump Family doesn't get along especially well in large groups, and Humphrey and his girl are mortified by the non-stop arguing, insults and off-color ranting. Meanwhile, most of the family is a bit taken aback to discover that Lacy is pretty, polite...and white.",en,N/A,2,Stan Lerner,
Nordstadt,2005,18,,de,https://image.tmdb.org/t/p/w500/lzukNXNAnvdmDJ90rjPTnfLVbqp.jpg,0,Michael Kupczyk,
Wal-Mart: The High Cost of Low Price,2005,99,"This documentary takes the viewer on a deeply personal journey into the everyday lives of families struggling to fight Goliath. From a family business owner in the Midwest to a preacher in California, from workers in Florida to a poet in Mexico, dozens of film crews on three continents bring the intensely personal stories of an assault on families and American values.",en,https://image.tmdb.org/t/p/w500/6PYx4HEbczd9QUCex5Wspkhjef5.jpg,6.2,Robert Greenwald,Brave New Films
