Title,Year,Genre,Plot,Language,Poster,IMDBRating,Director,Production,Error
Sunshine Cleaning,2008,"35, 18",A single mother and her slacker sister find an unexpected way to turn their lives around in this off-beat dramatic comedy. In order to raise the tuition to send her young son to private school the mom starts an unusual business – a biohazard removal/crime scene clean-up service.,en,https://image.tmdb.org/t/p/w500/zpS6aIqBTGLKvpFshmSuegv5JDt.jpg,6.598,Christine Jeffs,"Overture Films, Back Lot Pictures, Big Beach",
Bastardi,2008,18,"The families Iuvara and Patene are bound by a common inherited hatred, which is further deepened when young Luke accidentically kills his rival Alexander during a motorace. To avoid revenge, the Iuvaras are forced to steal on behalf of their ancient rivals.",it,https://image.tmdb.org/t/p/w500/lA634ZGikKBDw8TI9fG0jjEggOQ.jpg,0,Andres Alce Meldonado,,
The Duchess,2008,"18, 36, 10749","A chronicle of the life of 18th century aristocrat Georgiana, Duchess of Devonshire, who was reviled for her extravagant political and personal life.",en,https://image.tmdb.org/t/p/w500/u56HFt8ILqQ3MjafFxC3Y1w7YcU.jpg,6.998,Saul Dibb,"Pathé Renn Productions, BBC Film, BIM Distribuzione, Qwerty Films, Magnolia Mae Films",
The Black Balloon,2008,18,"Thomas is turning 16. His dad's in the army and they've just moved to a town in New South Wales; his mom is pregnant; his older brother, Charlie, who's autistic, has his own adolescent sexual issues. Thomas finds Charlie an embarrassment in public, so when Thomas is attracted to Jackie, a girl in his swim class, Charlie presents any number of obstacles when she drops by their house, when the three of them go for a walk, and during a family birthday dinner. Can Thomas find a way to enter the world of teen romance and still be his brother's keeper, or is Charlie's disability going to prove more than Thomas can handle?",en,https://image.tmdb.org/t/p/w500/3D0PF1xpZHfyO3787TP6KS24Cme.jpg,6.488,Elissa Down,"Black Balloon Productions, Icon Entertainment International",
The Informers,2008,"18, 80, 53","A collection of intersecting short stories set in early 1980s Los Angeles, depicts a week in the lives of an assortment of socially alienated, mainly well-off characters who numb their sense of emptiness with casual sex, violence, and drugs.",en,https://image.tmdb.org/t/p/w500/uGwQKdQXVOj15gKCaa2sw3k5Rdd.jpg,4.8,Gregor Jordan,Senator Entertainment,
The Forbidden Kingdom,2008,"28, 12, 14","An American teenager who is obsessed with Hong Kong cinema and kung-fu classics makes an extraordinary discovery in a Chinatown pawnshop: the legendary stick weapon of the Chinese sage and warrior, the Monkey King. With the lost relic in hand, the teenager unexpectedly finds himself travelling back to ancient China to join a crew of warriors from martial arts lore on a dangerous quest to free the imprisoned Monkey King.",zh,https://image.tmdb.org/t/p/w500/mkrwLBAFHwLnQF8qdhCH0VOQqff.jpg,6.6,Rob Minkoff,"Casey Silver Productions, China Film Co-Production Corp., Relativity Media, Lionsgate, The Weinstein Company, Arclight Films, Huayi Brothers Pictures, J&J Project, Salon Films",
Hotel California,2008,"28, 53","When TROY turned on crime boss DMITRI DEBARTOLLA he was forced to leave Los Angeles and lay low in Miami. After two years, and the loss of his leg in a shootout with a Cuban crime syndicate, Troy returns to LA to reclaim what is rightfully his. A reunion with his former partners in a rundown hotel sets the stage for an explosive encounter where past and present collide.",en,https://image.tmdb.org/t/p/w500/vm5YBS7ShjdN6qecB8Y15tlScSQ.jpg,6.3,Geo Santini,,
Made of Honor,2008,"35, 10749","Tom and Hannah have been platonic friends for 10 years. He's a serial dater, while she wants marriage but hasn't found Mr. Right. Just as Tom is starting to think that he is relationship material after all, Hannah gets engaged. When she asks Tom to be her 'maid' of honor, he reluctantly agrees just so he can attempt to stop the wedding and woo her.",en,https://image.tmdb.org/t/p/w500/pDg8D0jNqmz7RbCBgblWvmPswHE.jpg,6.447,Paul Weiland,"Columbia Pictures, Original Film",
Aakasha Gopuram,2008,"18, 10749","The film, in Malayalam and made by the Indian film maker K P Kumaran, AkashaGopuram is set among the Indian immigrant community in London and tells the story of Albert Samson (Mohanlal), a middle-aged architect who has clawed his way to prominence.",ml,https://image.tmdb.org/t/p/w500/4AQemYYJujGbFKsmUj9tkjNVtIc.jpg,0,K. P. Kumaran,,
Childless,2015,,"Katherine is a typical teenager. Today's her funeral. The four adults in her life have a lot on their mind - and it's not all about Katherine either. With a frankness that's strikingly disarming as well as frequently self-serving, the grown-ups struggle with being... well... grown-up.",en,https://image.tmdb.org/t/p/w500/A3xnS8K4II7puaFO8Cwc5MubuRU.jpg,4.5,Charlie Levi,,
Chile Can Do It,2008,"35, 878",The businessman who sends the first Chilean astronaut into outer space can't quite come up with the money to bring the adventurer back.,es,https://image.tmdb.org/t/p/w500/llN5FGKzxdXZVaW1Po9eQ3Cgy17.jpg,4.3,Ricardo Larraín,,
From a Place of Darkness,2008,"18, 53, 27","Miles Kody, is a documentary filmmaker. As Miles tapes his interviews with Vic he becomes aware of the appearance of ""ghosts"" captured on his video monitor. He realizes that the faint energy fields of these ghosts, past victims of the snuff films, are picked up more readily on video...",en,https://image.tmdb.org/t/p/w500/tWnBODNNrUq07ZYPeAq1NdfNPyd.jpg,2,Douglas A. Raine,"Vic's Flicks, PDP Productions",
The Human Trace,2008,53,"Over the last year, a series of grisly murders has plagued the small town of Solace. Investigators are baffled because no cause of death can be determined. Local law enforcement is under suspicion and county detective Kyle Fishburn is sent undercover to find the killer. Investigator uncovers a frightening twist when he realizes that the murders are not your garden variety homicides.",en,https://image.tmdb.org/t/p/w500/lhVWQBBKs3W8lD9iIfUZRxOQqmz.jpg,0,Jason Satterlund,Big Puddle Films,
Jolene,2010,18,A teenage orphan spends ten years traveling to experience life.,en,https://image.tmdb.org/t/p/w500/5udqbFUVTzevHpDkel4CElpNEBR.jpg,6.2,Dan Ireland,Next Turn Productions,
Ranchero,2008,18,A former ranch hand  confronts the realities of drug addiction and runs afoul of a local gangster after he moves to Los Angeles.,en,https://image.tmdb.org/t/p/w500/pEN7EwDkS6tkQi2ft7Ze33v2ttD.jpg,3.8,Richard Kaponas,,
Unnatural Causes,2008,53,"A dramatic thriller about a couple who own an advertising agency. The husband apparently commits suicide, but the police and the insurance company decide to investigate his death.",en,https://image.tmdb.org/t/p/w500/zJZAeN0abqYyv0hiypN7RQWb7V6.jpg,4.7,Robert Malenfant,Drimtim Entertainment,
Smother,2008,"35, 18, 10749","After he's fired from his job, an everyday guy faces pressure from his wife to have a baby and from his mom, who has decided to move in with the young couple.",en,https://image.tmdb.org/t/p/w500/2vLLJG71kmrCcTbnIztn13NHKZF.jpg,5,Vince Di Meglio,Carsey-Werner Company,
Paris,2008,18,"Pierre, a professional dancer, suffers from a serious heart disease. While he is waiting for a transplant which may (or may not) save his life, he has nothing better to do than look at the people around him, from the balcony of his Paris apartment.",fr,https://image.tmdb.org/t/p/w500/bcJAgm2N0FW0PkCew9A1yv8r6zF.jpg,6.48,Cédric Klapisch,"Ce Qui Me Meut Motion Pictures, France 2 Cinéma, TPS Star, StudioCanal Image, Uni Etoile 4, Canal+, StudioCanal",
Ciao,2008,"18, 10749",A man learns that his late friend had a secret online lover who is on the way from Italy.,en,https://image.tmdb.org/t/p/w500/pvmEaE0lzlLqMpAXVLOGaf5rLX5.jpg,5.6,Yen Tan,,
The Dark Horse,2008,"10751, 18","The Dark Horse is a story of struggle and redemption. Dana, a ballet teacher, reluctantly returns to her childhood home to discover it is about to be sold. To save the farm, and the family, she must tame her mother's dangerous black horse, and ride him to victory in the year's biggest dressage competition.",en,https://image.tmdb.org/t/p/w500/pWpEKopZkM2VSTuyi0kaSswdo49.jpg,8.3,Cornelia Moore,Kairos Productions,
Frost/Nixon,2008,"18, 36","For three years after being forced from office, Nixon remained silent. But in summer 1977, the steely, cunning former commander-in-chief agreed to sit for one all-inclusive interview to confront the questions of his time in office and the Watergate scandal that ended his presidency. Nixon surprised everyone in selecting Frost as his televised confessor, intending to easily outfox the breezy British showman and secure a place in the hearts and minds of Americans. Likewise, Frost's team harboured doubts about their boss's ability to hold his own. But as the cameras rolled, a charged battle of wits resulted.",en,https://image.tmdb.org/t/p/w500/nLrRrHZQ40tWqLTY3kxgS4x7GUw.jpg,7.28,Ron Howard,"Universal Pictures, Imagine Entertainment, Working Title Films, StudioCanal, Relativity Media",
Harrison Montgomery,2008,18,"In a rundown apartment complex in San Francisco's Tenderloin, a septuagenarian seer is waiting for his final message. For decades the eccentric recluse has chronicled the phrases of the Wheel of Fortune and deciphered their hidden meaning - the details of a mission to save his neighbors from their troubles.",en,https://image.tmdb.org/t/p/w500/nx5gAaeFDw7WkybkuKLVwLBGXmw.jpg,5,Daniel Dávila,"Momentum, Divisadero Pictures",
Humboldt County,2008,"35, 18","Peter is a medical student about to graduate and begin his residency. When his professor fails him, he winds up in bed with an actress and singer named Bogart rolling through Los Angeles. He accompanies her to the redwoods of northern California, where he encounters her eccentric family of pot farmers. But when Bogart runs away without a word, Peter is thrust into the picturesque and bizarre world.",en,https://image.tmdb.org/t/p/w500/o5x5YXmXOtW9Kk9FH9MNbdEIfq5.jpg,5.5,Danny Jacobs,Embark Productions,
October Moon 2: November Son,2008,"27, 53","Two years after their loved ones were murdered in obsessive rage, the survivors are dragged into a horrific psychological breakdown - and blood soaked plan for revenge.",en,https://image.tmdb.org/t/p/w500/d1CbI0SYrc1CDKvs6sgsNQYYaRc.jpg,3.3,Jason Paul Collum,,
Boot Camp,2008,"18, 53",A group of troubled teens are sent to a rehabilitation program housed in a remote camp on the island of Fiji. What their parents believe is a state-of-the-art deluxe institution in a beautiful natural environment turns out to be a prison-like boot camp where they are abused and brainwashed.,en,https://image.tmdb.org/t/p/w500/rSAIVxNJGRGcfvnzUzsL2VZJL7g.jpg,5.953,Christian Duguay,"CD Films, Edgey Productions",
The Caretaker,2008,27,"A group of teenage boys out to give their girlfriends a good scare on Homecoming night, which also happens to be Halloween, head to an abandoned house in an out-of-the-way fruit orchard where they uncover the story of a real life urban legend.",en,https://image.tmdb.org/t/p/w500/cGZ6YrzeVp1GWVPE78kGAkcsJf5.jpg,4.7,Bryce Olson,Turkey Ranch Productions,
Baby Mama,2008,"35, 10749","A successful, single businesswoman who dreams of having a baby discovers she is infertile and hires a working class woman to be her unlikely surrogate.",en,https://image.tmdb.org/t/p/w500/xZOwucsL5NInPyFcmqJzytHkaJR.jpg,5.9,Michael McCullers,"Relativity Media, Michaels-Goldwyn, Universal Pictures",
Ocean of Pearls,2008,18,"As a Sikh man with a full beard and turban, AMRIT SINGH is often the target of racial profiling. But when he sees his dreams of becoming Chief of Surgery at a state-of-the-art transplant center dwindle because of his appearance, Amrit goes against a tradition he's maintained his whole life and cuts his hair. Hiding this decision from his girlfriend and family in Toronto is only the start of a series of compromises Amrit finds himself making as he deals with hospital politics and health care injustices. When his compromises result in the death of a patient, Amrit begins to reexamine the value of the religious traditions he'd turned his back on.",en,https://image.tmdb.org/t/p/w500/6a3O91Vv64X75Y0CTaupJ2bicDo.jpg,4.9,Sarab Neelam,"Light Post Pictures, Ocean of Pearls, White Hill Production",
Off and Running,2008,35,,fr,https://image.tmdb.org/t/p/w500/lkv0vO6c5Qlf3TT8xkuiSfE9UCp.jpg,5.4,Tonie Marshall,,
I Can See You,2008,"27, 53","Three young ad-men enter the woods for a photo shoot, but a girlfriend's mysterious disappearance sparks a harrowing descent into unreality.",en,https://image.tmdb.org/t/p/w500/wdFWLR57df9jmsD0pDItgQpdRHz.jpg,4.6,Graham Reznick,Glass Eye Pix,
Better Things,2008,18,"Gail's agoraphobia keeps her inside where she escapes into romance novels. She shares a house with her Nan, recently back from the hospital. Gradually, they both try to reach out to each other to break their isolation. Rob plunges further into his addiction as a way of numbing his heartbreak over the death of his girlfriend. In his stupor, he dreams of embracing her again. Mr & Mrs Gladwin are going through a shift in their 60 year relationship. Years of resentment and unspoken truths have built a barrier between them that Mrs Gladwin, in her abiding love, tries to erode in little gestures.",en,https://image.tmdb.org/t/p/w500/51WVxWtbD8DApOIvN2CufbqCA42.jpg,5,Duane Hopkins,"Third Films, Wellington Films, Flying Moon Filmproduktion GmbH, EM Media, UK Film Council, Film4",
The Devil's Dominoes,2008,53,"On their way to a weekend hunting trip in the Ozarks, four friends get in to a car accident, killing the driver of the other car...",en,N/A,3.8,Scott Prestin,,
The Rimshop,2008,35,Joe Joe has just opened up his very own rim shop and things are going well until an evil loan shark comes to collect an old debt. With no money in the bank Joe Joe has 24 hours to come up with the cash or he loses everything.,en,https://image.tmdb.org/t/p/w500/1UmREFSld2pWs8hg5On1EtnjQPa.jpg,2,Francis G. Pinnock,"Films In Motion, HK Pictures, Most Wanted Films",
Salute,2008,99,"The black power salute by Tommie Smith and John Carlos at the 1968 Mexico Olympics was an iconic moment in the US civil rights struggle. Far less known is the part in that episode in history played by Peter Norman, the white Australian on the podium who had run second — and the price paid afterward by all three athletes.",en,https://image.tmdb.org/t/p/w500/rUOdTezDkhW03MyPxhdH98Rwf5q.jpg,6.6,Matt Norman,"Wingman Pictures, The Actors Cafe, Instinct Entertainment, Film Victoria, Australian Film Finance Corporation",
Pretty Ugly People,2008,35,"Lucy has always used food to escape life's problems, but when this self-titled ""fat friend"" lures her group of old college buddies to the Montana wilderness, she reveals a new self - skinny, beautiful and still flawed.",en,https://image.tmdb.org/t/p/w500/togHIE3Bs2alz7CNt8o7x1QVXGz.jpg,4.329,Tate Taylor,Harbinger Pictures,
The Plex,2008,,"AJ lives an unsatisfactory life as an usher at the local Multiplex Cinema working along side his best friend Zeke and his sexy, but power hungry girlfriend Katie. After AJ is unfairly fired he decides to get even with his old boss.",en,https://image.tmdb.org/t/p/w500/qfS7Isb6eeGywJBtnQb5RqwsCKe.jpg,0,N/A,,
Public Interest,N/A,,"A struggling television network is about to go under. A down-on-his-luck film director (Robert Curtis-Brown, Trading Places, It's Complicated) has an idea for ""the reality show to end all reality shows."" It seems like the perfect match. With nothing to lose, they set out together to change television. Public Interest chronicles the high hopes and low blows of making a reality TV show that no one was ready for.",en,N/A,4,N/A,,
Tiramisu,2008,"18, 9648","Bookkeeper Jacob newest client is the talented and flamboyant actress Anne. They first meet each other on her houseboat, the morning after the premiere of Anne's new theatrical play. Anne has made a mess of her personal finances and she has a lot of debt. So much so that she may even have to sell her houseboat. Jacob does what he can to help her.",nl,https://image.tmdb.org/t/p/w500/ikE45rOzA3ocKhcH5hCXqJAFTO.jpg,5.2,Paula van der Oest,Motel Films,
Lake City,2008,"28, 18","In this searing Southern drama, a mother and son reunite under desperate circumstances years after a family tragedy drove them far apart.",en,https://image.tmdb.org/t/p/w500/afePgaBmJsrJHABKu1Qv8uPdDBA.jpg,5.7,Hunter Hill,"Lake City Productions, Mark Johnson Productions",
The Last Word,2008,"18, 10749","An odd-but-gifted poet, Evan Merck makes his living writing suicide notes for the soon-to-be departed. So when he meets Charlotte, the free-spirited sister of his latest client, Evan has no choice but to lie about his relationship to her late, lamented brother.",en,https://image.tmdb.org/t/p/w500/2Aou5FwwTlMhiS63J49vcOoVCwv.jpg,5.9,Geoffrey Haley,"Dreamz, Deviant Films",
Ponyo,2008,"16, 14, 10751","When Sosuke, a young boy who lives on a clifftop overlooking the sea, rescues a stranded goldfish named Ponyo, he discovers more than he bargained for. Ponyo is a curious, energetic young creature who yearns to be human, but even as she causes chaos around the house, her father, a powerful sorcerer, schemes to return Ponyo to the sea.",ja,https://image.tmdb.org/t/p/w500/yp8vEZflGynlEylxEesbYasc06i.jpg,7.7,Hayao Miyazaki,"Studio Ghibli, TOHO, Nippon Television Network Corporation, dentsu, Hakuhodo DY Media Partners, The Walt Disney Company (Japan), Mitsubishi",
Give Me Your Hand,2008,18,"Quentin and Antoine are 18-year-old twins. Without their father knowing it, they set out on a voyage to Spain, where their mother's funeral is to take place. The two brothers barely knew their mother. Their hitchhiking journey is full of encounters, arguments, reconciliations, and experiences. Their time on the road also reveals their differences, the splits in their attractions, and the confusion of their feelings.",fr,https://image.tmdb.org/t/p/w500/fBL3fM71XvzfYH3jCMS3aQXIbvb.jpg,5.8,Pascal-Alex Vincent,"Local Films, Adam Productions",
Bad Day,2008,"80, 53","Rebecca Ryan has been working as an undercover agent for the Organised Crime Division (OCD) posing as a taxi driver, while investigating London's south-side mob. When she finds her young daughter Lynn brutally murdered she fears her cover has been blown wide open, so she turns renegade and begins a brutal campaign of vengeance against the mob she believes killed her daughter. As she trawls the seedy depths of London's underworld hunting down her daughter's killers, the lines between good and evil, right and wrong begin to blur as do her notions of justice and revenge. It falls to the world-weary OCD agent Darius Cuise and his newly-assigned, hot-tempered partner Abby Barrett to track down Rebecca and bring her in before all hell breaks loose.",en,https://image.tmdb.org/t/p/w500/gQLM19Uh8zXSWNSrLJwYlG3RQMd.jpg,5.2,Ian David Diaz,"Centre Media, Planet Matters",
"New Orleans, Mon Amour",2008,18,"One year after Hurricane Katrina, troubles arise for a surgeon who, despite remarrying his ex-wife and starting his life anew, becomes reacquainted with an former girlfriend.",en,N/A,10,Michael Almereyda,,
Red Zora,2008,"12, 18, 10751","In this sun soaked adventure for the entire family, a group of five orphaned children form their own makeshift family while attempting to operate outside the rules of society. Though they must sometimes steal to survive, their loyalty to one another means that they will always have a brother or sister to count on.",de,https://image.tmdb.org/t/p/w500/ktwIaGKMxqQ3Z7q8eRIgFdnlmMd.jpg,5.2,Peter Kahane,"Universal Pictures Germany, Studio Hamburg, FilmFörderung Hamburg, NDR",
Harm's Way,2008,53,"Darlene and her daughter Victoria seek refuge at a remote rural safe house for abused women that's run by the strict and tough, but folksy and supportive Bea. Things turn sour when Bea proves to be a total lunatic with an especially dangerous influence on the impressionable Victoria.",en,https://image.tmdb.org/t/p/w500/2NYvX8PbL9B8EJqymqHcPcYDUIb.jpg,5.1,Melanie Orr,,
The Higher Force,2008,"28, 35","Ashamed for being a debt-collecting thug, David believes that he is an ugly duckling waiting to become a swan. Through an unlikely mentor he finds out that life has indeed something very special in store for him.",is,https://image.tmdb.org/t/p/w500/wWIu3sve9FsPoScjN8q0m8zmIPd.jpg,5.6,Olaf de Fleur Johannesson,Visit Films,
Untraceable,2008,"53, 80, 9648, 18, 27","Special Agent Jennifer Marsh works in an elite division of the FBI dedicated to fighting cybercrime. She thinks she has seen it all, until a particularly sadistic criminal arises on the Internet. This tech-savvy killer posts live feeds of his crimes on his website; the more hits the site gets, the faster the victim dies. Marsh and her team must find the elusive killer before time runs out.",en,https://image.tmdb.org/t/p/w500/ySUwDRDEn01lKIMPQorpFCMLWqE.jpg,6.2,Gregory Hoblit,"Cohen/Pearl Productions, Screen Gems, Lakeshore Entertainment",
Shuttle,2008,"53, 80, 9648, 27","When two friends return from a girls weekend vacation in Mexico, they find themselves stranded at the airport. Trying to get home safely, they board an airport shuttle for the short trip. But once their feet cross the threshold of the shuttle, a night that had started like any other turns terrifying, and the ride home becomes a descent into darkness.",en,https://image.tmdb.org/t/p/w500/xZWYVT0YC5kDf6fetNAAifN1aAx.jpg,5.3,Edward Anderson,"Future Films, Moody Street Pictures, Pierce/Williams Entertainment, Zero Gravity Management, Fourth Wall Productions",
Modern Life,2008,99,"For ten years, Raymond Depardon has followed the lives of farmer living in the mountain ranges. He allows us to enter their farms with astounding naturalness. This moving film speaks, with great serenity, of our roots and of the future of the people who work on the land. This the last part of Depardon's triptych ""Profils paysans"" about what it is like to be a farmer today in an isolated highland area in France. ""La vie moderne"" examines what has become of the persons he has followed for ten years, while featuring younger people who try to farm or raise cattle or poultry, come hell or high water.",fr,https://image.tmdb.org/t/p/w500/h8IWYCY8fA1VclmjZghVQ3sZwsN.jpg,7.6,Raymond Depardon,"Palmeraie et Désert, France 2 Cinéma",
Looking for Palladin,2008,,"Brash young Hollywood talent agent Josh Ross (David Moscow) is dispatched to Guatemala, where he's assigned to locate missing star Jack Palladin (Ben Gazzara), a man Josh has never met but can't stand due to Palladin's long-ago relationship with his late mother. Despite receiving no help from the amused locals, Josh eventually finds his target hiding out as a cook at a restaurant but discovers that persuading the reluctant actor to return to Hollywood will be an uphill climb. Talia Shire costars in this independent comedy.",en,https://image.tmdb.org/t/p/w500/gTD0QF8S3cfuhTobZWjyNdAD21G.jpg,3.7,Andrzej Krakowski,,
"One, Two, Many",2008,35,A modern-day romance that follows one man's quest to find the girl of his dreams: one who wants to do it with him and another girl.,en,https://image.tmdb.org/t/p/w500/pRrz6Iub8b9cRxeYig1gNKQw5jr.jpg,3.8,Michael DeLorenzo,"Chapter 2 Productions, Digital Film Company",
Eavesdrop,2008,18,"Two chess players face off at a busy café, studying both the pieces on the board and the unfolding dramas at the neighboring tables. While a young couple fumbles through an uncomfortable blind date, a longtime marriage begins to crumble. Meanwhile, a pair of film noir fans suspect they're witnessing a real-life murder. This is an ensemble drama about conversations overheard in a bustling New York City bistro. With every whispered word, we gain a greater understanding of the big picture being formed all around us. From lovers' quarrels to artistic musings and hushed confessions, a crowded restaurant is the perfect place to discover just what strangers will say when they think no one else is listening.",en,https://image.tmdb.org/t/p/w500/1nhfmv0zxWXrcGogOS7CXjspxDh.jpg,5.8,Matthew Miele,,
The Golden Boys,2008,"35, 10749","Three retired sea captains living together in genteel squalor. They scheme to improve their fortunes by having one of them solicit a bride through an ad in a Boston newspaper. The loser of a coin toss must get married and take in the other two as boarders. But upon the arrival of the Nantucket woman selected from the applicants, the captains get cold feet.",en,https://image.tmdb.org/t/p/w500/pmMSvicemJfI9FKOshaWW2Fqzaq.jpg,5.6,Daniel Adams,,
Three Kingdoms: Resurrection of the Dragon,2008,"28, 36, 18","The aging Zhao embarks on his final and greatest campaign, a road to adventure that will crown his name in glory for all time.",cn,https://image.tmdb.org/t/p/w500/q3MTP7z1d5jEf3aUdMzrW0ww54W.jpg,6.2,Daniel Lee,"Visualizer Film Productions, Taewon Entertainment, Xian Longrui Film and TV Culture Media Co., Easternlight Films, Bona Film Group",
Dark Reel,2008,"27, 9648, 53","Murder, mystery and mayhem as B movie fan, Adam Waltz, wins Walk on Role in a film Featuring Scream Queen, Cassie Blue (Tiffany Shepis). Thinking his luck had changed for the better he steps into chaos with a killer loose and no one on the production safe.",en,https://image.tmdb.org/t/p/w500/hbUBoLDTNqT4EEL8hpo2jLEQYCW.jpg,3.8,Josh Eisenstadt,Dark Reel Productions,
Nora's Hair Salon II: A Cut Above,2008,35,Simone arrives in Los Angeles after inheriting her late aunt's hair salon where she soon clashes with the diva hairstylist who has her own ideas about the salon's future.,en,https://image.tmdb.org/t/p/w500/8Gs6P8TD3UOsebyNkKdZk8Cy3eg.jpg,6,Jill Maxcy,Nora's Hair Salon,
