Title,Year,Genre,Plot,Language,Poster,IMDBRating,Director,Production
The Sunflowers,2005,,"A folk singer comes into a dusty town, sits down and begins to sing about people. One song is about a man coming from far away to the town. At that moment, a man comes home from prison, through the sunflower fields. The folk singer and other town folks tell his story, talking to him of the past.",zh,N/A,0,Wang Baomin,
Save the Forest,2005,,"If you had the chance to save something you cherished, would you do it or just walk away? After discovering that their beloved local theater, the Forest, has been sold to make way for an obnoxious McMultiplex, an oddball group of protesters vows to preserve the cinema. While working together against powerful forces, they learn important lessons about life, about love and (unexpectedly) about sex. The cast includes Megan McNulty and Eben Gordon.",en,https://image.tmdb.org/t/p/w500/iPVf8WdQVQsDtke2NXwBG9sgye1.jpg,0,N/A,
Tired of Kissing Frogs,2006,"18, 35, 10749","A romantic comedy about a young interior decorator who, as a result of a romantic disappointment, becomes the female counterpart of Don Juan. The misadventures of the manizer make her rediscover the value of love.",es,https://image.tmdb.org/t/p/w500/Ao5ZnjodOiBcYicex6cw2b3vxLg.jpg,6.4,Jorge Colón,Miravista
Air: The Motion Picture,2005,"16, 10749, 14","A long time ago, a winged maiden was held prisoner in a castle - cursed never to experience love, lest she die. Centuries later, in a sleepy coastal town, a young girl relives this agony.",ja,https://image.tmdb.org/t/p/w500/869qSfiou8ZGBhOGrmAol48K9Vo.jpg,5.8,Osamu Dezaki,"Office Prion, P.R.O., Studio Aoi, Tabac, Visual Art's/Key, Frontier Works, Toei Animation"
Sunday Driver,2005,99,"An all-access documentary film of the people living the lifestyle and responsible for the artistry behind low riding - SUNDAY DRIVER is an incredible portrait of a community working together to build the ultimate customized vehicles while struggling to legitimize their lifestyle under close scrutiny of the cops. With an upfront look at the guys behind the chrome, SUNDAY DRIVER exposes the origins of the club by describing in interviews, what it really means to be a Majestic. Dedicated to creating a vision of the ultimate modified automobile, the Majestics come together like no other community to help each other realize their dreams.",en,https://image.tmdb.org/t/p/w500/xooHn56Wb2RqvtDoqmUhTpkenn2.jpg,7,N/A,Rockstar Games
Blue Hour,N/A,,"This sci-fi neo-noir thriller tracks the daunting experience of John, who comes to New York to visit his old friend Catfish. Catfish, threatened by intimidating gangsters, asks John to submit to medical experiments conducted by a mysterious Orwellian organization known as The Foundation. Put to sleep by a potion, he wakes up three days later with all memories erased. As he tries to solve the mystery of what happened to him, flashes of memory haunt him as he struggles to find out who he can and cannot trust.",en,N/A,0,N/A,
Emilia,2005,18,,de,https://image.tmdb.org/t/p/w500/4kAr96TvwoXTFChIGceDrK5D4Cq.jpg,7,Henrik Pfeifer,ARD
Tales of Terror: Haunted Apartment,2005,27,"Aimi and her father move into an old, apartment building and learn quickly that things are not as they seem.",ja,https://image.tmdb.org/t/p/w500/36CXLonKsO7Fkd6v2BMJwErpUjz.jpg,6.1,Akio Yoshida,
Machete,2006,,"Lucas Cano, (Machete) an ex-bodyguard for the Mexican President, tired of his life style, retires to a remote small town in Mexico, in hope of finding peace. But things do not work out for him the way he wants them to. First, he must confront several drug dealers who smuggle illegal immigrants into the United States, forcing them to smuggle drugs. Then, Machete finds out that his old Vietnam friend, who now works for the CIA in Arizona, has been assigned to arrest Machete, and take him back to the US for some old charges. Machete's health is deteriorating rapidly. He is constantly bleeding internally, but he won't stop drinking and smoking. Panchito is a little boy Machete met in a street fight, and the little boy, claiming not to have any family, decides to hang out with Machete and tries to help him change his life style. Machete does not know that a higher power is watching out for him.",en,N/A,6.75,Roman Hernández Cordova,
Millions of Cardinals Memories: Busch Stadium,2005,,"Architects made it nearly circular in design but Busch Memorial Stadium was in the end shaped by a 40-season adventure of championship teams record setting moments and the collective energy of millions of Cardinals fans. Busch was affectionately embraced as the heart of Cardinal Nation and it was where St. Louis and much of the Midwest spent their summers. After hosting its first game on May 12, 1966 Busch Stadium welcomed six World Series and eight National League Championship Series. It was the setting when some of baseball's most celebrated records fell and the stage for many of the Game's greatest players and personalities. We'll never pass through its turnstiles again but the magic and the memories preserved on this commemorative DVD will remain with us forever.",en,N/A,6.2,N/A,
unknown,2005,,"Nathan Holmes and his girlfriend Ashlee have the perfect life together - a storybook romance - but Nathan is a man possessed by intense and disturbing dreams. His psychiatrist, Dr. Cameron Graye, doesn't seem to be helping, and neither are Nathan's parents, who seem to be holding something back. As Nathan delves deeper into the unknown, he begins distancing himself from everyone, and as life continues to spiral out of control, the line between dreams and reality blurs and not even Nathan knows when he's awake or when he's dreaming.",en,https://image.tmdb.org/t/p/w500/62h5Wpos6znGnxKU9QqnMrnNwt.jpg,5,Nick Thompson,"Graye Horizon Pictures, CNGM Pictures, The Federation"
Kanda Naal Mudhal,2005,"10749, 35",Two youngsters meet in a marriage hall and fight with each other and thereafter every-time they meet they end up fighting with each other. But there comes a time when this animosity turns to love.,ta,https://image.tmdb.org/t/p/w500/9Y2rX9o01SCPU5bxi0yHhf9I5id.jpg,6,V. Priya,Duet Movies
Red Carpet,2005,35,"Quinzinho (Matheus Nachtergaele) has a promise to keep: to take his son, Neco (Vinicius Miranda), to the city to watch a Mazzaropi movie. They live in a small farm in São Paulo. In this odyssey through the towns of São Paulo, he also takes his wife Zulmira (Gorete Miracles), who goes unwillingly, and their donkey Policarpo. On their journey, they find regional peculiarities and undergo magical situations related to popular belief.",pt,https://image.tmdb.org/t/p/w500/zh8PPoN82hV73GOfwZ6LD14Q1zp.jpg,7.4,Luiz Alberto Pereira,
Matchmaker,2005,99,A young Jewish woman from Switzerland goes on a quest to find a kosher husband.,de,https://image.tmdb.org/t/p/w500/l0te65skt61JhZqaSqdDTSkfALF.jpg,0,Gabrielle Antosiewicz,
Dollars and Signs,N/A,,"In the great American city of Memphis, TN, three ""businessmen"" are struggling to succeed. Carlton has an image to maintain and a family to feed. Mike and Dave have regular folks paying them to take a stand against corporate greed. Along the way the three will meet, heads will bump and lives will change.",en,N/A,0,N/A,
The Dresden Dolls: Paradise,2005,10402,"Paradise is a concert video taken from a performance of The Dresden Dolls at The Paradise Rock Club in Boston, MA on June 5th, 2005 and released on DVD on November 22, 2005. The set list includes: 1. Good Day, 2. Missed Me, 3. War Pigs (Black Sabbath), 4. Perfect Fit, 5. Christopher Lydon, 6. Bad Habit, 7. Half Jack, 8. Girl Anachronism, 9. Pierre (Carole King) and 10. Truce.",en,N/A,8,Michael Pope,
Rosita,2005,99,"The plight of a nine-year-old Nicaraguan girl, who becomes pregnant as the result of a rape, triggers a battle of whose life has precedence.",es,https://image.tmdb.org/t/p/w500/wI5F6FngiTjY76uCCcwMNAXv98n.jpg,0,Barbara Attie,
Sacredly,2005,99,"In Russian, ""Svyato"" means ""happy"". But it is also a nickname for Svyatoslav, the son of director Kossakovsky, who for two years covered mirrors from Svyato. For the first time in his life, Svyato is going to watch himself on a mirror.",ru,https://image.tmdb.org/t/p/w500/2QdbYCDLV1OnVtquCloGpHzSgh4.jpg,4.1,Viktor Kossakovsky,
Brotherhood,2005,99,Brotherhood offers a rare look into the world of a New York City firehouse.,en,https://image.tmdb.org/t/p/w500/e3vw8kPtvggTz0NMIHdumvDFKMi.jpg,0,Lilibet Foster,
Way of Life,2005,18,,de,N/A,0,"Thakur, Sameer",
Evil,2005,27,An evil force is awakened in downtown Athens transforming the unsuspecting citizens into raving zombies. The few survivors will have to fight hard for their lives. To the death.,el,https://image.tmdb.org/t/p/w500/8OyP5WP0wHS1PjsSijdxCEY2nVI.jpg,5.3,Yorgos Noussias,Ekso Productions
Donauleichen,2005,18,"The emotional death of an oversexed society. No one helps anybody else. But then, shortly before Basti attempts to commit suicide, before he jumps from Vienna's Reichsbrücke into the notoriously gluttonous Danube, something happens between the two young protagonists. Basti and Claudia meet on the bridge. Two bungee jumpers without a cord. They both recognize themselves in the other's life, between reform school and the family's butcher shop, between child abuse and games that involve getting tied up.",de,https://image.tmdb.org/t/p/w500/bKlTetV6k5JreNXGoEYR0aUsW3l.jpg,0,Peter Kern,Alma Film Produktion
Legenda,2005,"27, 53",,pl,https://image.tmdb.org/t/p/w500/AkrGI6lEB9DTtd6fMx6LiL6SPsX.jpg,2.4,Mariusz Pujszo,
Aardvark'd: 12 Weeks with Geeks,2005,99,"Four interns are brought into Manhattan and given 12 weeks to design, develop, debug and ship a program that will change the way computer geeks around the world fix their friends' computers. Boondoggle Films presents a journey through the world of software development from the perspective of a unique upstart, four quirky interns, and the world of The Geek.",en,https://image.tmdb.org/t/p/w500/bYHgS62THhJhqEoTYeMsK8mNAhn.jpg,5.7,Lerone D. Wilson,Boondoggle Films
America's Lost Landscape: The Tallgrass Prairie,2005,,"America's Lost Landscape: The Tallgrass Prairie tells the rich and complex story of one of the most astonishing alterations of nature in human history. Prior to Euro-American settlement in the 1820s, one of the major landscape features of North America was 240 million acres of tallgrass prairie. But between 1830 and 1900 - in the space of a single lifetime - the tallgrass prairie was steadily transformed to farmland. This drastic change in the landscape also brought about an enormous social change for Native Americans; in an equally short time their cultural imprint was reduced in essence to a handful of place-names appearing on maps. America's Lost Landscape examines the record of human struggle, triumph, and defeat that prairie history exemplifies, including the history and culture of America's aboriginal inhabitants. The story of how and why the prairie was changed by Euro-American settlement is thoughtfully nuanced.",en,https://image.tmdb.org/t/p/w500/w8KolX6Lyf6HlfmrIug9mpT0Lx0.jpg,0,N/A,
Cochise County USA: Cries from the Border,2005,99,"As migrants cross the Mexican border into Arizona, they enter Cochise County, where some Americans wait with water, and some wait with guns.",en,https://image.tmdb.org/t/p/w500/wiOVDhulqallHu8dd4PVX23xqsm.jpg,6,Mercedes Maharis,
Fragile,2006,18,,fr,https://image.tmdb.org/t/p/w500/e6Bc8IsbANJVoYo2Fum8PjbnKMx.jpg,1,Laurent Nègre,Bord Cadre Films
The Gay Marriage Thing,2005,,"THE GAY MARRIAGE THING is not some historical commentary on gay rights in the United States. It is instead a small story with big implications. By focusing on one suburban couple and the multitude of events that directly affect that couple's otherwise average life, THE GAY MARRIAGE THING strives to show a different side of this issue than documentaries or television newscasts have thus far. This tale is cinematic in its storytelling, rather than journalistic in its reporting. There are plenty of other worthy documentaries where ""experts"" abound. But this film is about the biggest experts of all, real people. With protesters and their colorful signs serving as a Greek chorus, and an array of opinions from church, state, and everyone in between, this is the film that family members can finally watch together. THE GAY MARRIAGE THING is the documentary that opens dialogue, fully expecting the audience to continue it.",en,https://image.tmdb.org/t/p/w500/vAVWzkKo0SkkouUe5DAEHQ1LQ7w.jpg,1,Stephanie Higgins,
Planet Athens,2005,18,"In summer Athens, shortly before the start of the Olympic Games arrive with basic occasion of the most important sporting appointment, people from every corner of the Earth. Among them a couple from the country of the rising sun, which aims to unite the bonds of marriage, a French artist of the lens and a amerikanidoula who fall in love under the hot sun, an east returning years later to the place he met his big love, mingle with the locals characters you see forming before them something new.",el,https://image.tmdb.org/t/p/w500/wsWaKdTGSI5R1fk40K0SZ4cvry9.jpg,6,Dimitris Athanitis,
I Had an Abortion,2005,99,"Underneath the din of politicians posturing about ""life"" and ""choice"" and beyond the shouted slogans about murder and rights, there are real stories of real women who have had abortions. Each year in the US, 1.3 million abortions occur, but the topic is still so stigmatized it's never discussed in polite company.  Powerful, poignant, and fiercely honest, I HAD AN ABORTION tackles this taboo, featuring 10 women - including famed feminist Gloria Steinem - who candidly describe experiences spanning seven decades, from the years before Roe v. Wade to the present day.",en,https://image.tmdb.org/t/p/w500/ikC5VvEg2YDRueNEnXwQSghYO4U.jpg,0,Gillian Aldrich,
Cinéfilos a la intemperie,2005,99,,es,https://image.tmdb.org/t/p/w500/qTGMfVda173iMRfbkB3S090e9ZL.jpg,0,Carlos O. García,Derecho Viejo Producciones
Schnelles Geld,2005,,,de,N/A,5,Sabine Derflinger,
Deepsummer Night Dream,2005,99,"Tůma's film is a sovereign cinematographic space, which, broken up into many chapters, takes an unconventional look at contemporary Czech society.  The opening political grotesque on the election of the President is drowned out by the ecstatic ramblings of philosophising (and chattering) fragments turning on the sought-out axis of life and the world, and especially the inward-looking images full of colourful objectivity and charming humour that is elevated to the level of pure poetry.",cs,N/A,0,Radek Tůma,"FAMU, Théâtre de la Liberté"
Return of the Poet,2005,99,"A lyrical journey through Armenia, following the creation and transport of a statue. The simple telling from basic materials of the making of the clay used in the statue, and of the simple but poignant a cappella poetry that is sung as the only commentary, the film is a testament not only to Armenia‘s national poet, Ashugh Jivani, but to the integrity of art, its roots far away from the superficiality of the world, and of the power and truth it can convey.",hy,https://image.tmdb.org/t/p/w500/hXyunT4qNu64xq9QPEafOqIJm1N.jpg,6,Harutyun Khachatryan,
Dead at the Box Office,2005,27,"After finding a mysterious film reel hidden in their ceiling, the well-meaning staff of a struggling movie theater assume that the film is an old B-movie preview trailer and play it before a midnight screening of the timeless George A. Romero masterpiece, 'Night of the Living Dead'. When the film is revealed to be a long-dead Nazi scientist's mind control experiment, their audience of horror movie fanatics is transformed into a mob of mindless zombies with a fierce hunger for the flesh of the living! Ten survivors struggle to stay alive as the cinema is overrun by shambling hordes of the undead, while outside, ruthless government agents plot to halt the spread of the mysterious outbreak by any means necessary. Sometimes creepy, sometimes campy, 'Dead at the Box Office' pays tribute to the low budget horror films of the '70s and '80s. Combining the elements of these ""B"" classics with a fresh twist on the zombie origin, 'Dead at the Box Office' is a tongue-in-cheek salute to horror fans.",en,https://image.tmdb.org/t/p/w500/kKZnljlSpvkg42QAKeOIBhAQGgy.jpg,1.2,Shawn Stutler,Throbbing Temple Production
Resurrection Mary,2005,"9648, 18, 27","Drawn into a fiery affair with a mysterious woman named Mary who he met on the side of a darkened road, an engaged man finds his impending union threatened by an urban legend brought to terrifying life. It seemed that in Amy, Shawn had found everything he could ever want in life. Then, just six months before their wedding, Shawn met Mary.",en,N/A,4.7,Michael Lansu,Cooked Goose Production
Soulmates,2004,"10749, 35","For the 10 interns who sign up to be part of the online dating site BestMatch.mate, spending their summer playing Cupid turns out to be less satisfying than they expected. For one thing, they have a rash of crazy clients to deal with … not to mention their own interpersonal problems. Shoentel Scott, Dennis Addison and Victoria Esher co-star in this independent romantic comedy directed by husband-and-wife team Carl and Vivian Adams.",en,https://image.tmdb.org/t/p/w500/zB8DRyxvy0WzvSEg1j3vtdTvmWU.jpg,0,Carl Adams,"Back Corner Productions,"
The Sacrifice,2005,27,"Three years after the death of his father, 16-year-old Jonathan Kelly moves with his mother to the small New Hampshire town of Dunkirk. He is immediately drawn to David, a boy who shares his interest in the occult, and a tentative romance begins to develop between them.  But when the boys try to learn the truth behind a local ghost story, they discover that someone is digging up graves in the oldest part of the cemetery, collecting human remains for a dark ritual...a ritual that will end in human sacrifice.",en,https://image.tmdb.org/t/p/w500/19GdMhzXS4l1ZLklShNVuMy4J5H.jpg,1,Jamie Fessenden,
Chairman George,2005,,"In Canada, George is a statistician. But in China, George is Elvis... CHAIRMAN GEORGE is a documentary feature about a Greek-Canadian troubadour who refuses to live anything but an extraordinary life. ln Ottawa, George is a statistician who lives with his mother. But every few months, he takes an extended leave from his job and heads to China where he metamorphoses into an international man of culture. Armed only with his bouzouki, guitar and cell phone, he becomes a star in China (with both the critics and the ladies). He concludes that since he is ""the only Greek in the world who can sing in Chinese,"" it is his duty to perform at the Closing Ceremonies of the Athens Olympic Games, as the torch is passed from Athens to Beijing.",en,https://image.tmdb.org/t/p/w500/7RKGHIxrxVJXrO6P7WbNeboRq8W.jpg,0,Daniel Cross,
Hamlet,2005,"18, 9648, 27, 80",A young Prince is visited by the Ghost of his father and compelled to vengeance - but can he stop thinking for long enough to do it?,en,https://image.tmdb.org/t/p/w500/51Nb8Tnz2nLRikYryIZ7LbITq6t.jpg,2,Stephen Cavanagh,Derry Film Initiative
The Present,2005,,Rachel and her unborn baby were murdered ten years ago. David could change that--all of it. If he could just outplay the watchers in a game of cosmic chess.,en,N/A,0,Peter Shanelaris,
Saber quién echó fuego ahí,N/A,,feature length documentary,es,N/A,0,Lluís Crous,
Bortglömda,2005,99,,sv,https://image.tmdb.org/t/p/w500/jKHrpUWpPR9toOPlXgTdtxGbhjL.jpg,0,Agnieszka Lukasiak,Hysteria Film AB
Who's Quentin?,2005,"80, 28, 35",Two small-time criminals lose a bag they are supposed to steal and have until dawn to recover it.,en,https://image.tmdb.org/t/p/w500/dwQDSrIPZchKmmCcHyDsYaNhelG.jpg,0,Sacha Bachim,Feierblumm
How Do You Like Iceland?,2005,99,"How do you like Iceland? is a documentary about foreigners' perception of Icelanders. The film is mainly based on interviews with 37 foreigners from 9 countries who come from the world of art, sport, business and politics. Many humorous questions and interesting topics arise when the Icelandic nation is examined through the eye of the foreigner: Do foreigners think of Reykjavík as Bangkok of the north? Are the Icelanders an isolated and inbred nation? Or rather special and like no other? Is Icelandic inventiveness fit for export? Is the ""pure and unspoiled"" nation itself environmentally friendly?",is,https://image.tmdb.org/t/p/w500/puYp9OjwbFXExnN6hteec0lWccc.jpg,0,Kristín Ólafsdóttir,
Ik wil nooit beroemd worden,2006,99,"Tobias used to be a successful cellist. Following heart failure in 1997, his life took a dramatic turn. He was pronounced clinically dead and brought back to life with jolts of electricity. He was in a coma for several weeks and, when he woke up, he turned out to be physically and mentally handicapped. In this way, at the age of 39, Tobias found himself in a wheelchair and was no longer able to talk as a result of his brain damage. From that moment on, playing the cello was a thing of the past.",nl,https://image.tmdb.org/t/p/w500/5YIQVGzzt5DfhuvTM6ue2WVgb6N.jpg,0,Mercedes Stalenhoef,Selfmade Films
Morally and Kicking,2006,"35, 18, 10749","A group of men that their friendship starts from the army, meet after years in the funeral of a friend. This bad time reunites them, as for many years the family life and obligations, had absorbed a strong friendship.",el,https://image.tmdb.org/t/p/w500/i7hEgodvHqEhANgQ81uCsjXCl8V.jpg,4,Stamatis Tsarouchas,
Behind the Mirror,2005,,"The Little Painter of Rajasthan Aniket is a middle class executive living in the Indian city of Pune with his wife Malati and his son. He leaves Pune every morning at dawn and undertakes a long train journey to work in Mumbai. After riots took place, he takes his son Anirudh to his grand-mother's place in a little town of Shekhawati, in the middle of the desert, and somehow haunted by the magical and superb traditional paintings decorating the walls of houses and palaces. The old woman happily welcomes her grand-son she hardly knows. Anirudh discovers another world, a fascinating world far from what he was used to. He feels very affectionate for his grandmother. She gives him the painting box of her deceased husband, the artist who made the most beautiful paintings in town.",hi,https://image.tmdb.org/t/p/w500/lrYOb6sicftCGNiNG1mfVUTtNQk.jpg,0,Rajkumar Bhan,
Meatball Machine,2006,"27, 878, 28","Capable of making bio-mechanical weapons out of human flesh, alien parasites grotesquely invade the Earth, turning their hosts into maniacal killers who seek and destroy each other to the bloody death! And yes, it s also a human love story, even though the budding romantics are infested with slimy, tumor-like globules.",ja,https://image.tmdb.org/t/p/w500/szggz8oSi9ZIszL14rHTiahOLMm.jpg,5.4,Yudai Yamaguchi,King Records
Olentzero eta Subilaren Lapurreta,2005,16,,eu,https://image.tmdb.org/t/p/w500/3y5xCVGCLkjq8wkncLZy8ck0G40.jpg,0,Juanjo Elordi,"Baleuko, Barton Films"
The Old Man and Jesus: Prophets of Rebellion,2005,99,"The lives of two men who live on the streets of Caracas, Venezuela, are followed in a documented prophecy of the coming underground rebellion.",es,N/A,0,Marcelo Andrade Arreaza,Calle y Media Collective
Can You Die in Heaven?,2005,99,Portrait of Jonathan whose father committed suicide when he was only 8 years old. Now Jonathan is 11 and fights cancer.,en,N/A,0,Erlend E. Mo,
Loach is Fish Too,2006,"10749, 18",A divorced woman takes twin daughters to Beijing for living opportunities. She meets a widowed labor contractor. The two both have same nickname 'Loach'. They help each other for their adrift lives.,zh,https://image.tmdb.org/t/p/w500/trlVZbiHNb0Moa9F7Zvy0QYb3u8.jpg,5,Yang Yazhou,
Whirpool,2005,18,"A close friend of Homayoon, Bahram, commits suicide and leaves all his belongings to Homayoon's daughter, which makes Bahram suspicios and unvails a hidden romatic relationship.",fa,https://image.tmdb.org/t/p/w500/q1ckGWWaUj9Q9GSgjPP6ph1ifTI.jpg,0,Hassan Hedayat,
Adrenaline Hunters: The Movie,2006,,"Through winter and summer, across endlessly varied landscapes in search of perfection... not just for the rush, but to unlock the philosophy of The Edge. Against these unadulterated backdrops, the athletes look more animal than human. Like a gecko clinging to a wall, Klem Loskot moves sinuously up a sheer rock cliff. Jerome Ruby leaps from a lonely, lofty sandstone spire to swoop towards the desert below, more falcon than man. David Arnaud descends raging mountain rivers as fluidly and powerfully as the fish that call it home. Australia, Canada, Madagascar, Morocco, New Zealand, Norway, the United States, and Vietnam are just some of the locations that provide the organic arenas for their high performance antics.",en,N/A,0,Victor Muh,
L'appel des arènes,2005,,Love story set among wrestlers in Senegal.,en,https://image.tmdb.org/t/p/w500/fMPWFKmBFarqkdKEYQZQeVnfpTh.jpg,0,Cheikh Ndiaye,
10 Days in Malawi,2005,,"Traveling with a medical aid organization and joined by his mother and two friends, director Brian Ekdale discovers that the African country of Malawi, although deeply plagued by poverty and HIV/AIDS, is not a place abandoned by hope.",en,N/A,0,N/A,
The Sentimental Education of Eugenie,2005,10749,"The clever and passionate Madame De Saint-Ange has taken into consideration the education of the young and illiterate Eugenie and at the same time wants to seduce Marquis Dolmance, a famous homosexual philosopher. In two days, with the help of her brother, the Cavalier de Mirvel and the young servant Augustin, Madame will bring the company to completion with more or less mischievous geniuses, put in place through a combination of sensuality, eroticism and feeling.",it,https://image.tmdb.org/t/p/w500/tp4tXVguC5n14X6zo5fFNCuVK5e.jpg,4,Aurelio Grimaldi,BIM Distribuzione
