Title,Year,Genre,Plot,Language,Poster,IMDBRating,Director,Production,Error
My Mighty Princess,2008,"35, 10749","So-hwi is a martial arts prodigy and college student. Realizing that her superhuman strength is holding back her love life, she decides to quit martial arts to pursue handsome hockey player Joon-mo. But Joon-mo is in love with an older woman, and when So-hwi's mystical martial arts community comes under threat from an old enemy, Heuk-bong, her childhood friend Il-yeong must persuade her to return.",ko,https://image.tmdb.org/t/p/w500/mFpZjurGhtvBa1Jyzfw58Me7ZQ6.jpg,6.7,Kwak Jae-yong,"Bear Entertainment, Prime Entertainment",
Yo soy sola,2008,"35, 18","The story tells of four moments in the lives of four women: Vera, rising journalist  but dissatisfied with life, trying to be the best without knowing where; Lina, always surroended by  incense and saints, looking for the love of his life in a television character; Mara Bestelli, who is artificially inseminated without telling her partner that lives abroad; and Inés, whose only goal in life is to marry regardless of the reason for this decision.",es,https://image.tmdb.org/t/p/w500/1eIqaI3CX0Hnxh9o9ylyLXzEiqI.jpg,0,Tatiana Merenuk,,
Miss Conception,2008,"35, 10749","Georgina is an ambitious young London professional who learns she has only one month left in which to conceive a child. After exhausting all possibilities with her baby-phobic boyfriend, Georgina turns to her wildly optimistic friend Clem, with whom she sets out to identify and ""land"" the perfect father for her child.",en,https://image.tmdb.org/t/p/w500/p0p4s1ds3UATUPrTymUZPWIhJoK.jpg,4.4,Eric Styles,"Miromar Entertainment, Blue Angels Films",
K. Il bandito,2008,18,What is the English language plot outline for K. Il bandito (2008)?,it,N/A,0,Martin Donovan,,
Linoleum,2008,18,"While arranging their deceased father's funeral and inheritance, two brothers and their women are forced to make confessions in the oppressive atmosphere of the parental house.",nl,https://image.tmdb.org/t/p/w500/lfVeJQzG00xHX3FzWZHZfDrBNH8.jpg,0,Marcel Visbeen,Selwyn Film BV,
Valkyrie,2008,"18, 53, 10752","Wounded in Africa during World War II, Nazi Col. Claus von Stauffenberg returns to his native Germany and joins the Resistance in a daring plan to create a shadow government and assassinate Adolf Hitler. When events unfold so that he becomes a central player, he finds himself tasked with both leading the coup and personally killing the Führer.",en,https://image.tmdb.org/t/p/w500/8eoRtXswC8IQDsqW7iJWO56NhAv.jpg,6.936,Bryan Singer,"Bad Hat Harry Productions, Achte Babelsberg Film, United Artists",
French Film,2008,"10749, 35","Jed prepares to interview French cineaste and self-appointed expert on the nature of love - Thierry Grimandi. The worldly and somewhat jaded Jed is dead-set on dismissing the auteur's musings as pompous and, well French, until his own relationship with Cheryl starts to fall apart and he is forced to re-evaluate the illusive subject. Soon everyone is talking about love: his relationship counsellor, drinking buddy Marcus and Marcus' girlfriend Sophie Beginnings, endings, tricks...could the French be on to something?",en,https://image.tmdb.org/t/p/w500/eO5n2joORCosJMkbJMZK9rh9b31.jpg,6.1,Jackie Oudney,"IWC Media, Met Film Production, Slingshot Productions, APT Films",
Mr. Kuka's Advice,2008,35,"Young Waldek wants to earn some money abroad and asks his experienced neighbour, Mr Kuka, for advice. When he finally gets to Vienna, he can confront the reality with what he has been told about.",pl,https://image.tmdb.org/t/p/w500/fWRUj6zZZVczYv3bDcjnogRb7EN.jpg,5.9,Dariusz Gajewski,"ORF, Prisma Film, Opus Film, TVP",
Hunger,2008,"18, 36","The story of Bobby Sands, the IRA member who led the 1981 hunger strike during The Troubles in which Irish Republican prisoners tried to win political status.",en,https://image.tmdb.org/t/p/w500/84HdTM39G2MzyTl8N9R0wVU9I5b.jpg,7.3,Steve McQueen,"Blast! Films, Film4 Productions, Northern Ireland Screen, Wales Creative IP Fund",
Further North,2008,,"Five people and their relation to murder, as perpetrators, as victims, as conspirators.",en,N/A,6,James Snapko,,
Chronic Town,2008,"18, 28, 53","Truman Korovin is a lonely, sharp-witted cab driver in Fairbanks, Alaska, 1980. The usual routine of picking up fares and spending his nights at his favorite bar, the Boatel, is disrupted when his girlfriend, Emily, dumps him on one of the coldest nights of the year. After an acid trip, Truman winds up in the local loony bin. Imprisoned in a grueling therapy group, Truman gets re-acquainted with loonies who are his old cab fares, which includes a local stripper he has insulted more than once. In this world, Truman must find or lose himself.",en,https://image.tmdb.org/t/p/w500/trLUlHdOiu6aFBRmk6kDaxatXp.jpg,6,Tom Hines,,
One-Eyed Monster,2008,"35, 27, 878","In February 2007, ten people went to the remote mountains of Northern California to shoot an adult movie. What happened next was something no one expected, but everyone saw coming.",en,https://image.tmdb.org/t/p/w500/xXDmkwuWyQTjD8Tz7dJr93z9KdU.jpg,4.3,Adam Fields,Cheyenne Studios - 27567 Fantastic Lane,
Traitor,2008,"18, 28, 53, 80","When straight arrow FBI agent Roy Clayton heads up the investigation into a dangerous international conspiracy, all clues seem to lead back to former U.S. Special Operations officer Samir Horn.",en,https://image.tmdb.org/t/p/w500/va4Uo7L2b4d96JTdRMclO9L2hY0.jpg,6.6,Jeffrey Nachmanoff,"Mandeville Films, Hyde Park Entertainment, Crescendo Productions, Overture Films, Paramount Vantage",
Killer Movie,2008,"27, 9648, 53",A reality TV director copes with a spoiled celebutante and a show gone haywire when a masked killer starts bumping off the crew in this slasher-movie satire.,en,https://image.tmdb.org/t/p/w500/fhZNX8SCvtrrTfh8NV5EgtZC9d0.jpg,5.7,Jeff Fisher,The Weinstein Company,
The Dungeon Masters,2008,99,"The Dungeon Masters explores the subculture of role-playing games, specifically Dungeons &amp; Dragons, which for over 30 years has offered gamers the chance to escape their mundane lives and participate in a world they might otherwise never experience. Popularity and power are based on creativity and imagination rather than social status or wealth, and success is based not on who you know but on what you do.",en,https://image.tmdb.org/t/p/w500/s5tZg3GVhD5o5qDYL5aYVYCu5Oa.jpg,5,Keven McAlester,,
27 Dresses,2008,"35, 10749",Altruistic Jane finds herself facing her worst nightmare as her younger sister announces her engagement to the man Jane secretly adores.,en,https://image.tmdb.org/t/p/w500/rEfourJfgEyKiewwH8ZkUYt9AqE.jpg,6.418,Anne Fletcher,"Fox 2000 Pictures, Spyglass Entertainment, Dune Entertainment III",
Donkey Punch,2008,"27, 18, 53, 80","Three hot girls, four guys, and one mega-swanky yacht collide for a serious night of drugs and sexual deviancy. One debaucherous act goes too far though, turning this teen joy ride into a weekend of bloody bedlam.",en,https://image.tmdb.org/t/p/w500/7kk6dvvPVzZxii2Fez81LJZgtLS.jpg,4.763,Olly Blackburn,"Madman Entertainment, Warp X, Film4 Productions",
Karma Police,2008,18,What if a worldwide secret organization existed and you were recruited to join? That's what happens to Charles West when he's recruited to join the Karma Police. He loves it...but is making sure that good people are rewarded and bad people punished all that it seems to be?,en,N/A,5.5,N/A,,
The Maltese Murder Mystery,2008,,"What happens when an eyewitness to a murder comes forward to the police forty years later? What happens when the detective assigned to the case finds out that it is her mother who has made that call? Laura Posey is that detective and Ava Posey Bedingfield is the woman who can no longer live without her two daughters knowing the truth. The Maltese Murder Mystery is the story of love and deceit, of envy and lust, of hatred, addiction and murder. The Maltese Murder Mystery tells the compelling story of human frailties and the lengths to which people will go both to conceal and, perhaps even more harmful, to hide from the truth.",en,N/A,0,Joseph Parker,,
Unspoken Passion,2008,18,"Sikil tells the story of two men and a woman who are involved in a bizarre love triangle. These three friends grew up in a small town south of Manila. Enzo is a young closet gay prostitute who's obsessed with his childhood friend who happens to be a call-boy and has a girlfriend. Other interesting characters are the bi-sexual pimp, a regular bathhouse customer, and a sampaguita vendor-pickpocket-shoplifter and caretaker of Adong's daughter.",tl,https://image.tmdb.org/t/p/w500/A9M4ucYsz9V1JmZ2Xnj3ZEmeDMT.jpg,7.9,Roni Bertubin,"New Life Cinema, Professional Productions",
Suspension,2008,"28, 18, 14, 878, 53","Daniel loses his wife and son in a car accident. While slowly recovering from his injuries, he rebuilds his son's video camera that was destroyed in the crash. Infused with power from the moment of the crash, the camera develops the ability to stop time when Daniel presses the pause button.",en,https://image.tmdb.org/t/p/w500/xQ1rYct8j2idvpC4qVQAOXQG1K5.jpg,5,Alec Joler,EasyAction,
Sugar,2008,18,"Like many young men in the Dominican Republic, 19-year-old Miguel ""Sugar"" Santos dreams of winning a slot on an American baseball team. Indeed, his talents as a pitcher eventually land him a slot on a single-A team in Iowa, but culture shock, racism and other curveballs threaten to turn Sugar's dream sour.",en,https://image.tmdb.org/t/p/w500/ldiKnTAt8pBB3rY6HQI4QZt6r7n.jpg,6.508,Anna Boden,"Serie 23 Productions, Gowanus Projections, HBO Films, Sony Pictures Classics",
Rex,2008,"18, 80","Chase attempts to save his farm from being stolen by the corrupt sheriff that framed and murdered his father 20 years earlier. In the process, Chase begins mixing meth in the farm's basement and becomes involved in a love triangle between his best friend and his girlfriend",en,https://image.tmdb.org/t/p/w500/8ZUtLNKyFRrYSf0vQqNX1rBrxsq.jpg,4,N/A,,
The Feature,2008,99,"The Feature does not reconcile fact and fiction; instead, it blurs the definitions seemingly represented by the film’s two clearly demarcated registers: that of the archival footage and that of the new, theatrical material. In his guise as “Michel Auder,” living a fulsome and extravagant life, replete with beautiful women and a rock-cut pool overlooking Los Angeles, the art world is revealed as a sham, and his character exhibits a repulsive narcissism. And yet, when caught in quiet moments, something poignant emerges—a glimmer of truth that rebels against the entire endeavour. Or maybe, that’s what makes The Feature.",en,https://image.tmdb.org/t/p/w500/iaYHA6BkGQUK2z8VnW7B5gs5Cv6.jpg,8,Michel Auder,SeeThink Films,
Bhoothnath,2008,"10751, 35","Banku, his mother, Anjali Sharma and father move in to their new house -- the Nath villa, unaware of the fact that the house is inhabited by a ghost. It is learnt the ghost is not too happy with his new housemates. But what the ghost is not prepared for is his unlikely friendship with Banku. Now Banku must uncover the reason why his ghostly friend is stuck and help him to attain salvation.",hi,https://image.tmdb.org/t/p/w500/2Tvwmsu4ihzDiltXxPWI4RwTF3W.jpg,6.139,Vivek Sharma,BR Films International,
The Great Alibi,2008,"9648, 53","Like every weekend senator Henri Pagès and his wife entertain guests at their beautiful mansion in a peaceful village near Paris. But this time around, things go awry: Pierre Collier, a psychoanalyst and consummate womanizer, is brutally murdered. Claire, his wife, dazed and confused by his corpse, with a smoking gun still in her hand, seems to be the ideal culprit...",fr,https://image.tmdb.org/t/p/w500/u1ws9656MKXBqdSUjIZTAWKez8j.jpg,5.1,Pascal Bonitzer,"UGC Films, Angoa-Agicoa, CinéCinéma",
Hikers in Saint-Tropez,2008,35,"Ten years after their disastrous walking holiday in Corsica, four friends – Cora, Nadine, Mathieu and Louis – decide to spend the summer together on the Côte d’Azur. To their surprise, who should they meet in St-Tropez but Eric, the guide-from-Hell who transformed their last holiday into a nightmare and whom they swore never to see again...",fr,https://image.tmdb.org/t/p/w500/l8KOvffky8R3PQMBVHEOLMhdDOk.jpg,5,Philippe Harel,"K2 SA, Lazennec Films, SCOPE Pictures",
It Will Not End,2008,"10752, 18, 35","Djuro is a Romany, he has a large, happy family, and earns a living appearing in Serbian porn films. And it's through his sarcastic perspective that we follow the story of the Croatian war veteran Martin. He falls in love with a beautiful girl who plays Little Red Riding Hood in a porn version of the fairy tale. She is also a prostitute. To be with her, Martin has to buy her from her pimp. A tragicomic story of love in a world where it seems all human values are put up for sale or destined for cynical destruction",hr,https://image.tmdb.org/t/p/w500/yf9WLu0yoglRugj4rPPhVbeyAgC.jpg,6.7,Vinko Brešan,"Interfilm, Vans, Hrvatska Radiotelevizija",
Waitresses Wanted,2008,"28, 53","Brazilian native Priscilla Paredes is intent on staying in Montreal, despite the expiration of her student visa. Out of desperation, she takes a job as an exotic dancer at the Elixir, a downtown strip club, where she meets Milagro, a headstrong Quebecoise and fellow dancer who, ironically, longs to move to Brazil. Priscilla is welcomed into Milagro's secret family life, and introduced to her young daughter Chloé; Milagro in turn teaches Priscilla how to fight for what she wants, for what she needs.",fr,https://image.tmdb.org/t/p/w500/hosPuuporC19mRycFqpaJ4BMnXE.jpg,4.5,Guylaine Dionne,,
Africa Unite: A Celebration of Bob Marley's 60th Birthday,2008,"99, 10402",A documentary about the family of the late Bob Marley and their first trip to Ethiopia to attend the annual Africa Unite concert.,en,https://image.tmdb.org/t/p/w500/9ugrkeQ7NVH2Q3pJsvi84EJdvgx.jpg,0,N/A,,
David & Fatima,2008,18,A retelling of Romeo and Juliet in Jerusalem involving a Palestinian woman and an Israeli man.,en,https://image.tmdb.org/t/p/w500/uCwgsvj2qCdsEQs6GeXSuqxdo4H.jpg,5,Alain Zaloum,Karim Movies,
EM,2008,"18, 10749","When Josh and Amanda make eye contact at the airport, they both experience an instant attraction, and soon they're living together. But one day Josh awakens from his romantic haze to find his new life partner hospitalized for bipolar disorder.",en,https://image.tmdb.org/t/p/w500/lLnR11hGI5zxbAwetxEqwfLkdfq.jpg,7.5,Tony Barbieri,,
A Christmas Tale,2008,"35, 18","When their regal matriarch falls ill, the troubled Vuillard family come together for a hesitant Christmastime reunion. Among them is rebellious ne'er-do-well Henri and the uptight Elizabeth. Together under the same roof for the first time in many years, their intricate, long denied resentments and yearnings emerge again.",fr,https://image.tmdb.org/t/p/w500/yGLrE150vchL1q1e1UNmPRPKwii.jpg,6.7,Arnaud Desplechin,"Why Not Productions, France 2 Cinéma, Wild Bunch, Bac Films, CinéCinéma, CNC, Région Nord-Pas-de-Calais, Sofica UGC 1, Canal+, Pictanovo, IFC Films",
Ghost Town,2008,"18, 35, 14","Bertram Pincus, a cranky, people-hating Manhattan dentist, develops the unwelcome ability to see dead people. Really annoying dead people. Even worse, they all want something from him, particularly Frank Herlihy, a smooth-talking ghost, who pesters him into a romantic scheme involving his widow Gwen. They are soon entangled in a hilarious predicament between the now and the hereafter!",en,https://image.tmdb.org/t/p/w500/b8VS14DwpLlugTxVWSllYU0Gjn5.jpg,6.541,David Koepp,"Spyglass Entertainment, Pariah, DreamWorks Pictures",
The Business of Being Born,2008,99,"Birth: it's a miracle. A rite of passage. A natural part of life. But more than anything, birth is a business. Compelled to find answers after a disappointing birth experience with her first child, actress Ricki Lake recruits filmmaker Abby Epstein to explore the maternity care system in America",en,https://image.tmdb.org/t/p/w500/39IEAvj5u0gitcGgo0HylPAfuWS.jpg,6.6,Abby Epstein,Barranca Productions,
Buick Riviera,2008,18,"The story of Buick Riviera is told through fates of two men, both Bosnian (ex Yugoslavian) emigrants, belonging to the two different religious groups that fought for the city of Sarajevo during the War.",hr,https://image.tmdb.org/t/p/w500/y5g3QXW3TEJyXVNC9jCvgA4MKwF.jpg,6.5,Goran Rušinović,"Propeler Film, Tradewind Pictures, Refresh Production, Platform Productions, Film and Music Entertainment",
Land of Confusion,2008,99,"In March of 2004 a Pennsylvania filmmaker was activated with his National Guard unit and deployed to Iraq. During the next twelve months he would document his unique experiences as he and his platoon were tasked with the politically charged mission of searching for the infamous weapons of mass destruction (WMDs). The search would take them from the heart of Baghdad to rural Iraqi farms. Land Of Confusion offers a never-before seen account of working with the, then secretive, Iraq Survey Group (ISG) as they travel throughout the country searching for evidence that Saddam had the WMDs. The film reveals the extraordinary perspective of soldiers on the ground in Iraq, as recorded by one of their own and goes far beyond what the conventional mainstream media shows audiences about the war in Iraq.",en,https://image.tmdb.org/t/p/w500/7l0yoNlpQ3rLhpJkiwAm8ZUNmnq.jpg,0,Jeremy Zerechak,,
Tashan,2008,"28, 10749","Jeetendra Kumar Makwana is employed full-time at a Call Center and works part-time teaching English. He is recruited by an attractive young woman, Pooja, to teach her Hinglish-speaking boss, Bhaiyaji, English. Jeetendra agrees to do so, falls in love with Pooja, and joins forces with her to steal a bag containing 25 Crore Rupees in cash. He will soon find out that Bhaiyaji is a hoodlum and extortionist known to the Police as Lakhan Singh.",hi,https://image.tmdb.org/t/p/w500/h5GHlLJLan8eFFpBazIMP4iD0Rg.jpg,4.6,Vijay Krishna Acharya,Yash Raj Films,
Summer Heat,2008,"80, 18, 10749",Photographer Bob loses his girlfriend. A year later he meets Kathleen. Is she in love? Or does she use him for her dark dealings with the mafia?,nl,https://image.tmdb.org/t/p/w500/Uw0nwVbsBBqrTZmLKI8YVpSmUy.jpg,5.6,Monique van de Ven,,
Train Master,2008,,,en,https://image.tmdb.org/t/p/w500/160O3CC2HHVEQhRhw0CByxrfprr.jpg,1,Phil Bransom,,
Mr. Bones 2: Back from the Past,2008,35,"Hekule, the King of Kuvukiland, is given a gemstone by the dying Kunji Balanadin. The stone is cursed and causes Hekule to become possessed by the spirit of the mischievous Kunji. It is up Mr. Bones, the royal witch doctor to cure his King and get rid of this cursed stone by returning the gem to its home in an Indian fishing village.",en,https://image.tmdb.org/t/p/w500/esGxe0UYjK0ziKuhIQX7SlejAvc.jpg,6.3,Gray Hofmeyr,Videovision Entertainment,
The Apprentice,2008,18,"Mathieu, fifteen years old, student in an agricultural high school, is an apprentice on a work-study program at Paul's farm, a small dairy farm on the Haut Doubs plateaus. In addition to learning working methods, Mathieu must integrate into family life, make his mark, find his place. Around the gestures of work, links are woven with Paul. He learns from his contact what cannot be learned in a classroom. Because it is also an absent father that Paul replaces...",fr,https://image.tmdb.org/t/p/w500/2avt1U9ffOCHD7Qjv1uMiXr1gIa.jpg,5.5,Samuel Collardey,"Lazennec et Associés, ARTE France Cinéma",
Attack of the Giant Leeches,2008,27,"In a small town, the silence is shattered by a rash of disappearances at the swamp near the old deserted factories. Bodies are being discovered with no blood left in their bodies. It's up to a park ranger and the town sheriff to discover what ungodly creature is responsible for these deaths. It's only a matter of time before they discover that what they seek are leeches that have grown to unbelievable size. We bleed- they feed! Remake of the B-cult classic.",en,https://image.tmdb.org/t/p/w500/rZXFf6tDZ1n9sFyl7IrACI65DEK.jpg,3.6,Brett Kelly,"Dudez Productions, Brain Damage Films",
Cortex,2008,53,"Trapped in an old folks home where people keep going missing, an ex-cop must overcome his Alzheimers to find out who is killing people in this jigsaw thriller.",fr,https://image.tmdb.org/t/p/w500/qVxAQmQxPq2yvwhcUjMpPYFj5wD.jpg,6.5,Nicolas Boukhrief,"Canal+, Cofinova 3, France 3 Cinéma, Les films du Worso, La Région Île-de-France, Soficinéma 3, Wild Bunch",
Love Me No More,2008,18,"Antoine Méliot is around 40 years old and has everything he needs to be happy: a beautiful wife, two adorable children, friends he can count on, a pretty house in the Yvelines and money. But one day he decides to ruin everything in one weekend.",fr,https://image.tmdb.org/t/p/w500/g7n9ax9lKXdj6w9FZCptIcC3sgW.jpg,7.1,Jean Becker,"ICE3, StudioCanal, France 2 Cinéma",
The Feelings Factory,2008,18,"A successful woman searches for romance by speed dating in this drama. Eloise has a great job and a great education, but she's looking for love. Can a couple of minutes be the key to finding true love?",fr,https://image.tmdb.org/t/p/w500/o9w1PpnSMrplFehG3mTKu4mD2lH.jpg,4.9,Jean-Marc Moutout,"Centre du Cinéma et de l'Audiovisuel de la FWB, Les Films du Losange, Need Productions, Eléfilm, France 2 Cinéma, CNC, Canal+, RTBF",
Farm House,2008,"27, 53, 9648","Stranded in the remote countryside after wrecking their car, a couple seeking to start over discovers that there's no escape from the sins of their past.",en,https://image.tmdb.org/t/p/w500/5o5Hab1TGNlQ6yAYmo7RuE54bSJ.jpg,5.2,George Bessudo,,
The Maiden and the Wolves,2008,"18, 10751","Not long before World War I, in a French Alpine town near the Italian border, a pack of slaughtered wolves is delivered to local taxidermist Leon (Patrick Chesnais). A surviving black cub comes down from the mountains looking for his family, and is saved from discovery and certain death by Leon’s young daughter Angele, who releases him back into the wild. The Great War comes and goes, making local foundry owners the Garcins rich. Family patriarch Albert Garcin (Michel Galabru), who happens to be Angele’s godfather, has given a free lifetime’s lease of a shack in the hills to a gypsy woman (played in flashbacks by Elisa Tovati in which she’s seen, literally, having dances with wolves on stage). Her son Guiseppe (Stefano Accorsi), who appears to be slightly mentally handicapped, guards the wolves he’s befriended up there, especially the black pack leader he calls Carbone.",fr,https://image.tmdb.org/t/p/w500/a3Pl0QYYFjwS3bbVZ10NYbY4YUQ.jpg,6.1,Gilles Legrand,,
Lady Jane,2008,"80, 18, 53","Centers on three childhood friends: Muriel, Francois and Rene. Partners in crime (burglaries, to be precise), the three end their ""criminal"" activities after one of their attempted burglaries fails. They vow never to see each other again until, however, Muriel's son is kidnapped, which leads the three to join forces again to get the ransom money.",fr,https://image.tmdb.org/t/p/w500/7t7W4p2FHW1NvlYaVaFyWGV0Pau.jpg,5.5,Robert Guédiguian,Agat Films & Cie / Ex Nihilo,
Modern Love,2008,"35, 10749",Several couples break up and get back together.,fr,https://image.tmdb.org/t/p/w500/q5eed7fHP7Hew8HUAjjWkEnaXQT.jpg,4.5,Stéphane Kazandjian,"Galatée Films, Delante Films, Cirrus Communications, Pathé",
Not Quite Hollywood,2008,"35, 99","As Australian cinema broke through to international audiences in the 1970s through respected art house films like Peter Weir's ""Picnic At Hanging Rock,"" a new underground of low-budget exploitation filmmakers were turning out considerably less highbrow fare. Documentary filmmaker Mark Hartley explores this unbridled era of sex and violence, complete with clips from some of the scene's most outrageous flicks and interviews with the renegade filmmakers themselves.",en,https://image.tmdb.org/t/p/w500/n4J0mFMjeondUYT2zqlYb350tWL.jpg,6.8,Mark Hartley,Magnolia Pictures,
Otis,2008,"35, 27","After being captured and tortured by the psychopath Otis, teen cheerleader Riley Lawson escapes and informs her parents, who quickly sidestep sluggish FBI agents and take matters into their own hands. But the Lawsons' revenge plan hits a snag when Otis's unusual brother enters the picture.",en,https://image.tmdb.org/t/p/w500/hDujIe7PxXxxkWK844sCTkwqxCu.jpg,5.5,Tony Krantz,Raw Feed,
"White Tuft, the Little Beaver",2008,"10751, 12",White Tuft is a small beaver who lives in the north of Canada; It is a dangerous place so in his adventure he would have to recognice his friends and his enemies.,fr,https://image.tmdb.org/t/p/w500/rTFTPKoJw1PFWYjbu4eWAxoOgIB.jpg,6.4,Philippe Calderon,,
Alien Raiders,2008,"27, 878, 53","It's the end of yet another night at Hastings Supermarket, a grocery store in Buck Lake, Arizona. But just before closing, a group of masked and armed to the teeth militants invades the store and take everyone hostage",en,https://image.tmdb.org/t/p/w500/gBz8ueJSWIVwB3LO80BiuUFpiWY.jpg,5.35,Ben Rock,"Flame Ventures, Raw Feed",
The Tour,2008,"12, 35, 28","Year 1993, the bleakest time of war in Bosnia and Herzegovina. A group of actors from Belgrade, utterly unaware of what they're setting themselves up for, embark on a search for quick earnings - on a ""tour"" around the Serbian Krajina. However, there they are thrust into the heart of war and begin to wander from war front to war front, from one army to the next.",sr,https://image.tmdb.org/t/p/w500/jM3pW6qOfwMt8Q6js9PwhrHQHMn.jpg,6.7,Goran Marković,"A Atalanta, Balkan Film, Testament Film",
