Title,Year,Genre,Plot,Language,Poster,IMDBRating,Director,Production
Speaking Parts,1989,"18, 10749","Hotel employee Lisa develops an obsession with her co-worker Lance, a struggling actor who has appeared in several films as an extra.",en,https://image.tmdb.org/t/p/w500/xRVyrjLeyvpEJfCkyRUXyXsKpUt.jpg,5.9,Atom Egoyan,"Academy Pictures, Ego Film Arts"
Speed Zone,1989,"35, 28","An illegal race that takes place over the United States and nothing will stop this bunch of racers except for the occasional cop or a damsel in distress. Jackie Chan's car is not in this one, but many new cars make up for that. Who will win? Who will crash? Who will not even finish? Sit down and buckle up for the ride of your life.",en,https://image.tmdb.org/t/p/w500/cmAgnjrH7TlKjYUpS9NMGMlbkre.jpg,4.5,Jim Drake,"Entcorp Communications, Orion Pictures"
Spider's Web,1989,18,"Ulrich Mühe plays a German businessman who was born completely without scruples. This makes him an eminently suitable candidate for success in the chaotic years after World War I. The shameless man's story is contrasted with that of his polar opposite, a Jewish anarchist.",de,https://image.tmdb.org/t/p/w500/o3o9Fx8rAzDuaMFx6tEy9GsuL8t.jpg,6.25,Bernhard Wicki,"ORF, Beta Film, Provobis Film, ZDF, RAI, TVE"
Split,1989,"878, 18",Sci-fi story about a man (Timothy Dwight) on the run from a Big Brother-like security force.,en,https://image.tmdb.org/t/p/w500/hXS89dhUPiMLhOmiXWc2t3U8pH8.jpg,4.6,Chris Shaw,Stalker Films
Spontaneous Combustion,1990,"27, 878","A young man finds out that his parents had been used in an atomic-weapons experiment shortly before he was born, and that the results have had some unexpected effects on him.",en,https://image.tmdb.org/t/p/w500/44RKxTOBEJggUK9jHzsaIWFb668.jpg,4.7,Tobe Hooper,"Black Owl Productions, VOSC"
Inventory,1989,18,"Difficulty of human relations in a 3-cornered tale: a neurotic woman, idealistic young man and his mother. Tomek is a clean-cut, high-minded geography student. He lives with his mother Zofia, a sensitive, practicing Catholic, like her son. When he meets Julia, a depressed woman older than he, he first tries to comfort her, then invites her to stay with him and his mother. Tomek makes a trip to West Berlin to visit his well-off father. He refuses to take money from him and looks for work as a house painter. Julia ends up in a rest home for treatment, while Tomek is trying to make their relationship work.",pl,https://image.tmdb.org/t/p/w500/1gyT3CdjAR1o14BV6jx9Zy7RzaJ.jpg,6.3,Krzysztof Zanussi,"Regina Ziegler Filmproduktion, TVP, Studio Filmowe Tor"
Star Trek V: The Final Frontier,1989,"878, 28, 12, 53",A renegade Vulcan with a startling secret hijacks the U.S.S. Enterprise in order to find a mythical planet.,en,https://image.tmdb.org/t/p/w500/uiXr41VLYsuug3CZbFrKLSNahuZ.jpg,5.7,William Shatner,Paramount Pictures
Staying Together,1989,"35, 18","After their father abruptly sells the beloved family-owned restaurant that has employed them for years, the charismatic McDermott boys - hot-tempered Brian (Quill), lovelorn Kit (Mulroney) and jokester Duncan (Astin) - find themselves at odds with their parents and each other.",en,https://image.tmdb.org/t/p/w500/4aWYb3fc2knW1WCH6fMX9AvVkiE.jpg,5.3,Lee Grant,
Steel Magnolias,1989,"35, 18, 10749","A young beautician, newly arrived in a small Louisiana town, finds work at the local salon, where a small group of women share a close bond of friendship and welcome her into the fold.",en,https://image.tmdb.org/t/p/w500/7ExUSN9s9gX9bhVM17zDLEizano.jpg,7.2,Herbert Ross,"Rastar Productions, TriStar Pictures"
Stepfather 2,1989,"27, 53","""Stepfather"" Jerry Blake escapes an insane asylum and winds up in another town, this time impersonating a marriage counselor. With a future wife and new stepson who love him, Blake eliminates anyone who stands in his way to building the perfect family.",en,https://image.tmdb.org/t/p/w500/STSt97FOcXjaUEHtVBPRZCA7eK.jpg,5.4,Jeff Burr,"Part II Productions, Millimeter Films, ITC Entertainment"
A Sting in the Tail,1989,35,"Diane Lane is intelligent and ambitious. When she is elected to Parliament her idealism and commitment give her unpopular party a boost. Everyone, including the Prime Minister, is eager to share her limelight. Diane’s ambition is not satisfied with her new position. Diane’s married lover, Barry Robbins, the Minister for Health, is unaware of Diane’s ultimate plan. Her closest friend, Louise Parker, a political journalist, is a bit more realistic about what women can achieve; she too has a higher goal in mind.",en,N/A,0,Eugene Schlusser,Rosa Colosimo Films
The Story of Boys and Girls,1989,"18, 35","At a farmhouse, a large family cooks mountains of food for the next day's engagement party for Silvia and her city fiancé, Angelo. Her parents feud about infidelity; an aging salesman who rents a cottage from them arrives with a young French woman; in Bologna, Angelo's mother frets that her son is marrying beneath him; his sisters are less critical. Early the next morning, the four of them go by train to the farmhouse, joined by Angelo's married, unpregnant sister. The day-long dinner is riotous, couples display affection and impatience, children chase angels. Angelo's family stays the night, and his sister Linda has a visitor. A silver elephant makes the perfect gift.",it,https://image.tmdb.org/t/p/w500/szd5fbhPaRvKzuQrZcPVAd8a2Ae.jpg,7,Pupi Avati,"Duea Film, Unione Cinematografica Internazionale, RAI"
Strapless,1989,"18, 10749","An expatriate American doctor in London allows herself to lighten up when her freewheeling younger sister and a mysterious man enter her life. Her inhibitions released, the beautiful doctor learns that freedom has its own price.",en,https://image.tmdb.org/t/p/w500/dk58HvZbbiHHVVCaP8O52bJWRZJ.jpg,8.3,David Hare,"Granada Productions, Film4 Productions"
Street of No Return,1989,"28, 18, 80, 53","A rock star-turned-bum, his vocal chords severed at the height of his career for the love of a woman, drunkenly roams the city, torn apart by sponsored race riots. When accused of murder, he may have the chance to get revenge on the magnate who maimed him.",en,https://image.tmdb.org/t/p/w500/tUAKWZflEZy5fk4SLszWQ6g0Dqr.jpg,5.5,Samuel Fuller,"Animatógrafo, Instituto Português de Cinema (IPC)"
Witch Story,1989,27,"A young girl and her brother take some friends on trip to check out a house the pair has just inherited. What they don't know is that the house is haunted by demons and the ghost of a woman who was burned at the stake as a witch, and who now plans to take revenge by killing off the siblings and their friends.",en,https://image.tmdb.org/t/p/w500/8mGEg3VeoAA5Qw6vtdEVOeT0UF.jpg,4.6,Alessandro Capone,"Claudio Bonivento Productions, United Entertainment Corporation"
Stripped to Kill 2: Live Girls,1989,"53, 27, 35","When the razor blade slasher begins his reign of terror in the alleys behind the Los Angeles strip clubs, the most famous stripper in the spotlight must walk a tightrope between her own fragile sanity and the inescapable murderer's blade.",en,https://image.tmdb.org/t/p/w500/rT4O42rtThyskk6oUGf6xSMj3KJ.jpg,4.1,Katt Shea,
Stuff Stephanie in the Incinerator,1990,"35, 53, 27","A bored, filthy rich married couple and their hired help play sordid games of deception, kidnap, sexual intrigue, and perhaps murder when a secret alliance is formed to kill domineering husband Jared for money he's been hoarding from them. Meanwhile, he may have a secret or two up his sleeves.",en,https://image.tmdb.org/t/p/w500/bGioOzHb3XjSVKtbBXiJ1ga3Hq6.jpg,3.1,Don Nardo,Troma Entertainment
Twisted Obsession,1989,"53, 9648","An American writer in Paris is hired to do a script for an edgy young director he can't stand. When he falls in love with the director's cold and manipulative pretty sister, his life starts to unravel and he realizes that he's been used.",es,https://image.tmdb.org/t/p/w500/qISuU2idmInI1HoNAxy6BC3PdDT.jpg,5.4,Fernando Trueba,"French Productions, Iberoamericana Films Produccion, Sofica Valor"
Suffering Bastards,1989,35,Two brothers try to get back the nightclub that was swindled from their mother.,en,https://image.tmdb.org/t/p/w500/w4ndD2TFh63JqggBE3nrwGVUubf.jpg,0,Bernard McWilliams,
Suivez cet avion,1989,35,"A perfectly innocent computer jockey becomes the prime suspect in a bank robbery. Among the tribulations he must suffer is that the real culprit is his landlady. Another source of suffering for the poor man is his extremely strong-willed mother, whose wants must be catered to. Meanwhile, he is being rabidly pursued by one of his female coworkers, who has taken a shine to him.",fr,https://image.tmdb.org/t/p/w500/v63pjR3zK1rRuw2wBBTAw3IBmi6.jpg,7.2,Patrice Ambard,"Madeleine Films, My Slav Productions, Société Générale de Gestion Cinématographique (SGGC)"
Sukkubus,1989,"18, 14, 27","Sometime during the 19th century in Switzerland: After a delirious night of drinking, three herdsmen who are all alone in the alps with their kettle, create a female doll from cloth and a strangely formed wooden root. When their creation comes to life in form of an evil and beautiful female demon, they have to fear for their lives...",de,https://image.tmdb.org/t/p/w500/5F6OrTdhA1M7CjPPua3jmwkxc89.jpg,5.9,Georg Tressler,"Roxy Film, Franz Seitz Filmproduktion"
Summer Job,1989,35,In this adolescent comedy a group of college girls get summer jobs at a posh Florida resort and have assorted adventures when they begin competing for the best jobs and for the affections of a hunky male staff member.,en,https://image.tmdb.org/t/p/w500/6Nd8NZUxktrcasOXP4MS3BalOTZ.jpg,4.9,Paul Madden,
Sundown: The Vampire in Retreat,1989,"35, 27",Reclusive vampires lounge in a lonely American town. They wear sunscreen to protect themselves. A descendant of Van Helsing arrives with hilarious consequences.,en,https://image.tmdb.org/t/p/w500/afyyaG2uJJIXCKn5kDoWT5aJiQS.jpg,6.1,Anthony Hickox,Vestron Pictures
Super Chief: The Life and Legacy of Earl Warren,1989,99,"A documentary portrait of the late Earl Warren, the Chief Justice who presided over the Supreme Court during some of its most turbulent years from 1953 to 1969.",en,N/A,7.3,Bill Jersey,
Surname Viêt Given Name Nam,1989,"99, 36, 10752","The film evolves around questions of identity, popular memory and culture. While focusing on aspects of Vietnamese reality as seen through the lives and history of women resistance in Vietnam and in the U.S, it raises questions on the politics of interviewing and documenting.",en,https://image.tmdb.org/t/p/w500/tlvMUtwV4epz57VvL1nE6JcM2xd.jpg,6.1,Trịnh T. Minh-hà,Women Make Movies
Survival Quest,1988,"28, 12","A bunch of city slickers from different backgrounds go into the wild mountains to be one with nature, but basically to have a good time. However, a paramilitary group has chosen the same time to go camping. When one of the soldiers thinks their boss has been killed by one of the city slickers, he coaxes his team into exterminating all of them. They will have to rely on their wits and on each other in order to survive.",en,https://image.tmdb.org/t/p/w500/weaF990jmJw6VIAlxKyxvH7bAJP.jpg,5.4,Don Coscarelli,"Starway International Inc., Metro-Goldwyn-Mayer"
Światło odbite,1989,18,"The writer Zbigniew takes part in a psychotherapeutic session, during which he tells his story.",pl,N/A,0,Andrzej Titkow,"Zespół Filmowy ""Perspektywa"""
Art of Loving,1989,"35, 10749",Prior to her wedding a nineteen years old Anna can't stop wondering - whether she made the right choice? So she decides to seek the advice of a well-known sexologist...,pl,https://image.tmdb.org/t/p/w500/tNxqry77K8Q4vgqMfmnHpLM5gjn.jpg,4.6,Jacek Bromski,Zebra Film Studio
Tale of Two Sisters,1989,18,"Two sisters reunite after not having seen each other for five years. While catching up on each others' lives, they relive childhood experiences, both good and bad.",en,https://image.tmdb.org/t/p/w500/sw9KahHByEdBJjlHWQaMvm19IZc.jpg,3.2,Adam Rifkin,"Troma Entertainment, L.A. Dreams Productions"
The Tall Guy,1989,"35, 10749",An American actor in England tries to find love and work.,en,https://image.tmdb.org/t/p/w500/6tGHCij3jJu80RYSSpV0LBRLTN3.jpg,5.7,Mel Smith,"LWT, Virgin Vision, Working Title Films"
The Winter War,1989,"18, 10752",Russia attacked Finland in late November 1939. This film tells the story of a Finnish platoon of reservists from the municipality of Kauhava in the province of Pohjanmaa/Ostrobothnia who leave their homes and go to war. The film focuses on the farmer brothers Martti and Paavo Hakala.,fi,https://image.tmdb.org/t/p/w500/hoXzrghg8RMtw9ErlWZ6lfixOR9.jpg,7,Pekka Parikka,National-Filmi
Tango & Cash,1989,"28, 53, 35, 18","Ray Tango and Gabriel Cash are two successful narcotics detectives who can't stand each other. Crime lord Yves Perret, furious at the loss of income they have caused him, plots an elaborate revenge against them.",en,https://image.tmdb.org/t/p/w500/jxxxjTu87OSmQYkMFF7MgOEDXRn.jpg,6.453,Andrei Konchalovsky,"Warner Bros. Pictures, Guber/Peters Company"
Tank Malling,1989,"53, 80","Tank  is an investigative reporter and jailbird, framed on scant evidence supplied by the London mob. Helen is the sensuous call-girl who offers Tank ammunition and retribution. But, retaliation is swift and brutal, in the guise of Sir Robert Knights and his equally lethal lawyer, Dunboyne. A series of hideous murders follow as the devil protects his own. Only Malling and Helen can halt the onslaught. But, for how long, and at what price?",en,https://image.tmdb.org/t/p/w500/kMnjzLhHOcyIGIhRZGiC41crLPc.jpg,4,James Marcus,
Tap,1989,"18, 10402","Max Washington has just been released from prison after serving time for burglary. He returns to his old hangout, a hoofer club. His old girl friend, Amy, who still works at the club as a Tap instructor, is less than thrilled to see him. Her father, Little Mo, is happy to see him, because he has plans for a show involving Max. In addition, Max's old partners in crime have another job for him.",en,https://image.tmdb.org/t/p/w500/cjy45SaOAzcyReyl4pr6jWss6uS.jpg,6.7,Nick Castle,"TriStar Pictures, Beco Films"
Tarzan Mama Mia,1989,10751,"Eleven-year old Rikke lives alone with her father, whose only interest in life seems to be the soccer matches which appear on his television. Not surprisingly, Rikke is somewhat bored. She enters a contest put on by a cereal company which has as its grand prize a horse. Since she lives in the city in a second floor apartment, it never occurred to her that she might win, but win she does. The horse (""Mama-Mia"") duly appears, and she and the members of her slum neighborhood come together to cope with the situation in a delightful way.",da,https://image.tmdb.org/t/p/w500/gz0YoNy5plwUAqcIzoUsc1HWmXw.jpg,6.1,Erik Clausen,Nordisk Film Denmark
Taylor Made,1989,,Cheri Taylor gets the star treatment here as a housewife who finds sexual freedom after walking out on a loveless marriage.,en,https://image.tmdb.org/t/p/w500/qCaJDFpoNkslBPxmsBgadW9oFSc.jpg,0,David Mann,
Teen Witch,1989,"35, 14, 10749",Louise is not very popular at her highschool. Then she learns that she's descended from the witches of Salem and has inherited their powers. At first she uses them to get back at the girls and teachers who teased her and to win the heart of the handsome footballer's captain. But soon she has doubts if it's right to 'cheat' her way to popularity.,en,https://image.tmdb.org/t/p/w500/51A71crqobviJRX2Ktl7JVROwdv.jpg,6.065,Dorian Walker,Trans World Entertainment
Ten Little Indians,1989,"80, 53, 9648","An unknown judge invites a guilty governess and others to a 1930s safari, for justice one by one.",en,https://image.tmdb.org/t/p/w500/nkh9NY3PMYqpCVQqo9yJFe8u0eq.jpg,4.938,Alan Birkinshaw,"Breton Film Productions, The Cannon Group"
Termini Station,1989,18,"Termini Station is a Canadian made drama, released in 1989 and directed by Allan King.  The film stars Colleen Dewhurst and Megan Follows as Molly and Micheline Dushane, a mother and daughter living in a small Northern Ontario town.  Molly is an alcoholic, which creates tension between her and Micheline and inspires Micheline's fantasies of escaping her stifling small-town life.  The cast also includes Gordon Clapp and Debra McGrath as Molly's son and daughter-in-law.  Termini Station was the only film besides the Anne of Green Gables movies in which Follows and Dewhurst worked together.  The film was nominated for six awards at the 11th Genie Awards, including Best Picture and Best Actress nods for both Dewhurst and Follows.  Filmed on location in Kirkland Lake Ontario.",en,https://image.tmdb.org/t/p/w500/rXlEdF84cz2A2YJcAIaFHOuk8MB.jpg,4,Allan King,"Saturday Plays Limited, Astral Films, Northern Arts Entertainment"
That Summer of White Roses,1989,18,"World War II finally reaches a Yugoslavian lake, where a lifeguard shelters a refugee and her son.",sh,https://image.tmdb.org/t/p/w500/7EakIGTPePRh1v82JZbm9p37Oj6.jpg,5.3,Rajko Grlić,"Jadran Film, Amy International Artists, National Mutual Australasia Ltd, Maestro Film"
That's Adequate,1989,35,"This mockumentary about fictional movie studio Adequate Pictures boasts an interesting cast. Tony Randall hosts, and James CoCo (practically on his deathbed) stars as head of the studio. Includes parodies of  everything from silent comedies to porn, including an ultra violent  ""three stooges"" style comedy team who put a new spin on the eye poking  gag.",en,https://image.tmdb.org/t/p/w500/sb2bgaEsQ4nR3PtgSQriqepB6aW.jpg,4.2,Harry Hurwitz,That's Adequate Co.
Theo en Thea en de ontmaskering van het Tenenkaasimperium,1989,"10751, 35, 12","Theo and Thea want to make a movie of Snow White, but Gerard Joling, who should play prince, cries off. Someone suggests to ask opera singer Marco Bakker. First he doesn't want to, but when Theo and Thea dress up like jazz singers Bea and Ans, he decides to join in. Marco even falls in love with the dressed-up Theo. Written by Clausule",nl,https://image.tmdb.org/t/p/w500/fxW0iaGkbzXpdr8oOBTFO4JFKRP.jpg,6.2,Pieter Kramer,Van Den Beginne
They Call Me Macho Woman,1989,"28, 53","A young widow on a trip to the backwoods stumbles upon the operation of a gang of drug smugglers. They attempt to kill her in order to keep their operation a secret, but she turns out to be more resourceful than they thought, and starts to turn the tables on them.",en,https://image.tmdb.org/t/p/w500/mMIkKeyj8yfp3GyufvmJx667o2P.jpg,4.6,Patrick G. Donahue,Troma Entertainment
Three Fugitives,1989,"35, 80","On his first day after being released from jail for 14 armed bank robberies, Lucas finds himself caught up in someone else's robbery. Perry has decided to hold up the local bank to raise money so that he can keep his daughter, Meg, and get her the treatment she needs. Dugan, a detective, assumes Lucas helped plan the robbery, and hence Lucas, Perry and Meg become three fugitives.",en,https://image.tmdb.org/t/p/w500/d6Gy5Hg88lKJUumBwY0FZzwU5oD.jpg,6.683,Francis Veber,"Silver Screen Partners IV, Touchstone Pictures"
Thunderground,1989,"28, 12","A con-artist meets a tough fighter and sees him as her ticket to a better life. The two make an agreement and head off to New Orleans to arrange a match with ""the man"" - the mysterious king of bare-knuckled boxing. There are no rules for this fight...one man wins when the other dies.",en,https://image.tmdb.org/t/p/w500/kTyA0oLpVmFF1G6p1HCIt3iCrPA.jpg,3,David Mitchell,"Rose & Ruby Productions, Shapiro-Glickenhaus Entertainment, Thunderground Productions"
Time Has No Name,1989,99,A documentary which visually captures the day-to-day routines of a husband and wife on a small farm.,sv,https://image.tmdb.org/t/p/w500/pi1zoV4SowtvaXfwdFWRKhnniBX.jpg,6,Stefan Jarl,
Live Hard,1989,"53, 28","In Hong Kong, terrorists from Libya blow up a bus which kills the son of the American consul. The Hong Kong Police Force sends Lui Yung and his team of special agents to investigate the case and destroy the terrorist group. On the other hand, Senior Inspector Hui Tat Ming (Simon Yam) of the Regional Crime Unit is discontented by the fact that he is no longer in charge of the case since it has been transferred to the Politics Department. However, Hui secretly investigates alone to track down the terrorists and bring them to justice",cn,https://image.tmdb.org/t/p/w500/zbefcTr1GfXNQvUDzRkc1oC53HB.jpg,6,Yuen Cheung-Yan,Top Sun Film Production House
"Tiger, Lion, Panther",1989,35,,de,https://image.tmdb.org/t/p/w500/nMQJnTHsZrnI39dHhbu7jNV0OjG.jpg,0,Dominik Graf,Bavaria Film
Time Trackers,1989,"878, 28, 12","When an evil scientist steals his colleague's time machine his colleague's beautiful, brilliant daughter, aided by an L.A. cop and a hapless admirer, pursues him back to twelfth century England where - disguised as a damsel in distress - she enlists the help of a knight errant whose secret past holds the key to her future.",en,https://image.tmdb.org/t/p/w500/mlfSLXbbFEqlP4XPZXzruTFfsMc.jpg,3,Howard R. Cohen,Concorde Pictures
Tolérance,1989,,"An English hermit Rupert Everett) has somehow been brought to France in the period following the French Revolution, and prior to the Napoleonic Era, a period (1795-1799) known as ""The Directory."" He eventually comes down out of his tree into a chateau owned by an Italian nobleman (Ugo Tognazzi) and his wife. Before long, the hermit has washed and bathed and become quite presentable, even charming. However, his appearance in their midst is like a sentence of death for many of those who associate with him.",en,https://image.tmdb.org/t/p/w500/8WLfAbEIm4ViSJH1a4erlNAnizm.jpg,2,Pierre-Henry Salfati,"Top Films Productions, Films A2, G.P.F.I."
Tong Tana - En resa till Borneos inre,1989,,"A Swedish crew trekked into the depths of the endangered Bornean rainforest to film this poetic documentary about the plight of the Penans and their most unusual ally, Bruno Manser - a young Swiss who has rejected 'civilization' to join the tribe and help fight international logging.",en,https://image.tmdb.org/t/p/w500/bsbqemgfbS0foPeJgP2UtW5Nqi1.jpg,0,Fredrik von Krusenstjerna,
Bloody Brotherhood,1989,"28, 80, 53","Wah is the only one in his family lucky enough to survive the deadly boat passage from China to Hong Kong. Once in Hong Kong, he searches for opportunities he heard so much about. After struggling for months, he discovers that this is all but a myth.",cn,https://image.tmdb.org/t/p/w500/cNXnQNAfV4KdRzA3Wjv2we5wif2.jpg,7.5,Johnny Wang Lung-Wei,Chun Sing Film Company
Toofan,1989,,"Two brothers (Toofan and Shyam) are separated at birth by their father, a police inspector. One grows up to be a magician, and the other, the legendary Toofan, hero of the poor. His father was falsely accused of stealing millions in gold and Toofan is on a mission to clear his father's name from the police records.",hi,https://image.tmdb.org/t/p/w500/fvWYIGtwbYBdjsjl5fLsMVcbPLP.jpg,5.7,Ketan Desai,M.K.D. Films Combine
The Top of His Head,1989,"10749, 18","Satellite dish salesman Gus experiences some life-altering changes when he meets performance artist Lucy in this visually poetic fantasy. After Lucy vanishes, leaving a puzzling note, Gus goes on a quest for the mysterious woman. Moving from his meticulous life in a technologically advanced world into the spontaneity of nature, Gus learns some important lessons and begins to trust his own instincts.",en,https://image.tmdb.org/t/p/w500/hLyzkwZZud0G6V1NtECvdbM5EmR.jpg,3,Peter Mettler,"Rhombus Media, Grimthorpe Film"
Torquemada,1989,"18, 36",Last feature film of Stanislav Barabas,de,https://image.tmdb.org/t/p/w500/rduhfJW8tca4CRpMT9SBSY8CJho.jpg,8,Stanislav Barabáš,
City Squeeze,1989,"10749, 35","Wong is a supervisor at Yau's firm, he is often taken advantage of because of his integrity and timidity. Yau has struck rich because of his wife's wealth. One day on an inspection tour, he's stunned by a receptionist, Fung. He then begins to date her. Most of the male staff in the firm is interested in Fung, including Wong. But he hasn't the courage to approach her.",cn,https://image.tmdb.org/t/p/w500/h2bDS4z3nVe04l5hKXyucSAWNfo.jpg,5,Clifton Ko Chi-Sum,Ko Chi Sum Films Company Limited
The Toxic Avenger Part III: The Last Temptation of Toxie,1989,"35, 27, 878","Desperate to raise money for the experimental surgery that could restore his blind fiancee's eyesight, Toxie accepts a lucrative job with the evil multinational conglomerate Apocalypse Inc.",en,https://image.tmdb.org/t/p/w500/yEOliKp5hZIBR0lDr9L3mJLijT0.jpg,4.988,Michael Herz,Troma Entertainment
The Toxic Avenger Part II,1989,"35, 27, 878","Melvin Junko was a nerdy weakling until he fell into a vat of toxic waste, turning him into the first ever superhuman creature from New Jersey. This time, he takes on Tokyo.",en,https://image.tmdb.org/t/p/w500/m5o7B3VSAjvinjtSYxXD38senvb.jpg,5.443,Michael Herz,"Troma Entertainment, Lorimar Film Entertainment"
Hell's Trap,1989,"18, 28, 53, 27","Seven young people go to a desolated forest looking for a bear, what they don't know is that a crazy Vietnam vet lives there and he is waiting for fresh blood.",es,https://image.tmdb.org/t/p/w500/v34FEQZBu8soWt2KAWRfwdl1swJ.jpg,5.2,Pedro Galindo III,"Galmex Films, Grupo Galindo, Televicine"
Trapper County War,1989,28,"A pair of city boys get in trouble with a backwoods North Carolina family, when the boys try to stop the abuse of the family's step daughter. A pair of locals decide to step up to help the boys and the girl.",en,https://image.tmdb.org/t/p/w500/y67hs4II26M291CBEy7uJb9GQMS.jpg,3.5,Worth Keeter,
Triumph of the Spirit,1989,"18, 10752","During World War II, Salamo Arouch, a passionate boxer, is arrested and sent to a concentration camp. Soon, he is forced to box against his fellow prisoners for the sake of entertainment.",en,https://image.tmdb.org/t/p/w500/dxaSARmpCiFOCaxwGvjYAXMYPE4.jpg,6.6,Robert M. Young,Nova International Films
