Title,Year,Genre,Plot,Language,Poster,IMDBRating,Director,Production
A Step,1988,18,Romantic love story of Russian physician Gusev and Japanese woman Keiko takes place in time of fighting of Russian and Japanese scientists against poliomyelitis epidemic broken out in Japan in 1959.,ru,https://image.tmdb.org/t/p/w500/815gfwA35U7Sy2SSu2j72gB4bcd.jpg,6.3,Aleksandr Mitta,"Sovinfilm, Shigoto Film Production, Mosfilm"
I Am Sorry,1989,,"Carole and Mandy have just become neighbors in a luxury apartment complex. Mandy is a successful career woman, educated and independent. Carole is a kept woman, dreaming of the day when her businessman lover will divorce his wife to marry her. Through Mandy, Carole meets Edgar, a neurotic headwaiter. She breaks off her affair with the businessman, but Edgar is still masochistically involved with his old girlfriend Alice. Carole realizes that she still has a lot to learn about life. And nothing is going to stop her from learning it.",cn,https://image.tmdb.org/t/p/w500/bOYh6Y72iQSMi6B7Ry2UKboi6I9.jpg,5.8,Tony Au Ting-Ping,
The Yuppie Fantasia,1989,"35, 10749","Marital ups and downs and extramarital flings provide the background to this uproarious tale of life in an advertising agency. Yuppie ad-man Leung Foon separates from his similarly career-focused wife Ann, tries to get back together with his former girlfriend, and flirts with his woman boss, before questioning whether he was better off where he started.",cn,https://image.tmdb.org/t/p/w500/zKGb7g5flaoT6edeUmNamxxdcI6.jpg,6.2,Gordon Chan,"Maxi Harvest Film's Production Ltd., Paragon Films Ltd."
Sleepaway Camp III: Teenage Wasteland,1989,"35, 27","Psychotic Angela is itching to do what she does best: slaughter dozens of teenage campers. As luck would have it, the previous site of her murders has been renamed and converted into an experimental summer camp meant to bring together privileged and lower-class teens. On the day the youths are boarding the buses to camp, Angela runs over a potential camper with a garbage truck and assumes her identity. Once she has infiltrated the camp, the real terror begins.",en,https://image.tmdb.org/t/p/w500/qladM9OMuGWfj2hdoj8NBpScLg9.jpg,5.434,Michael A. Simpson,Double Helix Films
The Servant,1988,18,Multiple-value and tangled relationships between servant and boss... Imperceptible displacement of recognizable reality... Metaphysical dimension of our lives...,ru,https://image.tmdb.org/t/p/w500/nYD3Nf4Ef11aF7u2BattCMLe0Bt.jpg,5.1,Vadim Abdrashitov,Mosfilm
Whirlwind,1989,"28, 18","In this heavyhanded political allegory, set in the plains and mountains of Central Asia, a tribe of people led by the fanatical Mavrut (Vladimir Msrian) wanders about in the most desolate parts of this already desolate region in search of a mythical ""Land of Happiness."" Their quest is hampered by the fact that they must all live a life which is extremely ascetic. One tribeswoman expresses a desire to have a child, but is rebuked by being reminded that she has vowed never to have worldly ties that would distract her from the quest. When she has a child anyway, she and her lover are made to pay for this crime in a horrific way. Despite that, the child becomes a kind of holy mascot for the group, touted by the leader as a kind of savior. They are distressed when the child goes missing one day, only to appear mysteriously on the opposite side of the rapids of a river, beckoning to them.",ru,https://image.tmdb.org/t/p/w500/ln9JVHMYVImdqYdpDwpPa7gbYii.jpg,0,Bako Sadykov,Tajikfilm
Ein Sohn aus gutem Hause,1988,18,,de,N/A,0,Karin Brandauer,
A Soldier's Tale,1988,"10749, 10752, 18","In the days following the D-Day invasion in Normandy, France, a British platoon leader named Saul (Gabriel Byrne) and his corporal (Paul Wyett) reach an isolated farmhouse and encounter a beautiful French girl named Belle (Marianne Basler). Love blooms between Saul and Belle, but the grim realities of war catch up with them when a French Resistance trio claims that Belle is a Nazi collaborator. Judge Reinhold appears briefly as the token Yank.",en,https://image.tmdb.org/t/p/w500/jFkbUcYCmGZ57g9wvoiVxbiHOuD.jpg,4,Larry Parr,Mirage Atlantic
Una ombra en el jardí,1989,"9648, 18",,es,https://image.tmdb.org/t/p/w500/xBCQpTJ7GI4S1Nukod9gWSSfBVN.jpg,0,Antonio Chavarrías,Quasar S.A.
The Lead,1989,"28, 36, 53","Tehran, 1948. A young Jewish couple, Danial and his wife Munes, decide to immigrate to the recently founded state of Israel. But their application is rejected on the ground of the documents against Danial's uncle, Yaghub, how is suspected of betrayal. A Zionist agent, named Yezghel, finds out Yaghub's home and stabs him. One of Yaghub's neighbours who witnesses the crime is blamed for murder. Fearing for their lives, Munes and Danial escape to the north of Iran in order to leave the country. The Neighbour's brother, Nuri, a journalist, sets off on their heels to bring them to the court to give testimony on his brother's innocence.",fa,https://image.tmdb.org/t/p/w500/2YMEIqY1sVppIVjAXcvT89ZnNmG.jpg,5.8,Masoud Kimiai,
Sortis de route,1988,18,"After a car accident, a twelve years old boy had to take care of his younger sister and their dog as they are lost in the Moroccan desert.",fr,N/A,0,Bruno Mattei,"Strawberry Films, Alcinter"
Splendor,1989,35,"Splendor is the name of an old movie theater managed by Jordan (Mastroianni), who inherited it from his father. The theater is in decay and only generates debts and trouble, but Jordan gets aid in his almost quixotian quest from projectionist Luigi (Troisi) and ushurette Chantale (Vlady). However, Jordan is finally forced to sell the Splendor to businessman Lo Fazio (Piperno), which plans to transform it in some kind of furniture store. When Jordan leaves the theater for the last time (the very first scene), he recalls the glorious days of Splendor and movies in general.",it,https://image.tmdb.org/t/p/w500/83j7YRrgNQev6lexFX7hg8RmxRc.jpg,6.5,Ettore Scola,"Gaumont, Cecchi Gori Group Tiger Cinematografica, Studio El"
Sternberg - Shooting Star,1988,35,"Sternberg lands with his parachute in the bed of a stewardess, in the car of an airport employee and finally on a freeway service area. There he meets Harry. Harry is blind and he joins Sternberg who is looking for his Hedi. Together they land in the flat of the model married couple, Alf and Evy. With his appearance he upsets the day-to-day life of the couple.",de,https://image.tmdb.org/t/p/w500/6gfv1hLlCbsNkF5D5qCkYi1Lbes.jpg,3.375,Niki List,Wega Film
Светлая личность,1989,35,,ru,https://image.tmdb.org/t/p/w500/fbSGbHVZPPJ95R7MjCOVj8sajHB.jpg,4.7,Aleksandr Pavlovskiy,Odessa Film Studio
The Seventh Letter,1989,,"Some time ago Gerardo knew another man of the same age called Berardo. When he said the name, Berardo expressed his oppinion violently, saying that the «G» was owed him and that Gerardo, since he owned it had somehow stolen something from him.  Berardo then tries to get something back which soon goes beyond a baptismal name. Gerardo whitnesses this strange spectacle of himself as a place where, after Berardo, other people try to get something back, something that escapes them about themselves. Three women - Adália, Miranda and Virgínia - are whitnesses to this game",pt,https://image.tmdb.org/t/p/w500/buTXP2gkDMwPYMsqYyN96mK3iIx.jpg,0,Simao Dos Reis,
A Taste of Hemlock,1989,"53, 27, 9648",A loner answers a simple newspaper ad and finds himself framed for murder.,en,https://image.tmdb.org/t/p/w500/hk9oWIPq4zF10XtygT1u9jCYLyL.jpg,0,Geoffrey Darwin,
Teen Vamp,1989,"35, 27","An unimpressive, boring high-school geek is bitten and contracts vampirical symptoms, transforming him into a confident coolio.",en,https://image.tmdb.org/t/p/w500/vEp7N8xbcj3ZsQcDgXM51vXqz0D.jpg,3.4,Samuel Bradford,Jim McCullough Productions
The Terror Within,1989,"27, 878","Experiments in biological warfare have destroyed all but a few remnants of the human race. Alone in a lab, eight students work feverishly to create a vaccine before they are forced outside in search for food. It is then that the surviving scientists discover creatures mutated by the plague. Now they prepare to do battle against their worst fear: The Terror Within.",en,https://image.tmdb.org/t/p/w500/rJRd9qUoNpW0BOcYcZRLhvZS1z.jpg,4.3,Thierry Notz,Concorde Pictures
Tetsuo: The Iron Man,1989,"27, 878","A ""metal fetishist"", driven mad by the maggots wriggling in the wound he's made to embed metal into his flesh, runs out into the night and is accidentally run down by a Japanese businessman and his girlfriend. The pair dispose of the corpse in hopes of quietly moving on with their lives. However, the businessman soon finds that he is now plagued by a vicious curse that transforms his flesh into iron.",ja,https://image.tmdb.org/t/p/w500/zeoILvZbBIdxDSRguP2UuZXCHOy.jpg,7,Shinya Tsukamoto,Kaijyu Theater
Thank You Satan,1989,,"Nathalie Monnier is 14, her parents are splitting up, and what's worse, their apartment is going to be put up for sale. Just about everything in her life is about to be shattered. So it makes a bit of sense that she is receptive to the possibility of selling her soul for the chance to keep all this from happening. Just as her parents are (of course) getting back together, she wins the lottery and is able to buy their old apartment.",fr,https://image.tmdb.org/t/p/w500/ib2q0Ig7wZhk9nVhq2t1T22lvJ7.jpg,0,André Farwagi,
Tichý společník,1988,18,,cs,N/A,0,Zdeněk Flídr,Česká televize
"Tragedy, Rock Style",1989,"80, 18","Vitya is a teenage rock-music and motorbike fanatic whose father is arrested for embezzlement. Vitya is devastated, and in this state of shock he falls prey to a supposed mystic called Cassius.",ru,https://image.tmdb.org/t/p/w500/2BXOMMLfok92EcKDaLu17vOpFCA.jpg,4.4,Savva Kulish,"Mosfilm, Vremya"
Twister,1989,"18, 35","An oddball family on a Kansas farm are trapped in their farmhouse by an impending storm. The patriarch of the clan is a retired soda pop tycoon. He is currently dating a children's TV evangelist. Also living at the farm is his layabout daughter and her precocious 8 year old daughter, his would-be artist son, the son's fiancée, and the black maid. Also thrown into the mix is the daughter's ex-husband, a ne-er-do-well who is seeking to get back in his ex-wife's good graces.",en,https://image.tmdb.org/t/p/w500/f3Wf4mR6SmqzLae7extudBfpL4b.jpg,5.5,Michael Almereyda,Vestron Pictures
Two to Tango,1989,53,"Jim Conrad, a reluctant hitman, is ordered to Buenos Aires to complete one last contract. The task becomes complicated when the intended victim proves to be a well-protected man accompanied by a beautiful mistress who has caught Conrad's eye.",en,https://image.tmdb.org/t/p/w500/kbKe0Q09hrsQzhYLqtcc2XpDM3F.jpg,2,Héctor Olivera,"Concorde-New Horizons, New Horizons Picture, Aries Cinematográfica Argentina"
The Understudy: Graveyard Shift II,1988,27,The macho Italian vampire Baisez appears on the set of a low-budget film about vampirism and billiards and seduces the cast and crew.,en,https://image.tmdb.org/t/p/w500/cKzMLO9VTbgmiXYserNkuHowCSO.jpg,3.4,Jerry Ciccoritti,Cinema Ventures
Brothers in Arms,1989,"53, 28","Simon, a Jewish police inspector, arrests Karim, a Muslim, in the bust of a drug smuggling cargo ship, only to realize that Karim is an undercover agent from the military intelligence, whose mission he was not aware of. The two men pursue the narc investigation, which will lead them to confront middle eastern terrorists together.",fr,https://image.tmdb.org/t/p/w500/cjqSnanFpsuylqCPZdAukvbigT4.jpg,6.8,Alexandre Arcady,"Alexandre Films, France 3 Cinéma, Société Générale de Gestion Cinématographique (SGGC)"
Up Your Alley,1989,35,"Vickie Adderly is an enterprising young newspaper reporter looking for that big story to boost her career. A chance encounter with an adventurous drifter leads her into a world she never imagined... on the streets of L.A. Suddenly, her days are filled with a cast of colorful characters, including Marilyn, an eccentric femme fatale, and a bewildered Russian. Add the attentions of a handsome admirer and it's easy to see how Vickie gets her story and a whole lot more in this charming romantic fable.",en,https://image.tmdb.org/t/p/w500/hjCcZ4sEeXGASIKK6VyzkkUrV1D.jpg,0,Bob Logan,
Wild,1988,"36, 18","1859. Exploiting the Austrian-French-Italian conflict, Kossuth sends Batiszy Kristóf back from the emigration to organize the Hungarian Legion. Batiszy's company gets into trouble, Austrians are waiting for them, Hungarian authorities chase them, people stand still. Demolition of the troop is the task of Görgényi László chief district administrator, who used to be an officer in the revolution once.",hu,https://image.tmdb.org/t/p/w500/Ae9eM9N30yocO7Pci0xv900FaqI.jpg,0,Ferenc András,
Vatanyolu – Die Heimreise,1989,18,,de,N/A,0,Enis Günay,"Pro-ject Filmproduktion, E/R Film, Frankfurter Filmproduktion GmbH, HR, Frankfurter Filmwerkstatt"
Veneno que tú me dieras,1989,35,"By a misunderstanding two employees of a pharmacy, Alberto and Juan, delivers rat poison to a client.",es,https://image.tmdb.org/t/p/w500/70GEmnIbqpAjgKpquYnLI0BmkuD.jpg,0,Mariano Ozores,
Vice Academy,1989,"28, 35","This tale tells the story of female police cadets training to join the Hollywood vice squad. During training, the toothsome rookies are assigned to infiltrate a kiddy porn operation. Next they must go undercover and join a prostitution ring.",en,https://image.tmdb.org/t/p/w500/8DuCF5lMjRGsxgNQfOldRJ4TKnL.jpg,4.5,Rick Sloane,Rick Sloane Productions
Viento de cólera,1988,12,"Two soldiers accompanied by two women enter the Baztán valley on horseback. They are deserters from the army of the Indies who are fleeing to Italy. They arrive to claim the inheritance of one of them, León de Balanza, Captain in Peru and soldier without fortune. They are looking for old Balanzategui who works the land of his ancestors. The old man's refusal to distribute the farmland's land causes a serious conflict.",es,N/A,2,Pedro de la Sota,"Bizkaia P.C., EiTB"
The Flight of the Dove,1989,,"A film team arrives at a more authentic and old square in Madrid to shoot a film. The area is full of children, working families and simple people who see the cinema as something unattainable. From his balcony, Paloma, does not lose detail of the shooting, nor of the movements of the gallant, for which he feels a strong attraction.",es,https://image.tmdb.org/t/p/w500/vmCoUhUe5BDG3tfjkEVzeUdxC6M.jpg,5.4,José Luis García Sánchez,
Waller's Last Trip,1989,18,"For many years the old Waller worked as a railwayman. After Waller is informed that ""his"" track will be closed down and that he will be retired, he walks the route for one last time and starts to remember his life along the way: Beginning in his childhood in the 1920s, he commemorates the death of his great love as well as he recalls the legal battle with his illegitimate daughter.",de,https://image.tmdb.org/t/p/w500/6DRgRucFfHBAMO2tdz0DUuRq2uJ.jpg,5,Christian Wagner,"Christian Wagner Film, BR"
War Requiem,1989,"10752, 18","During World War I, British soldier Owen is mortified by the examples of cruelty that surround him in the trenches. He combats these terrifying images by maintaining hope in his love for an army nurse. But he also begins to accept his fate as another battlefield sacrifice.",en,https://image.tmdb.org/t/p/w500/m2DvcGnf4eQs5bfttuNQLm35UtQ.jpg,6.6,Derek Jarman,"Liberty Film Sales, Anglo International Films, BBC"
Who's Afraid of the Bogeyman,1989,99,"Portrait of a private coal company in East Berlin's Prenzlauer Berg district in 1988/89. The feisty woman boss runs the business with humour and understanding. Her seven male employees respect her. To the outside world, they are all tough guys, but as they describe their jobs and personal situations, above and beyond the hard manual labour, their vulnerability starts to come to light.",de,https://image.tmdb.org/t/p/w500/nP8GUyyfNwjFizg4lwsl8PyA0fh.jpg,0,Helke Misselwitz,DEFA-Studio für Wochenschau und Dokumentarfilme
Witchery,1988,27,A student and her photographer boyfriend visit an island off of Massachusetts to research a hotel supposedly haunted by a witch.,en,https://image.tmdb.org/t/p/w500/rrXE92wmEPOrjAfGhjvjBGc2GRq.jpg,4.9,Fabrizio Laurenti,Filmirage
The Wolves of Willoughby Chase,1989,"18, 10751, 14, 878","Bonnie and cousin Sylvia, two very young children, are left at home in Willoughby Hall while their parents travel overseas. Only the servants and the prowling wolves are their companions. News arrives that Lord and Lady Willoughby are missing and an evil looking governess suddenly arrives at the hall...",en,https://image.tmdb.org/t/p/w500/xKEQOo61su0vulEp7xlL2gMoKsc.jpg,5.6,Stuart Orme,"Atlantic Entertainment Group, Zenith Entertainment"
Blood Ritual,1989,27,A woman is sacrificed and her heart is ripped out of her chest. The police are after these Satanic Cults and they have no leads. A man is released from prison and gets involved in fighting this cultist with a friend and a female singer.,cn,https://image.tmdb.org/t/p/w500/naBmMyZCx1qyhkU00KPZKZuVLba.jpg,7,Yuen Ching Lee,Geniune Films
Zanzibar,1989,18,"In this ""inside look"" at French filmmaking, Marechal - who is a has-been director - a producer, Vito Catene and Camile Dor, a big-name actress, have agreed to make a film about drugs, but don't have a story, financing, or any of the other elements needed to make it. This doesn't stop them; they cobble together the financing and begin shooting anyway. The producer is very fond of the leading actress, and when she gets hooked on drugs for real in the course of shooting what he feels to be a farcical imitation of a film, he gives up his shares in the film and heads off for the back of beyond (Zanzibar) to lick his wounds. To add insult to injury, the film winds up being a critical and commercial success.",fr,https://image.tmdb.org/t/p/w500/xTMiuNxT7WIbRheLUo3bJIx4pfI.jpg,4.8,Christine Pascal,"Société Générale de Gestion Cinématographique (SGGC), French Productions, Film et Vidéo Productions"
Canary Yellow,1989,"35, 18","After spending all his money buying a piece of land that was already sold to someone else, Nasrallah Madadi finds himself in trouble. To solve his money problems, he then decides to be the offender of fraud rather than its victim. Getting himself involved with a pair of criminals, he begins a crooked business selling a same yellow taxi to different buyers, only to steal it back from them and sell it again. In a fascinating portrayal of human nature, Canary Yellow follows Nasrallah through the ups and downs of his double-sided experience of crime. But will it all end with the better life for his family he hopes for?",fa,https://image.tmdb.org/t/p/w500/o33UJYYAU3HpVvZTOFowcL8lFls.jpg,4.5,Rakhshan Banietemad,
Death Cage,1988,28,It's the Wai Chai Gym versus the Hunter Gym. And the ring is a huge steel cage. No one gets out alive!,cn,https://image.tmdb.org/t/p/w500/bG4IVvijQMhgLe2LrGn8SRiCjkG.jpg,7.7,Robert Tai,"Lan Tien Motion Picture Co., Ltd., Golden Sun Films"
Kerosene Salesman's Wife,1989,18,Drama film about different lifes of twin brothers.,ru,https://image.tmdb.org/t/p/w500/oFlWYYAZFNq8EWtvLQHbQW8YCY2.jpg,4.6,Aleksandr Kaydanovskiy,Mosfilm
Spy Games,1989,"28, 35",A japanese singer believes her father has been kidnapped. She goes to Hong Kong to find him.,cn,https://image.tmdb.org/t/p/w500/7HnwDKR2eBUMcVy7OYlEYw9Ao7X.jpg,5.2,David Wu,Film Workshop
Aarhus by Night,1989,18,A biographical drama from writer and director Nils Malmros in which reality is mixed with childhood memories.,da,https://image.tmdb.org/t/p/w500/u5jH21iEhboqWdx5xdcTcoYeMY4.jpg,5.6,Nils Malmros,Per Holst Filmproduktion
Etoile,1989,"14, 9648, 10749, 53",An American ballerina arrives in Hungary to enroll in a ballet school and it soon becomes apparent that things are not what they seem.,it,https://image.tmdb.org/t/p/w500/AgezMjwwGt9bgSagC64W6C4o4xs.jpg,5.8,Peter Del Monte,"Reteitalia, Gruppo Bema"
Foreign Nights,1989,,"Leila is a university student, born and raised in Canada. However her parents still hold on to their traditional Palestinian customs, and her father will not allow her to go out after 5 p.m. This culture clash comes to a head when Leila goes to a dance audition and is chosen to be in the performance.",en,N/A,0,Izidore K. Musallam,
The 'Burbs,1989,"35, 27, 53","When secretive new neighbors move in next door, suburbanite Ray Peterson and his friends let their paranoia get the best of them as they start to suspect the newcomers of evildoings and commence an investigation. But it's hardly how Ray, who much prefers drinking beer, reading his newspaper and watching a ball game on the tube expected to spend his vacation.",en,https://image.tmdb.org/t/p/w500/vrVPAcv2njVdnkqhBwGBc7UxCjz.jpg,6.75,Joe Dante,"Universal Pictures, Imagine Entertainment, Rollins-Morra-Brezner Productions"
100 Years of Adolf Hitler – The Last Hour in the Führerbunker,1989,"35, 18, 36, 10752","On 30 April 1945, dictator Adolf Hitler, his wife Eva Braun, and prominent members of the Third Reich live out their final hour in the Führerbunker.",de,https://image.tmdb.org/t/p/w500/onqGCwvf0o6JRq5BMBiZ772DaH2.jpg,6.8,Christoph Schlingensief,
1939,1989,"18, 10752","When the war breaks out, Annika lives with her parents in Värmland, close to the border to Norway. Her cousin Harald is a dealer in the black market but has to escape from the police to Norway. Annika moves to Stockholm and gets a job as a waitress. She meets the happy-go-lucky Berit and together they have a wonderful time. She also meets a young man, Bengt, whom she marries. But almost immediately she discovers that her husband is different from the man who was courting her. Plot by Mattias Thuresson.",sv,https://image.tmdb.org/t/p/w500/1a5mL6ZnDkk0XTF7ttnAzXKRwiw.jpg,4.7,Göran Carmback,"SF Studios, Svenska Filminstitutet, SVT"
300 Miles to Heaven,1989,18,"Based on a true story dating back to 1985 when two Polish boys, a teenager and his little brother, escaped from communist Poland all the way to Sweden, hidden under a truck. In the movie, their destination has been changed to Denmark.",pl,https://image.tmdb.org/t/p/w500/3i2tszRVYsaa5CYGhOsKAWvDCbi.jpg,6.9,Maciej Dejczer,"Lise Lense-Møller Film, Trans Europe Film, Studio Filmowe Tor"
Dial Code Santa Claus,1990,"53, 27, 28, 12","Home alone with his invalid grandfather on Christmas Eve, Thomas is forced to face a department store Santa Claus who is, in fact, a deranged escapee from a nearby asylum.",fr,https://image.tmdb.org/t/p/w500/sFbHQyEmrJeSEFDOCdSybeDYWGY.jpg,6.1,René Manzor,"Garance Films, L.M. Productions, Deal"
Town Musicians of Bremen,1989,"16, 12, 35","Four farm animals, a donkey, a dog, a cat and a rooster, leave their home to become musicians in Bremen. Based on the tale of the Brothers Grimm.",es,https://image.tmdb.org/t/p/w500/4D6b7uzEnQDjtiKeLiF8OYvpIfd.jpg,7.3,Cruz Delgado,
80cm 5t,1989,99,"Karl Prantl, the main character in the film, is one of the leading figures of Austrian art. As a sculptor - as one who shapes stones - he has produced an oeuvre of rare consistency and coherence, created out of an awareness of the fundamental concerns and utterances of man.",de,https://image.tmdb.org/t/p/w500/1s46ATsmNGuGQHffiHcZ4s0xflL.jpg,0,Michael Pilz,Michael Pilz Filmproduktion
84C MoPic,1989,10752,An Army cameraman is embedded with a reconnaissance patrol and charts their mission across territory controlled by the North Vietnamese.,en,https://image.tmdb.org/t/p/w500/vu5zyYcQlUJmGJzzUnrrXKsxnKd.jpg,6.3,Patrick Sheane Duncan,"The Charlie Mopic Company, Charlie Mopic"
A Wopbobaloobop a Lopbamboom,1990,18,Luxembourg in the 60s. Youngsters from France come over to a small south Luxembourg village Dudelange to party there. And looking for girls. And then starts the fighting. Teenager love and rock 'n roll.,lb,https://image.tmdb.org/t/p/w500/lbSKSxDorf81PdaHpoNyObJc4Mo.jpg,6.7,Andy Bausch,"Fonds Culturel National, Frankfurter Filmproduktion GmbH, Visuals-Productions, ZDF"
"Water, Wind, Dust",2000,18,"A young teenager returns home after an absence to find his village in Iran deserted because of an incredibly severe drought. He begins a search to find his family, traveling through an amazingly bleak and desolate landscape. Primarily an essay on the issue of humans vs. nature, the film is of interest for technical and cultural reasons.",fa,https://image.tmdb.org/t/p/w500/uTB9PCGYIHPwsBtDEAU0wfnDGPE.jpg,5.7,Amir Naderi,"Channel One, Islamic Republic of Iran Broadcasting Channel"
Aag Se Khelenge,1989,,"While trying to arrest a gangster, a police officer joins hands with Johnny, one of the gangster's men who claims to be an undercover police officer himself.",hi,https://image.tmdb.org/t/p/w500/wNajbvHGoATbv5wbxM5TU0SCmQ1.jpg,8.2,Subhash Ghai,
Abhimanyu,1989,"28, 35, 18","Manu, a poor farmer, insists Pannalal to marry his sister, Tulsi, after he molests her. When he refuses, Manu resorts to a trick to avenge the insult.",hi,https://image.tmdb.org/t/p/w500/6UzUBDPss6RM0CnBx8HOmNArgvn.jpg,4,Tony Juneja,"NH Studioz, Navjeevan Productions"
The Abyss,1989,"12, 28, 53, 878","A civilian oil rig crew is recruited to conduct a search and rescue effort when a nuclear submarine mysteriously sinks. One diver soon finds himself on a spectacular odyssey 25,000 feet below the ocean's surface where he confronts a mysterious force that has the power to change the world or destroy it.",en,https://image.tmdb.org/t/p/w500/8NMEf8D2v85bQ6VNvexTqI9tVvG.jpg,7.348,James Cameron,"20th Century Fox, Pacific Western"
