Title,Year,Genre,Plot,Language,Poster,IMDBRating,Director,Production,Error
The Tale of Despereaux,2008,"12, 16, 10751","Once upon a time... in the far away kingdom of Dor... lived a brave and virtuous mouse with comically oversized ears who dreamt of becoming a knight. Banished from his home for having such lofty ambitions, Despereaux sets off on an amazing adventure with his good-hearted rat friend Roscuro, who leads him, at long last, on a very noble quest to rescue an endangered princess and save an entire kingdom from darkness.",en,https://image.tmdb.org/t/p/w500/6bBzgQ1uJabDHeGR9QvKrHvHYzG.jpg,6.096,Robert Stevenhagen,Larger Than Life Productions,
West of Brooklyn,2008,"18, 35, 10749",An Italian American street kid with a secret passion for poetry is a fish out of water in LA. Only the love of his family and a rich girl from the other side of the tracks can help him find the courage to be himself and find a place to call home.,en,https://image.tmdb.org/t/p/w500/squXbGE3IA2CYTgkf8vcEQum3SN.jpg,5,Danny Cistone,,
Street Kings,2008,"28, 80, 18, 53","Tom Ludlow is a disillusioned L.A. Police Officer, rarely playing by the rules and haunted by the death of his wife. When evidence implicates him in the execution of a fellow officer, he is forced to go up against the cop culture he's been a part of his entire career, ultimately leading him to question the loyalties of everyone around him.",en,https://image.tmdb.org/t/p/w500/csXyZ1BsDBlH0PXkOFWxggEf9WF.jpg,6.6,David Ayer,"Fox Searchlight Pictures, Regency Enterprises, Dune Entertainment III, Yari Film Group (YFG), EFO Films",
The Curious Case of Benjamin Button,2008,"18, 14, 10749","Born under unusual circumstances, Benjamin Button springs into being as an elderly man in a New Orleans nursing home and ages in reverse. Twelve years after his birth, he meets Daisy, a child who flits in and out of his life as she grows up to be a dancer. Though he has all sorts of unusual adventures over the course of his life, it is his relationship with Daisy, and the hope that they will come together at the right time, that drives Benjamin forward.",en,https://image.tmdb.org/t/p/w500/26wEWZYt6yJkwRVkjcbwJEFh9IS.jpg,7.589,David Fincher,"Paramount Pictures, Warner Bros. Pictures, The Kennedy/Marshall Company",
McCartney's Genes,2008,35,"When he learns that his sperm may be defective, small-time rock vocalist Alex (Hamilton von Watts) decides to father a child before it's too late -- if not with his reluctant wife, Jules (Keri Safran), then with his beautiful manager, Claudia (Lisa Sheridan). But when his band gets a shot at the big time, dad-to-be Alex discovers that he's bitten off more than he can chew. This comedy from director Jason S. Dennis also stars Spencer Gibb.",en,N/A,5.5,Jason S. Dennis,,
Heart of a Dragon,2008,18,"In an instant their lives were changed forever. Now on an adventure half way across the world, four friends search for answers that will lead them to the Great Wall of China - pushing their friendships to the limits. To survive a journey that will save or destroy their lives will take the Heart of a Dragon",en,N/A,5.75,Michael French,"Thunder Bay Films, China Film Group",
Get Smart,2008,"28, 35, 53","When members of the nefarious crime syndicate KAOS attack the U.S. spy agency Control and the identities of secret agents are compromised, the Chief has to promote hapless but eager analyst Maxwell Smart to field agent. He is partnered with veteran and capable Agent 99, the only spy whose cover remains intact. Can they work together to thwart the evil world-domination plans of KAOS and its crafty operative?",en,https://image.tmdb.org/t/p/w500/sZUjbtUS8qxXp4mj90evnqPJqX7.jpg,6.196,Peter Segal,"Mosaic Media Group, Mad Chance, Callahan Filmworks, Warner Bros. Pictures, Village Roadshow Pictures",
Glow Ropes: The Rise and Fall of a Bar Mitzvah Emcee,2008,35,"Enthusiastic emcee Taylor James (Tim Peper) leaves behind his home state of New Jersey when party planner Vanessa Dupree (Judy Reyes) hires him to work the busier New York City bar mitzvah scene. Tutored by slick Manhattan emcee Sebastian (George Valencia), Taylor spices up his wardrobe and becomes a more clever showman. Soon, he's a bar mitzvah celebrity. But when he has a disastrous problem with his glow-in-the-dark props, his career heads in another direction.",en,https://image.tmdb.org/t/p/w500/jLwqdNme3iitgMXPygbRU1uQOAp.jpg,0,Edwin Figueroa,Hellish Films,
Red Cliff,2008,"12, 18, 36, 28, 10752","In 208 A.D., in the final days of the Han Dynasty, shrewd Prime Minster Cao convinced the fickle Emperor Han the only way to unite all of China was to declare war on the kingdoms of Xu in the west and East Wu in the south. Thus began a military campaign of unprecedented scale. Left with no other hope for survival, the kingdoms of Xu and East Wu formed an unlikely alliance.",zh,https://image.tmdb.org/t/p/w500/dBk76uAeIsjGaJINUzIlKZOoVpi.jpg,7.1,John Woo,"Lion Rock Productions, Showbox, Beijing Film Studio, Avex Entertainment, CMC Entertainment, Shanghai Film Group, Emperor Multimedia Group, China Movie Channel, Summit Entertainment, Beijing Jinyinma Movie & TV Culture Co., Beijing Forbidden City Film, Red Cliff Korea Investment, Chengtian Entertainment, Bona Film Group, China Film Group Corporation",
Wrestling,2008,"18, 10749","In the summer between high school and college, a group of kids try to gain control of their relationships, emotions and lives for the first time.",en,N/A,2.5,Jeremy O'Keefe,Going Digital Films,
Superhero Movie,2008,"35, 28, 878","Rick Riker is a nerdy teen imbued with superpowers by a radioactive dragonfly. And because every hero needs a nemesis, enter Lou Landers, aka the villainously goofy Hourglass.",en,https://image.tmdb.org/t/p/w500/4MtvQdh5VP7jMSydhggp1P80FMj.jpg,5.2,Craig Mazin,"Dimension Films, Craig Mazin Company, The Weinstein Company, Metro-Goldwyn-Mayer",
Half-Life,2008,"18, 878","As troubling signs of global cataclysms accelerate, a brother and sister react to their father's desertion and the powerful presence of their mother's new boyfriend.",en,https://image.tmdb.org/t/p/w500/vKePliwZuwIdgw08ed37f73Z4DF.jpg,5.2,Jennifer Phang,"Fade to Blue Films, Mark E. Lee Productions, Lane Street Pictures",
American Carny: True Tales from the Circus Sideshow,2008,99,"Join Carnival Maestro Todd Robbins and award-winning filmmaker, Nick Basile, on a journey into a world of circus freaks, fire eaters, human blockheads, contortionists, professional lunatics and much, much more.",en,https://image.tmdb.org/t/p/w500/7lE9XtRzvqci48MDkcyDVcxaLq8.jpg,6,Nick Basile,,
Beneath the Mississippi,2008,"53, 27",A documentary filmmaker and her crew fight the elements and try to cope with their fears as they seek to understand the strange mystery of a flooded island where hundreds have died.,en,https://image.tmdb.org/t/p/w500/8AoSsxe3CY25VykV03fCrkfwyM8.jpg,2,Lonnie Schuyler,,
The Women,2008,"35, 10749","The story centers on a group of gossipy, high-society women who spend their days at the beauty salon and haunting fashion shows. The sweet, happily-wedded Mary Haines finds her marriage in trouble when shop girl Crystal Allen gets her hooks into Mary's man.",en,https://image.tmdb.org/t/p/w500/iFQrK0NHA4OMAvzyJVW4DA0kAFz.jpg,5.1,Diane English,"Jagged Films, Inferno Distribution, Shukovsky English Entertainment",
Beautiful Losers,2008,99,This documentary follows the lives and careers of a collective group of do-it-yourself artists and designers who inadvertently affected the art world.,en,https://image.tmdb.org/t/p/w500/9gllAA4UnQWQVkpe2RVXTOMr90P.jpg,6.5,Aaron Rose,"Perception Media, Sidetrack Films, Blacklake Productions, Oscilloscope",
Role Models,2008,35,"Two salesmen trash a company truck on an energy drink-fueled bender. Upon their arrest, the court gives them a choice: do hard time or spend 150 service hours with a mentorship program. After one day with the kids, however, jail doesn't look half bad.",en,https://image.tmdb.org/t/p/w500/d5SatGKWi0VpO9QX0Z74zLh9i91.jpg,6.5,David Wain,"WideAwake Pictures, Universal Pictures, Relativity Media, Stuber/Parent, New Regency Pictures",
Go with Peace Jamil,2008,"28, 18, 80","An Arabic tale that takes place in Scandinavia. About ancient religious hatred, about love, punishment, guilt and redemption, about being responsible for one's own actions and refusing a path of violence. Jamil stands in the middle. He is fighting the war of his life; a war within himself.",en,https://image.tmdb.org/t/p/w500/r9N0xPXZCw492LwEE6zecHoxwwY.jpg,5.8,Omar Shargawi,Zentropa Entertainments,
Keith,2008,"18, 10749","Natalie is high school royalty, but her queen bee status falls apart when she falls for the new guy at school. Although Keith ignores her at first, they soon become friends -- even though Natalie suspects that Keith has something to hide. As the free-spirited Keith shows Natalie how to embrace what life offers, they grow closer -- until a secret tests the bounds of their relationship",en,https://image.tmdb.org/t/p/w500/P9WAFA0yM7eqoxF7cSdOtPsYX3.jpg,7.088,Todd Kessler,Image Entertainment,
Good,2008,18,"When John Halder's latest novel is enlisted by powerful political figures in the Nazi party to push their agenda, his career and social standing instantly advance. But after learning of the Reich's horrific plans for the future and the devastating effects they will have on people close to him, John must decide whether or not to take a stand and risk losing everything.",en,https://image.tmdb.org/t/p/w500/AgNssumEnPaT6kzzJyj4oLypOOG.jpg,6.194,Vicente Amorim,"Good Films Collective, Miromar Entertainment",
Tulpan,2009,"18, 10749, 35","Asa, a young and cheerful dreamer, returns from his Russian naval service to his sister’s nomadic family on the desolate Hunger Steppe of central Asia, so that he can begin his own life as a shepherd. But before he can tend a flock of his own, Asa must first win the hand of the only eligible girl for miles—his mysterious neighbor, Tulpan.",kk,https://image.tmdb.org/t/p/w500/p6LMvGgoL5pEDJtUJuuFPt9SCDP.jpg,6.3,Sergei Dvortsevoy,"Pandora Film, Cobra Film, CTB Film Company, ARTE, BIM Distribuzione, Bundesamt für Kultur (BAK), Filmcontract Ltd., Pallas Film, Slovo",
Himmerland,2008,"80, 18, 53",An American travels to Europe to unravel the mystery surrounding his sister's death.,da,https://image.tmdb.org/t/p/w500/jMhS2yDISzC7WqQzZ9MSsYFrrE7.jpg,4.5,James Barclay,Radiator Film ApS,
The American Standards,2008,18,"At a crossroads in his life, Doc Jennings goes home to celebrate his mother's birthday and uncovers dramatic family secrets. Lies, affairs and afflictions bubble to the surface of his seemingly perfect family. Can they come back together or is it too late?",en,N/A,2,Joe Wehinger,"Skinny Giraffe films, Louisiana Production Capital",
Death's Door,2008,27,"When a television psychic begins to get real results, the cast and crew of the show find themselves trapped by vengeful spirits.",en,https://image.tmdb.org/t/p/w500/wW4q7eyGpqjQhdEG7d96GzqG0De.jpg,4.6,George Scileppi,"Reality Entertainment, Death's Door Productions",
Kung Fu Panda,2008,"28, 12, 16, 10751, 35","When the Valley of Peace is threatened, lazy Po the panda discovers his destiny as the ""chosen one"" and trains to become a kung fu hero, but transforming the unsleek slacker into a brave warrior won't be easy. It's up to Master Shifu and the Furious Five -- Tigress, Crane, Mantis, Viper and Monkey -- to give it a try.",en,https://image.tmdb.org/t/p/w500/wWt4JYXTg5Wr3xBW2phBrMKgp3x.jpg,7.3,Mark Osborne,DreamWorks Animation,
Restraint,2008,"18, 53",Two fugitives land in hot water when they take a hostage who poses a threat to their well-being.,en,https://image.tmdb.org/t/p/w500/2bguGmptNflshQgBdDimIlt028b.jpg,6,David Denneen,"Filmgraphics Entertainment, Australian Film Finance Corporation",
Stick It in Detroit,2008,35,"Chaos rules while factory worker Todd Kennedy is forced to choose between accepting a lucrative out of state job promotion or staying in Detroit. His indecision leaves him searching for answers from his highly dysfunctional friends Justin Rose, Scott Nelson, Matt Wojo, Gary Reiley, Lisa Brooks, Hot Rod Johnson and Mr. Willoughby.",en,https://image.tmdb.org/t/p/w500/ij1xKicAESDFYg3L98r7uhDXak4.jpg,0,Robert Daniel Phelps,Stick It in Detroit LLC,
Vantage Point,2008,"18, 28, 53, 80","During an historic counter-terrorism summit in Spain, the President of the United States is struck down by an assassin's bullet. Eight strangers have a perfect view of the kill, but what did they really see? As the minutes leading up to the fatal shot are replayed through the eyes of each eyewitness, the reality of the assassination takes shape.",en,https://image.tmdb.org/t/p/w500/9xA1KaGoYQJveY3C87J41Au5Kkn.jpg,6.399,Pete Travis,"KanZaman Productions, Relativity Media, Original Film, Art In Motion, Columbia Pictures",
Autopsy,2008,"27, 53","Emily Johnson, her boyfriend Bobby and their friends Clare and Jude are recent college grads driving cross-country, taking a last vacation together before they face the ""real"" world. An accident leaves them hurt and stranded on a lonely Louisiana road. When the ambulance arrives, it whisks them to Mercy Hospital.",en,https://image.tmdb.org/t/p/w500/wbjxIB8RFN5j2Wl2JftRQtKnJtZ.jpg,4.9,Adam Gierasch,"Project 8 Films, Lion Share Productions, FlipZide, Voodoo Production Services, Parallel Media, A-Mark Entertainment",
Crazy,2008,"10402, 18, 10749","Crazy is the story of a legendary guitar player who emerged from Nashville in the 1950s. Blessed with incomparable, natural talent, Hank Garland quickly established his reputation as the finest sessions player in Nashville.",en,https://image.tmdb.org/t/p/w500/yzUc0Z0S2Rclvf4nVMey7mZOpy0.jpg,5.5,Rick Bieber,FN Crazy Film LLC,
Guest of Cindy Sherman,2008,99,"Videographer Paul H-O must confront issues of ego and identity when he begins a relationship with the reclusive Cindy Sherman. With unprecedented access, the documentary places us in the company of the artist and offers a critique of the ever-inflated New York art market and the culture of celebrity. Written by Anonymous",en,https://image.tmdb.org/t/p/w500/sVrbuABdC9rdbEpuZ2LizFqSBMw.jpg,6.2,Paul Hasegawa-Overacker,CreativeChaos vmg,
Killshot,2008,"80, 18, 53","Beautiful Carmen Colson and her ironworker husband Wayne are placed in the Federal Witness Protection program after witnessing an ""incident"". Thinking they are at last safe, they are targeted by an experienced hit man and a psychopathic young upstart killer.",en,https://image.tmdb.org/t/p/w500/ckUhio8KhGDcvFV7g34kYjVLEEW.jpg,5.8,John Madden,"The Weinstein Company, FilmColony, Lawrence Bender Productions",
Something's Wrong in Kansas,2008,,"When a young pledge dies during initiation, her sister and brother conspire to have their revenge on the reckless college students responsible for her death.",en,N/A,0,N/A,,
"10,000 BC",2008,"12, 28, 18, 14",A prehistoric epic that follows a young mammoth hunter's journey through uncharted territory to secure the future of his tribe.,en,https://image.tmdb.org/t/p/w500/9I7gV6wRbGnbfI3XOKjHeLMjYEo.jpg,5.485,Roland Emmerich,"Centropolis Entertainment, Legendary Pictures, The Department of Trade, Industry and Competition of South Africa, Moonlighting Films, Warner Bros. Pictures",
Tracing Cowboys,2008,18,A young Englishman obsessed with Cowboys and becoming a Country and Western singer travels down to Mexico in search of his missing girlfriend during the festival of The Day Of The Dead.,en,https://image.tmdb.org/t/p/w500/atprhMfEjT2ddpMxWV1OsE4J421.jpg,0,N/A,,
The X Files: I Want to Believe,2008,"9648, 878, 53","Six years after the events of The X-Files series finale, former FBI agent Doctor Dana Scully is now a staff physician at Our Lady of Sorrows, a Catholic hospital, and treating a boy named Christian who has Sandhoff disease, a terminal brain condition. FBI agent Drummy arrives to ask Scully’s help in locating Fox Mulder, the fugitive former head of the X-Files division, and says they will call off its manhunt for him if he will help investigate the disappearances of several women, including young FBI agent Monica Banan.  Mulder and Scully are called back to duty by the FBI when a former priest claims to be receiving psychic visions pertaining to a kidnapped agent.",en,https://image.tmdb.org/t/p/w500/3zQMhutUMJP6lK49x7i2YfsOHL9.jpg,5.8,Chris Carter,"Ten Thirteen Productions, Dune Entertainment III, Crying Box Productions, 20th Century Fox",
The Burrowers,2008,"27, 37","It is 1879 in the Dakota Territories, a band of men who set out to find and recover a family of settlers that has mysteriously vanished from their home. Expecting the offenders to be a band of fierce natives, but they soon discover that the real enemy stalks them from below.",en,https://image.tmdb.org/t/p/w500/vLUjy4CiPRdbSY8ds8JtBExt2Fh.jpg,5.9,J.T. Petty,Blue Star Pictures,
Disgrace,2008,18,"Disgrace is the story of a South African professor of English who loses everything: his reputation, his job, his peace of mind, his good looks, his dreams of artistic success, and finally even his ability to protect his cherished daughter. After having an affair with a student, he moves to the Eastern Cape, where he gets caught up in a mess of post-apartheid politics.",en,https://image.tmdb.org/t/p/w500/xCM4H72gaXGXvJKcocAx8LKxaQC.jpg,6.3,Steve Jacobs,,
Deal,2008,"35, 18","As an ex-gambler teaches a hot-shot college kid some things about playing cards, he finds himself pulled into the world series of poker, where his protégé is his toughest competition.",en,https://image.tmdb.org/t/p/w500/zm1FN17vlQb3h5RdQfjPzNvDLWe.jpg,5.3,Gil Cates Jr.,"Andertainment Group, Crescent City Pictures, Tag Entertainment",
The Gamers: Dorkness Rising,2008,"12, 35, 14","All Lodge wants is for his gaming group to finish their adventure. Unfortunately, they're more interested in seducing barmaids, mooning their enemies, and setting random villagers on fire. Desperate to rein in his players, Lodge injects two newbies into the party: a non-player character controlled by Lodge, who the power gamers immediately distrust, and the rarest gamer of all -- a girl.",en,https://image.tmdb.org/t/p/w500/oHNTGK27PG1qe2N1xM3MW7xizEc.jpg,6.8,Matt Vancil,"Dead Gentlemen Productions, Zombie Orpheus Entertainment",
Dimples,2008,"27, 9648","On a Saturday morning, Frances jolts awake from a frightening dream. That afternoon, while on a road trip with four friends, a bizarre chain of events leads her to a secluded house where a little girl lives with a man she refers to only as, ""The Doctor"". Here, Frances uncovers grisly horrors the little girl is subjected to and as Frances fights to save her young soul, her friends fight to save themselves from the monster the doctor has created.",en,N/A,3.6,Dusty DePree,,
South of Heaven,2008,"18, 35, 80","A man returning from a tour of duty is mistaken for his brother by debt-collecting gangsters, while the brother goes on a killing and kidnapping spree with a loose-cannon convict.",en,https://image.tmdb.org/t/p/w500/eYZEpqQVIhBG0caDu8dhOb6sEYQ.jpg,3.7,J. L. Vara,,
Hancock,2008,"14, 28","Hancock is a down-and-out superhero who's forced to employ a PR expert to help repair his image when the public grows weary of all the damage he's inflicted during his lifesaving heroics. The agent's idea of imprisoning the antihero to make the world miss him proves successful, but will Hancock stick to his new sense of purpose or slip back into old habits?",en,https://image.tmdb.org/t/p/w500/7DyuV2G0hLEqHeueDfOqhZ2DVut.jpg,6.349,Peter Berg,"Columbia Pictures, Relativity Media, Blue Light, Weed Road Pictures, Overbrook Entertainment",
Bitter & Twisted,2008,"35, 18",A family drifts down a spiral of self-destruction and depression in the years following the death of their eldest son. Can they come to terms with what's happened before everything falls apart?,en,https://image.tmdb.org/t/p/w500/4l7Q9YPLk99jPWQDv8Yz4jlCjmk.jpg,5.3,Christopher Weekes,"Casp Productions, Odin's Eye Entertainment",
Enloquecidas,2008,35,"Blanca confesses to her aunt Barbara she met the man of her live and he disappeared. By chance in a charming old couples house for sale, they find his picture. It's their son and he's dead. Mad Blanca and Barbara began a crazy investigation in a city underconstruction. An insecure actress, a secretery with ESP and a husband who's fed up with all the madness, will help them unravel these knot marked by humor and intrigue.",en,https://image.tmdb.org/t/p/w500/1OgaTq0EUMvRjwtNTNTDXHIAhJm.jpg,6,Juan Luis Iborra,,
The Art of Travel,2008,"28, 12, 18, 35","High school grad. Conner Layne is about to marry his first love, but when wedding plans fail, he goes solo on his honeymoon to Central America, finding adventure with a ragtag group of foreigners who attempt to cross the Darien Gap in record time.",en,https://image.tmdb.org/t/p/w500/1wZX3NitmlqBUhcHwByuyokUMRR.jpg,6.2,Thomas Whelan,,
Passengers,2008,"18, 9648, 53, 10749","After a plane crash, a young therapist, Claire, is assigned by her mentor to counsel the flight's five survivors. When they share their recollections of the incident -- which some say include an explosion that the airline claims never happened -- Claire is intrigued by Eric, the most secretive of the passengers.",en,https://image.tmdb.org/t/p/w500/mUgzf27luTXvxrzH0jKgSNPwhMC.jpg,6.11,Rodrigo García,"TriStar Pictures, Mandate Pictures, Persistent Entertainment, Intuition Films",
Jodhaa Akbar,2008,"10749, 36, 18",A sixteenth century love story about a marriage of alliance that gave birth to true love between a Mughal emperor and a Rajput princess.,hi,https://image.tmdb.org/t/p/w500/bEltVQbNJpsl9sopLVkE5z24Ssj.jpg,7.333,Ashutosh Gowariker,"UTV Motion Pictures, Ashutosh Gowariker Productions",
Punisher: War Zone,2008,"28, 80","Waging his one-man war on the world of organized crime, ruthless vigilante-hero Frank Castle sets his sights on overeager mob boss Billy Russoti. After Russoti is left horribly disfigured by Castle, he sets out for vengeance under his new alias: Jigsaw. With the ""Punisher Task Force"" hot on his trail and the FBI unable to take Jigsaw in, Frank must stand up to the formidable army that Jigsaw has recruited before more of his evil deeds go unpunished.",en,https://image.tmdb.org/t/p/w500/gxIaSGGGemqtMeEjUnGJNjj7u1p.jpg,5.8,Lexi Alexander,"Lionsgate, MHF Zweite Academy Film, Marvel Knights, Valhalla Motion Pictures, SGF Entertainment, Muse Entertainment, Marvel Studios",
Horton Hears a Who!,2008,"16, 35, 10751, 12, 14","The classic and beloved story from Dr. Seuss is now a CG animated film from 20th Century Fox Animation, the makers of the Ice Age films. An imaginative elephant named Horton (Jim Carrey) hears a faint cry for help coming from a tiny speck of dust floating through the air. Horton suspects there may be life on that speck and despite a surrounding community, which thinks he has lost his mind, he is determined to save the tiny particle! Jim Carrey and Steve Carell lead an all-star cast in bringing this wonderful family picture to life!",en,https://image.tmdb.org/t/p/w500/6k47Z3A5zI2rxubTMwiLyIqQLLr.jpg,6.491,Jimmy Hayward,"Blue Sky Studios, 20th Century Fox Animation, Dr. Seuss Enterprises, 20th Century Fox",
The Sickhouse,2008,27,"Terror lurks in the old orphanage, beneath a disused London hospital - a Seventeeth Century malevolence, the Plague Doctor, has returned to complete his evil masterpiece",en,https://image.tmdb.org/t/p/w500/yelKwdba7w4pobjx8vD8QmAdo7p.jpg,4.3,Curtis Radclyffe,"iDream Productions, Hopscotch Films",
Stone & Ed,2008,"28, 35","It's just another hazy day for STONE and his brother ED until they unwittingly discover they may not be brothers after all! With the help of their techno-savvy neighbors JEFF and PHILLIP GUY, ""The Guys,"" Stone and Ed set out on a quest to find Stone's mother, JANE DOE. After the first two Jane Does on their list don't turn out to be the one, the two less than genius brothers make their way to Mexico, and to the last Jane on the list. Along the way, this wacky duo encounters a cast of zany characters and one, out of this world adventure. By the time its all over Stone &amp; Ed will have found their way into the middle of a dangerous game of cat and mouse between Mexico's largest drug lord, SENOR GORDO, and the CIA's most incompetent agents to ever leave Langley; THE MAN IN THE YELLOW HAT and his little partner, CURIOUS JORGE. Between mistaken identities of cases, and cases of mistaken identities, Stone &amp; Ed are in for the trip of their lives.",en,https://image.tmdb.org/t/p/w500/28hAczJYfT6nwfqgg2iCEYwWXgl.jpg,1.8,Adam Meyerowitz,Flashback Entertainment,
Telling Lies,2006,53,"The morning after the night before, a rapid spiral of disastrous telephone calls chart the certain ruin of young Phil's day as he attempts to fib his way out of one scrape after another. Told entirely in animated captions.",en,https://image.tmdb.org/t/p/w500/hDVaB5k7TSW6cRNjYxgWVqQP5NK.jpg,5.3,Antara Bhardwaj,,
Palabra por palabra,2008,,,es,N/A,0,Edgardo Cabeza,INCAA,
A Year Ago in Winter,2008,18,A renowned artist must uncover a young dancer's secrets in order to truly capture her likeness for a commissioned work.,de,https://image.tmdb.org/t/p/w500/yPQwdxT2kHeJKtIERIGVFFUgstD.jpg,6.3,Caroline Link,"Bavaria Film, ARD, Constantin Film",
