Title,Year,Genre,Plot,Language,Poster,IMDBRating,Director,Production
How I Got Into College,1989,"35, 10749","High school senior Marlon Bowne is smitten with overachieving classmate Jessica Kailo. But, if he wants to have a shot with her, he'll have to find a way to get into Ramsey College, Jessica's top choice of schools. It won't be easy, since the college is highly selective and Marlon's grades are hardly impressive. That means the lovelorn teen will have to find a way to score high on the SATs and win over the college admissions committee.",en,https://image.tmdb.org/t/p/w500/hm2sHodii3Av5OLRKFr1m3hdPzw.jpg,6,Savage Steve Holland,20th Century Fox
How to Get Ahead in Advertising,1989,"14, 35, 18",Pressure from his boss and a skin-cream client produces a talking boil on a British adman's neck.,en,https://image.tmdb.org/t/p/w500/8T1UacG5YV063PDbaHH2RaqA6Wc.jpg,6.3,Bruce Robinson,"Virgin Films, Handmade Films"
Howling V: The Rebirth,1989,27,"When a group of people from different walks of life converge in a Hungarian castle situated in Budapest which has been sealed for 500 years, they bring with them a werewolf which slowly begins to cut their numbers down.",en,https://image.tmdb.org/t/p/w500/irbRWCwIB1AONKlA4VzsYRkGmrK.jpg,4.8,Neal Sundstrom,Allied Vision
Ghost Busting,1989,"35, 27","Salesmen Bangladesh and Robert once worked in countryside and came across a female ghost and a sissy ghost, but their driver was killed by the ghosts unfortunately. Bangladesh and Robert were rescued by a Taoist Master, Cheung. They were so scared that they had to find a new job. The boss of the new company, Mr. Kan, authorized his daughter to be the manageress. His son, Tin Wai, was jealous and requested various ghosts to make a mess of the company in order to usurp power. So, the staff receive special training on exorcising ghosts.",cn,https://image.tmdb.org/t/p/w500/aqUmHiNk8y4U0iUQCxaObb3b102.jpg,4,Lau Shut-Yue,Grand March Movie Production Company Ltd.
Dream of Desire,1989,"35, 10749",A situation comedy revolving around two roommates and their increasingly complicated love affairs.,cn,https://image.tmdb.org/t/p/w500/AppFW3Tx3EVEd9Ite1zrNpEVuk9.jpg,9,O Sing-Pui,"Always Good Film Co., Ltd."
Unfaithfully Yours,1989,"10749, 35","Ng Yu Hon, a henpecked husband, takes a moral holiday each year. This year he falls for his Chief Accountant. Maggie Shaw and decides to take her along to Hokkaido under the pretext of business. Ng's nalive petty clerk in the Hokkaido branch. Lau Szu-hin, a cousin to Ng's wife Tan Niu, is under pressure to arrange this for his boss. Subsequently, impressed by Maggie's serious working attitude, he decides to get her out of this clutches.",cn,https://image.tmdb.org/t/p/w500/c7mTIzpzegtJFlYz4WeLZGVexW3.jpg,0,Kin Chung Chan,D & B Films
In the Line of Duty 4,1989,"12, 28","Two detectives who are up to their necks in trouble and in each other's face, as they try to shut down a drug-trafficking scheme that could be connected with international ties to organized crime. But in the midst of their investigation, innocent immigrant dock worker Luk Wan-Ting gets caught up in the mix when he witnesses the murder of an intelligence operative and is framed for the crime.",cn,https://image.tmdb.org/t/p/w500/w3IqNotgwl8RRS17P50xCOB9EEB.jpg,7,Yuen Wo-Ping,D & B Films
The Dog That Smiled,1989,"10751, 10770, 18","Jojje, Roffe, Sivert, Lillen, Peggy and the dog King are a tight-knit group of friends. When it turns out that King is sick and soon to die, his friends decide to give him his best time.",sv,https://image.tmdb.org/t/p/w500/76R7D7eSsM9pvtAXroHTfjLujWy.jpg,7,Rumle Hammerich,MovieMakers
Avenging Trio,1989,28,"Three unemployed brothers decide to rob a bank in order to support their pregnant wives. When they're killed by the police, their wives swear revenge.",cn,https://image.tmdb.org/t/p/w500/grmi57GcRNutwipc3PY42ODAPl1.jpg,8,Cheung Gik-Laam,Jia's Motion Picture (H.K.) Co.
Club Girls,1989,"18, 28",hong kong drama,cn,https://image.tmdb.org/t/p/w500/iGADJSWograzfwEuh6Nc1lzO6dd.jpg,0,Wai Lit,
Burning Sensation,1989,"35, 27","A firefighter salvages a spiritual shrine from an old burning building, which releases the gentle ghost of a Chinese opera singer, killed in a stage fire 30 years before. Grateful for saving her, the ghost falls for the firefighter and will stop at nothing to ensure his safety from the evils that lurk ahead. At the same time, the firefighter doesn't realize he is dating a ghost.",cn,https://image.tmdb.org/t/p/w500/h9wAObM1vChjQNH6RE0buSgKS2n.jpg,4.3,Wu Ma,Bo Ho Films
A Handful of Time,1989,18,"Gothic thriller about Old Martin who heeds the voice of Anna, who calls him back to the mountain cabin where he left her to die while she gave birth to their surviving son.",no,https://image.tmdb.org/t/p/w500/4Y6oTeYocMbIXyKsfOWfY5YSAmn.jpg,5,Martin Asphaug,"Norsk Film, Svenska Filminstitutet"
I Gonna Fuck You Back to the Stoneage,1989,,"""Masculinity"" is the subject of this film. Harald, the protagonist, fails in his blind attempt to prove his masculinity at Maria's expense. The Stone Age is over. Is it really?",de,N/A,0,Gabriele Mathes,"Hochschule für Musik und darstellende Kunst, Wien"
I Want to Go Home,1989,35,"Joey Wellman, an American cartoonist from Cleveland now largely forgotten at home, visits France with his partner Lena to attend an exhibition in Paris about the comic strip (bande dessinée) which features his work. He also hopes to be reconciled with his daughter Elsie who has been a student in Paris for two years, in flight from the American culture of which she sees her father as a typical example. Elsie is naively infatuated with French literature, and is trying to secure an introduction to the brilliant university professor Christian Gauthier, an expert on Flaubert but also an enthusiast for comic books. The meeting of father and daughter goes badly, but Elsie is persuaded to join Joey and Lena for the weekend at the country house of Gauthier's mother, Isabelle. During a comic-themed masquerade party, all of the characters are made to reconsider their present and past relationships.",fr,https://image.tmdb.org/t/p/w500/iQ4bRvvQfTTnI266GfsKeFW3kA7.jpg,4.9,Alain Resnais,
"I, Madman",1989,"27, 53",A bookshop clerk starts seeing the disfigured killer from her favorite 1950s pulp novels come to life and start killing people around her.,en,https://image.tmdb.org/t/p/w500/tzkWPBdwsfD9pvWObA3CTYdrDVl.jpg,5.8,Tibor Takács,"Sarliu/Diamant, Trans World Entertainment"
Rape,1989,,Depicts the escape of a poor innocent girl fleeing from three savage rapists.,ar,https://image.tmdb.org/t/p/w500/bqnFllBjHTcjhN7oGR04Pk0EFPA.jpg,6,Ali Abdel-Khalek,
Ilaaka,1989,"28, 18","Ilaaka - has a small little world of its own. A world of dreams and desires love and longings, hatred and hardships. This is Raja who stands at the cross roads of truth and traditions.. In this small world we have Suraj and Neha, the two crusaders against the might of evil. And we have the evil incarnated too! Nagar as vicious as a viper and as blood thirsty as a wolf. Here we have good old Masterji who is ready to sacrifice himself for his tiny world. And we have cunning Swami also, who is ready to destroy everything. Ilaaka has love and laughter, blood and tears. It is as delicate as a petal and as hard as steel. Ilaaka, a painting which has all the seven colours of rainbow.",hi,https://image.tmdb.org/t/p/w500/1IHto68OAJsOKfOz2rbWPOwn2jQ.jpg,6.3,Aziz Sejawal,
Immediate Family,1989,"35, 18","Linda and Michael, married for ten years, desperately want a baby and turn to an adoption agency which introduces them to Lucy, a teenage girl expecting her first baby. The three agree that Linda and Michael will adopt Lucy's baby and that Lucy will sign away custody. Things don't go quite to plan however..",en,https://image.tmdb.org/t/p/w500/reQw2irRqjbqYNJx1AqOzsXItJk.jpg,6,Jonathan Kaplan,"Columbia Pictures, Sanford/Pillsbury Productions"
Imorron och imorron och imorron,1989,99,A documentary about repetition. People from different professions give their view on what repetition means to them.,sv,https://image.tmdb.org/t/p/w500/4KfzwjMiSSJTsXjRiKA2fgsob99.jpg,0,Stig Björkman,"Hagafilm, SVT"
In Country,1989,18,"Samantha Hughes, a teenaged Kentucky girl, never knew her father, who died in Vietnam before her birth. Samantha lives with her uncle Emmett, who also served in Vietnam. Emmett hangs around with Tom, Earl, and Pete, three other Vietnam vets who, like Emmett, all have problems of one kind or another that relate to their war experiences. Samantha becomes obsessed with finding out about her father.",en,https://image.tmdb.org/t/p/w500/rLyxWz5O2QfOBbqLDlloUHQyuru.jpg,5.4,Norman Jewison,Warner Bros. Pictures
On a Moonlit Night,1989,18,"An American journalist works for a French newspaper. He is writing an article about the reaction against people with AIDS, without knowing he is infected too. Once he finds out, he decides to cut off himself leaving his wife and daughter.",en,https://image.tmdb.org/t/p/w500/8S4FU0xQDbL4MecpiDd8i0Xvpzg.jpg,7.2,Lina Wertmüller,
Indiana Jones and the Last Crusade,1989,"12, 28","In 1938, an art collector appeals to eminent archaeologist Dr. Indiana Jones to embark on a search for the Holy Grail. Indy learns that a medieval historian has vanished while searching for it, and the missing man is his own father, Dr. Henry Jones Sr.. He sets out to rescue his father by following clues in the old man's notebook, which his father had mailed to him before he went missing. Indy arrives in Venice, where he enlists the help of a beautiful academic, Dr. Elsa Schneider, along with Marcus Brody and Sallah. Together they must stop the Nazis from recovering the power of eternal life and taking over the world!",en,https://image.tmdb.org/t/p/w500/sizg1AU8f8JDZX4QIgE4pjUMBvx.jpg,7.851,Steven Spielberg,"Paramount Pictures, Lucasfilm Ltd."
The Coloured Dream,1989,,"The many hues of Mexico's colour-dominated streetscape create a motley, almost abstract backdrop against which everyday life takes place.",en,N/A,0,Henri Plaat,
An Innocent Man,1989,"80, 18, 53","Jimmie Rainwood was minding his own business when two corrupt police officers (getting an address wrong) burst into his house, expecting to find a major drug dealer. Rainwood is shot, and the officers frame him as a drug dealer. Rainwood is convicted of drug dealing, based on the perjured evidence of a police informant. Thrown into a seedy jail, fighting to prove his innocence is diffucult when he has to deal with the realities of prison life, where everyone claims they were framed.",en,https://image.tmdb.org/t/p/w500/fDgR7vq3fqtlo2w2wPN3pNXyDm5.jpg,6.1,Peter Yates,"Touchstone Pictures, Interscope Communications, Silver Screen Partners IV"
Insiders,1989,"18, 80",,fi,https://image.tmdb.org/t/p/w500/2QN5kNALPSNoTVZg4MfWrxvDxmG.jpg,3.4,Lauri Törhönen,Fantasiafilmi
Fight for Us,1989,"18, 80, 28","Set during the post-Marcos regime in a remote village of Dolores, chronicles the life of Jimmy Cordero, a political prisoner who have just been freed from prison after the decline of the Marcos dictatorship. From his revolutionary past, he got himself into human rights activism following his prison release. He and his wife’s brother once conducted a fact-finding mission to Dolores only to find out the terror brought about to its residents by the Orapronobis, a government backed anti-communist paramilitary troop deployed in the town of Dolores.",tl,https://image.tmdb.org/t/p/w500/ulB9bqdHXqz4yds8z8y5F0YcHlv.jpg,6.4,Lino Brocka,"Special People Productions, Bernadette Associates International, The Cannon Group"
Intergirl,1989,"18, 10749","A hospital nurse becomes an ""international girl"" — a prostitute who caters to foreigners with hard currency.",ru,https://image.tmdb.org/t/p/w500/nUi1vuuemOgSehUzyLixUyt3m7C.jpg,6.7,Pyotr Todorovskiy,"Mosfilm, Filmstallet"
"The Useless Death of My Pal, Manolo",1989,,"Cheo visits his friend, Manolo, who he hasn't seen for many years. They drink to celebrate their reunion and fondly recall the times they spent together in years past. As they reminisce, the two friends confront the revolution, evaluate their lives, and bare their souls.",es,https://image.tmdb.org/t/p/w500/l92tFvlBh5RhjsO3F6sPhcySlgK.jpg,0,Julio García Espinosa,ICAIC
L'Invité surprise,1989,"35, 28","During the broadcast of a live game show, a surprise guest is shot by an armed assassin.The victim, Martin Gaillard, recounts the bizarre series of events that led to this extraordinary denouement.",fr,https://image.tmdb.org/t/p/w500/ia4rICGUoqCBa0yieOb1WVw50cL.jpg,3.8,Georges Lautner,"Gaumont Production, TF1 Films Production"
Io Gilda,1989,53,A New York mafia boss who owns a nightclub blackmails the women. Among the nightclub girls is Lulu who discovers her friend Gina is being blackmailed. Gina aka Gilda another nightclub girl lives out a fantasy as her Idol Rita Hayworth and romances her limo driver and risks being discovered by her boyfriend.,en,https://image.tmdb.org/t/p/w500/bqyPet4oFFzml7SigzCH0EPE7Up.jpg,3,Andrea Bianchi,
The Iron Triangle,1989,"10752, 18","Based on the diary of an unknown Viet Cong soldier, this film provides a sympathetic look at a Viet Cong soldier who protected a captured American soldier whom he believed did not kill him when the American had the opportunity. Written by John Sacksteder",en,https://image.tmdb.org/t/p/w500/2BWYeZNX6EG3Xlr1zA522P3KoeM.jpg,5.4,Eric Weston,"Scotti Brothers Pictures (I), Scotti Brothers Pictures"
Truants,1989,18,"In the country reformatory school both the teacher and the children are trapped by the circumstances. From among the pupils excels Sanyi, who cannot accept the fact that his mother does not love him and he keeps on escaping after her. From among the teachers it is Mr. Csőrös who distinguishes himself by listening to the children, looking for those who escaped, Sanyi feels affection to him.",hu,https://image.tmdb.org/t/p/w500/xqayuYjPib60phqzd6JcYrOlPye.jpg,5.333,Ferenc Kardos,"Budapest Filmstúdió, Mokép"
Art of Living in Odessa,1990,"35, 18",The plot of the movie is based on books of Isaak Babel about Jewish criminals in city of Odessa before and after the Russian revolution.,ru,https://image.tmdb.org/t/p/w500/sDUav2pIlsb0pHhGoj1Tg7vIrd6.jpg,5.2,Georgi Yungvald-Khilkevich,Odessa Film Studio
Island,1989,,"Island is Paul Cox's serene and beautiful film which explores a spectrum of emotions - ranging from extreme passion to fear, leading to murder - from loneliness to sensuality. Three women from Australia, Sri Lanka, and Greece meet on a Greek island. All are exiles escaping from their own personal tragedies. Ultimately, it is the island itself, with the generosity and warmth of the islanders, which leads all three women to revelations about themselves and their place in the world.",en,https://image.tmdb.org/t/p/w500/59cR68leZE3dkK3g6QcJKgVCpqI.jpg,5.2,Paul Cox,
Palace of Beauty,1988,,"Niko, a gay man, is forced by rumours about his sexuality to marry the pregnant Lita who was deserted by a mutual friend. The couple's sex life doesn't amount to much and their relationship becomes more and more tensed through the years.",id,https://image.tmdb.org/t/p/w500/dR3BExbumsRj6otsp2oXqqeaHBn.jpg,1,Wahyu Sihombing,
Istanbul,1989,53,A New York Times correspondent based in Sweden travels to Istanbul with his daughter on a secret mission.,en,N/A,4,Mats Arehn,
It Had to Be You,1989,35,A has-been actress lures a TV commercial director to her apartment to seduce him.,en,N/A,0,Joseph Bologna,
From the Life of Fyodor Kuzkin,1989,18,"Story of life of Fyodor Kuzkin, who shared all the burdens of the 30s Stalins terror and after, WW2 and post-war years.",ru,https://image.tmdb.org/t/p/w500/xhVtApbOnfzYExZiyAIqP25mXne.jpg,0,Stanislav Rostotsky,Gorky Film Studios
I Went to the Dance,1989,"99, 10402","The definitive film on the history of the toe-tapping, foot-stomping music of French Southwest Louisiana. Includes many Cajun and Zydeco greats, featuring Michael Doucet and Beausoleil, Clifton Chenier, Marc and Ann Savoy, D.L. Menard, and many others.",en,https://image.tmdb.org/t/p/w500/ybhJbyWs0GF3jdmNT1ork0Wm2sv.jpg,7.5,Chris Strachwitz,Les Blank Films
J'aurais jamais dû croiser son regard...,1989,,"In this romantic thriller, Zoe (Nathalie Cardone), a girl who has gotten into serious trouble, finds an ally and protector in Bambi (Smain), a juvenile delinquent who has fallen in love with her.",fr,https://image.tmdb.org/t/p/w500/l0qd0XEwMoGCEKuk4hPRRnW5SB8.jpg,2,Jean-Marc Longval,
J'écris dans l'espace,1989,"36, 99",,fr,N/A,5.5,Pierre Étaix,
Jacknife,1989,18,A conflict develops between a troubled Vietnam veteran and the sister he lives with when she becomes involved romantically with the army buddy who reminds him of the tragic battle they both survived.,en,https://image.tmdb.org/t/p/w500/y4TBJTHdOodkavzdG77DzjyVKpJ.jpg,6.2,David Hugh Jones,"Cineplex-Odeon Films, Kings Road Entertainment, Sandollar-Schaffel Productions"
Jaadugar,1989,35,American-returned Shankar Narayan is baffled to witness his former businessman and jailbird dad posing as a soothsayer by the name of Mahaprabhu Janak Sagar Jagat Narayan in a small town ...,hi,https://image.tmdb.org/t/p/w500/cc4RECDRqhxA33gPbt5tcPq4VgC.jpg,3.1,Prakash Mehra,
Jan Rap en z'n maat,1989,,"This is a movie about a group of young people with all sorts of problems. They all live in some old house with a number of volunteers helping them to get back on track. The young people yell and scream a lot and destroy about every object you get to see in the film. At one point they start singing happily and running down a railway station together, but soon after that, the destruction and name calling commences again until basically nothing of the house is left.",nl,https://image.tmdb.org/t/p/w500/7Rcf6iMVvSarLmCMpCivjhkpAQv.jpg,4,Ine Schenkkan,
The January Man,1989,"80, 9648, 53, 35","Nick and Frank Starkey were both policemen. A scandal forced Nick to leave the force, now a serial killer has driven the police to take him back. A web that includes Frank's wife, bribery, and corruption all are in the background as Nick tries to uncover the secret of where the killer will strike next, and finally must lay a trap without the police.",en,https://image.tmdb.org/t/p/w500/5CZznrNvFLacr0mb4CYmlpJ4Tsw.jpg,4.9,Pat O'Connor,Metro-Goldwyn-Mayer
I'm the King of the Castle,1989,"18, 53, 10749","Thomas, the son of a millionaire lives a fairly isolated existence, in a mansion in rural France. His father hires a widowed woman to take care of things while he is away. The maid's son, Charles moves in as well, and the two parents hope that the two can become friends but they become enemies immediately after meeting each other. Once their parents fall in love, Thomas decides to make Charles, who he views as an ""invader"", as miserable as possible.",fr,https://image.tmdb.org/t/p/w500/xr80j7yguIFoKjVWN6BAtLrhLva.jpg,7.063,Régis Wargnier,"AAA Production, Images Investissements"
The Hostage of Europe,1989,"18, 36","On the island of Saint Helena, a prisoner Napoleon resisted allies who, through the voice of the English governor, Hudson Lowe, tried to humiliate him, break him, poison him in the figurative sense of the word, and perhaps literally.",fr,https://image.tmdb.org/t/p/w500/vXPuLgZA7HLOnDBRBcIwZsDYiSe.jpg,6,Jerzy Kawalerowicz,"Zespół Filmowy Kadr, Ciné-Alliance"
The Iceman Cometh,1989,"28, 35, 878","When 16th-century Ming guard Fong Sau-ching sets out to capture vicious rapist Feng San, both men end up falling into a glacier to be frozen in time. Thawed out by scientists over 300 years later, the confused guard must learn to cope with the modern world and continue in his quest to vanquish his opponent.",cn,https://image.tmdb.org/t/p/w500/w7IA9YI0q3NvYXsv3UQx3EKzljX.jpg,7.1,Clarence Ford,"Orange Sky Golden Harvest, Johnny Mak Production Co. Ltd."
Jiboa,1989,,Italian war movie trash. Filmed in Morocco.,en,N/A,0,Mario Bianchi,
The Immigrant Policeman,1989,18,An intricate mystery unravels when immigrant policeman (ANTHONY TANG) uncovers a cache of counterfeit watches imported from Hong Kong. The watches are traced to his long lost father and a simple investigation becomes more than he can handle.,cn,https://image.tmdb.org/t/p/w500/DXa4BBmwmcWxyb4IDAkW0Rmlgb.jpg,0,Luk Chi-Gong,
Web of Deception,1989,"9648, 53, 80, 27","Jane is unknowingly being blackmailed by her co-worker May. When May's roommate Queenie needs a large amount of money to bail her twin sister out, May suggests stealing the blackmail money Jane is keeping locked away in her mansion for now.",cn,https://image.tmdb.org/t/p/w500/p2BZoyrFZczyWDVEkPW3sbcFDDZ.jpg,6.2,David Chung,
The Jitters,1989,"28, 27, 35","In Chinatown, merciless gang goes on nightly rampages of theft and destruction. Merchant Frank Lee has no way of fighting back - until he's undead, murdered by the gangsters...but he returns to life transformed into a ""Kyonshi"" - Chinese version of a vampire - and ready to avenge his unjust death in a way that's sure going to give you the Jitters.",en,https://image.tmdb.org/t/p/w500/AdMGuTuuzP28ycN99We3wD0zfBT.jpg,4.214,John Fasano,GAGA Communications
Johnny Handsome,1989,"80, 18","A career criminal who has been deformed since birth is given a new face by a kindly doctor and paroled from prison. It appears that he has gone straight, but he is really planning his revenge on the man who killed his mentor and sent him to prison.",en,https://image.tmdb.org/t/p/w500/kVlf4UhX5StsNQpMsjyueOECiv4.jpg,6.3,Walter Hill,"Guber/Peters Company, Roven Productions, Carolco Pictures"
Jour après jour,1989,"35, 18",Two would be producers launch a singer's career.,fr,https://image.tmdb.org/t/p/w500/gclvNelXseC4HZ4fJf2bmJKG1Db.jpg,0,Alain Attal,Les Productions Jacques Roitfeld
Jungle Assault,1989,"28, 10752",Two Vietnam vets with nothing to lose are called back into the bloodiest action of their lives. Their assignment: locate and destroy a terrorist base and bring back a General's daughter alive.,en,https://image.tmdb.org/t/p/w500/rkSX1jUiPNxNr5HMzqlSU4zYMUZ.jpg,3.8,David A. Prior,Action International Pictures
Justice Denied,1989,"80, 18, 36",Donald Marshall is imprisoned for a murder he didn't commit.,en,https://image.tmdb.org/t/p/w500/iJTwF8DuncV0TfPYPahILhrazDG.jpg,0,Paul Cowan,ONF | NFB
Jesus of Montreal,1989,18,A group of actors putting on an interpretive Passion Play in Montreal begin to experience a meshing of their characters and their private lives as the production takes form against the growing opposition of the Catholic church.,fr,https://image.tmdb.org/t/p/w500/evtfMmuJyCQch2JIdWO2SdGWgJA.jpg,6.895,Denys Arcand,"CNC, Téléfilm Canada"
The Jönsson Gang in Mallorca,1989,"35, 80","Vanheden and Dynamit-Harry, together with Harry's fiancée Doris, are in Mallorca while Sickan is still in Stockholm. However, Wall-Enberg talks him into doing a break-in at Las Palmas cathedral in Mallorca. Once persuaded, he can't resist the temptation and travels to Mallorca as well. However, Wall-Enberg obviously can't be trusted. Sickan is framed, caught and put in jail. While being escorted home to Sweden again, Vanheden and Harry sets up a plan to break him free. Sickan, once free, wants payback. The gang discover that an antiques dealer called Germann has something to do with the whole thing and that she's also collaborating with Wall-Enberg. The gang then decide to take a closer look at her and her antiques and they discover that there's a heist being planned against the cathedral in Palma.",sv,https://image.tmdb.org/t/p/w500/fJyOupPvVi3f8dFnctDtekSEgs1.jpg,5.5,Mikael Ekman,"SF Studios, Cinema Art, Nordisk Film Denmark"
K-9,1989,"28, 35, 80","The extravagant cop Michael Dooley needs some help to fight a drug dealer who has tried to kill him. A ""friend"" gives him a dog named Jerry Lee (Officer Lewis), who has been trained to smell drugs. With his help, Dooley sets out to put his enemy behind the bars, but Jerry Lee has a personality of his own and works only when he wants to. On the other hand, the dog is quite good at destroying Dooley's car, house and sex-life...",en,https://image.tmdb.org/t/p/w500/21mBNUe0X4WYywe6w5DyihltmAn.jpg,6.1,Rod Daniel,"Gordon Company, Universal Pictures"
Kala Bazaar,1989,"28, 18","In modern secular India corruption, nepotism, caste, and favoritism has taken root all the way from Kashmir to Kanyakumari, sparing no one in it's wake. Bombay Municipal Corporation's employee Kimtilal is one such person who had to pay a bribe to a gynecologist so that his wife, Shanti, can give premature birth to their son, Kamal. When Kamal grew up, Kimtilal had to pay another bribe in the form of a donation to a school for admitting him. Then he had to pay another bribe so that his son could successfully pass his college examination, and go on to join the Bombay Police Force. Finally, he withheld an important municipal license for businessman Sampat, in order to get his consent to marry his advocate daughter, Kamini, with his son.",hi,https://image.tmdb.org/t/p/w500/r59iE6145Pseeg0kXmFUEyNCPoe.jpg,5.9,Rakesh Roshan,
Kanoon Apna Apna,1989,"28, 18, 80","A loyal government official fights to uphold his dignity when a group of goons try their best to taint his reputation. To do this, he uses his methods of justice.",hi,https://image.tmdb.org/t/p/w500/qjzGUZ47PDSbUBfNBzXCBApvDcC.jpg,4,B. Gopal,
