Title,Year,Genre,Plot,Language,Poster,IMDBRating,Director,Production
Mr. Housewife: Quiz King,2005,35,"To save his family from financial troubles, a house-husband takes part in the ""Housewife Quiz Show"" for the jackpot prize.",ko,https://image.tmdb.org/t/p/w500/7t8T1nsMEEfkTzqJ9R5ECxOqcor.jpg,6.6,You Sun-dong,
Mulawin: The Movie,2005,"10749, 12, 28, 14","After resolving to live peaceful lives as mortals, enchanted warriors Aguiluz and Alwina are caught in a violent storm and washed away to separate shores, where they struggle to survive without their memories. Meanwhile, the fire maiden Pirena resurrects Ravenum to wreak havoc on the Mulawin race.",tl,https://image.tmdb.org/t/p/w500/nTW1v3OxFd3hAw3cHaAyNhvUBpJ.jpg,7,Dominic Zapata,"GMA Pictures, Regal Entertainment Inc."
All for Love,2005,"18, 10749, 35",A romantic comedy which portrays the most beautiful period in the lives of different couples who have just fallen in love.,ko,https://image.tmdb.org/t/p/w500/vfxp7wSxG8rOayxOpHs2VbPkQg5.jpg,6.5,Min Kyu-dong,"Soo Film, CJ Entertainment, Doosaboo Film"
Blue Moon,2006,"10749, 18","Corazon (Boots Anson Roa), an old Filipina who lives in Boston, wrote to each Manuel Pineda in her home a letter. She hopes to find her love again. In the Philippines experiences of the old Manuel Pineda (Eddie Garcia), meanwhile, that he has cancer and has only months to live. He goes in search of his Corazon.There were two Corazons in his life: before the Second World War, he spent (Mark Herras) and his buddy Domingo (Polo Ravales) a lot of time with the shy ""Cora"" (Jennylyn Mercado) and the lively "" Azon ""(Pauline Luna).",en,https://image.tmdb.org/t/p/w500/tDkegNhdXIqJPhuJhcypzaUFvko.jpg,8,Joel Lamangan,Regal Entertainment Inc.
Rumi: Turning Ecstatic,N/A,99,"In December 1997, Tina Petrova drove off a cliff - literally and figuratively. A tragic car crash in the California desert was the beginning of a journey that would lead her to the extraordinary works of 13th century Sufi mystic Mevlana Jellaludin Rumi and to a remarkable array of people whose lives have been transformed by his poetry and philosophy. Rumi: Turning Ecstatic is her true story, a timely, powerful docudrama that take the viewer into the very heart of Sufi mysticism.",en,https://image.tmdb.org/t/p/w500/tzhtuOjKmSVHBi7tYXYmQ0PUE2V.jpg,0,Tina Petrova,Visionary Media Inc.
Shake Rattle & Roll 2k5,2005,"35, 27","The second installment of episodes from this classic horror series scares up even more screams than the first. In ""Poso,"" a wealthy client tempts a hack occultist out of retirement. In ""Aquarium,"" a family moves into their new home only to discover that the previous occupants left something terrible behind. And in ""Lihim,"" a pregnant woman fears for the life of her unborn child.",tl,https://image.tmdb.org/t/p/w500/fEUxnMHwjCPO0QtH8p5YMX5Wtwy.jpg,4.5,Uro Q. dela Cruz,"Reality Entertainment, Ignite Media, Regal Entertainment Inc."
"Stand Up, Teacher!",2005,99,"The fates of the students involved in the Latvian educational system reforms and that of their teacher – the screenwriter and film director, Tālivaldis Margēvičs, are unusually intertwined. This leads to thoughts on various, current integration problems and on universal human values.",lv,https://image.tmdb.org/t/p/w500/kcrM6Hs7UgAVbbwmXmoknaZ503d.jpg,7,Tālivaldis Margēvičs,Eiropas dokumentālā kino simpoziji
Tiger!,2005,99,Tiger! is a compelling story about a wrestling legend who turned 60 in 2004. For most people this would be seen as a good time to retire on a 100 acre property. Tiger chooses instead to take on 36 year old Japanese Judo champion Naoya Ogawa.  ‘Tiger!' is a riveting story with a nail-biting climax.,en,https://image.tmdb.org/t/p/w500/jYsh6arUv9HjPT8ZC8ZZpwbcAwY.jpg,0,Lalita Krishna,In Sync Video
You Are My Sunshine,2005,"10749, 18","An old bachelor Seok-joong, who has no experience in dating, falls in love at first sight with a prostitute named Eun-ha. At first Eun-ha shows no interest in Seok-joong, but gradually she begins to be flattered by his devotion and eventually falls in love with him. They marry. However, one day, Eun-ha finds out that she is infected with HIV and decides to leave Seok-joong.",ko,https://image.tmdb.org/t/p/w500/iAFj8oCQmTfBbQzDe2ptLzWUzD1.jpg,6.6,Park Jin-pyo,Bom Film Productions
Ice Breaker,2005,,Documents life aboard a modern Canadian ice breaker.,en,N/A,0,David Best,
One Way Boogie Woogie/27 Years Later,2005,99,"One half filmed in 1977, one half filmed 27 years later.",en,https://image.tmdb.org/t/p/w500/7xQ6rfsmAnwkOJrMA9SLiy6zAr5.jpg,6.3,James Benning,
Black Widow,2005,18,"A film noir-style musical telling the story of how a man met his end by getting sucked into a web of lies and deceit by a beautiful, dark-haired singer.",en,N/A,6,David Mortin,
Cutting Room!,2005,27,A director of a low budget movie decides to kill her fellow cast and crew members as they have used her art to become rich and famous.,en,https://image.tmdb.org/t/p/w500/h1ITwX8zQVF38Y4NACbICPfHrUl.jpg,4,Krist Rufty,
Dunia,2006,"18, 10749","After studying literature at Cairo University, Dunia, 23 years old, wants to become a professional dancer. She attends audition for an oriental dance contest where she recites Arabian poetry without any body movement. She explain to the perplexed jury that a woman can't move her body or evoke act of love when society ask women to hide their femininity. She is selected and meet Beshir, an intellectual and activist who will supervise her thesis on ecstasy in Sufi love poetry. Their attraction is mutual. This could be liberation for Dunia but the constraints on women in Egyptian society goes deeper than she suspects.",ar,https://image.tmdb.org/t/p/w500/qwlikYWMRW8ga7ZJcB6KQBnGLje.jpg,5.1,Jocelyne Saab,Catherine Dussart Productions
Following Sean,2006,99,"Filmmaker Ralph Arlyck first met Sean while living as a graduate student in Haight Ashbury at the height of the 1960s.  The city was awash with the trappings of America’s cultural revolution-the San Francisco State University campus flooded with cops in riot gear, the Haight filled with drifters and idealists, and, on the third floor of Arlyck’s building, a come-one-come-all crashpad apartment. It was from this top floor commune that the precocious 4-year-old Sean would occasionally wander downstairs to visit and talk-and one day Arlyck turned on his camera.  Sean’s casual commentary on everything from smoking pot to living with speed freaks was delivered in simple sincerity throughout the soon-to-be famous 15-minute film. This First Child of the notorious decade may have shaken the audience with his simple sentence- “Sure, I smoke pot”-but it was his barefoot impishness which would encapsulate the hope that lay in front of the nation: a promise of infinite possibility.",en,https://image.tmdb.org/t/p/w500/eNq95OeRbVhqY9FT5JQECaQDI3w.jpg,6.3,Ralph Arlyck,Timed Exposures
Neue Wut,2005,99,,de,N/A,0,Martin Keßler,
Rash,2005,99,Rash is a contemporary story of Melbourne Australia and the artists who make it a living host for illegal artwork called street art.,en,https://image.tmdb.org/t/p/w500/kfrXJeq5yPxnWk44cMTeFxRe0H6.jpg,5.9,Nicholas Hansen,
Rigodon,2006,18,Rigodon follows the spiritual journey's of three Filipino immigrants in New York City whose lives intertwine in the age of racial profiling and government crackdowns.,en,https://image.tmdb.org/t/p/w500/d9TALNkEBnZUCAkaGrnHLKosYFv.jpg,0,Keith Sicat,
La tragedia de Macario,2005,,"A new film inspired by the true events of immigrants from Mexico exhausting every effort to find a better life in the United States and paying the ultimate price as they attempt to cross the borders into a new world. This movie is dedicated to those nineteen ""workers"" who were suffocated to death in the Hell of a trailer in Victoria, Texas on May 14, 2003...",es,N/A,0,Pablo Veliz,
Dignity of the Nobodies,2005,99,"The degraded socio-economic condition of Argentina leading to the December 2001 rebellions, and its consequent social chaos analyzed by focusing on real people from Buenos Aires poorest shantytowns, crumbling hospitals, and women middle class farmers fighting multi national banks that are shamelessly appropriating their farmlands. Written by Gonz30",es,https://image.tmdb.org/t/p/w500/k4lFtkVEzF2odNgxGst3E4XfG96.jpg,6.7,Fernando E. Solanas,Cinesur
The Perfect Afternoon,2007,"35, 18",,pl,https://image.tmdb.org/t/p/w500/68sn8aWZvhJYtFi5QIeyySAQAjm.jpg,3,Przemysław Wojcieszek,
Happily Ever After,2005,"18, 35, 10749","Happily Ever After is a trilogy. Each is a love story with a touch of magic, comedy and whimsy. Tying all the segments together is a seemingly fake fortune teller, who uses a science sphere she got at a novelty store as a crystal ball!",tl,https://image.tmdb.org/t/p/w500/mUTHtFR1ND6ylcgdyVhDa5QrOj5.jpg,1,Maryo J. de los Reyes,"MAQ Productions, Regal Entertainment Inc."
The Collector,2005,18,"Lucjan Bohme is a ruthless debt collector working in a post-industrial Silesian town. In the land of unemployment and misery, he's got a lot of work and no mercy at all. Until something happens.",pl,https://image.tmdb.org/t/p/w500/16SkV2qUXJjMdWdSBtJhO9QX6Gx.jpg,6.4,Feliks Falk,"Zespół Filmowy ""Perspektywa"""
"It's Me, Now",2006,18,"Hanka is a young woman who suddenly abandons her stable life for no obvious reason, and undertakes a trip without any clear destination, meeting strangers on her way. At the same time, her boyfriend desperately tries to find her.",pl,https://image.tmdb.org/t/p/w500/lEb1V3KW5q6AH6HH3y0sfNUi46f.jpg,6,Anna Jadowska,
Open Cam,2005,"18, 53, 35, 27, 9648","Gay serial killer in Washington, DC uses dating web site to stalk victims.",en,https://image.tmdb.org/t/p/w500/s9JgLm9oLnDoD7UnF84DExb8mfK.jpg,3.8,Robert Gaston,Lil Coal's Big Pictures
The Greenhouse Effect,2005,18,"Rita is a naive 18-year-old from the sticks who has come to Moscow to meet up with the man who impregnated her a few months earlier. Unfortunately, his name and address was written on a piece of paper in her luggage, which was promptly stolen upon her arrival in Moscow. Thus, she is a bit at loose ends, and going back home is clearly not an option.",ru,https://image.tmdb.org/t/p/w500/1kSpFW9q5SvceyIYUzXWsGllXJr.jpg,4,Valeri Akhadov,CNF
CCCV (Cineclube Carlos Varela),N/A,,,es,https://image.tmdb.org/t/p/w500/mGi7iDrpGav1vauFyzzISHyE9Rb.jpg,0,Ramiro Ledo Cordeiro,
The King of San Gregorio,2005,"18, 10749",Pedro and Cati live in the San Gregorio township. They must fight for their love despite the over-protection and fears of their families.,es,https://image.tmdb.org/t/p/w500/yGO9sWrasKLhG6B0iAbUIqUzkcx.jpg,0,Alfonso Gazitúa Gaete,
The Sacred Family,2006,18,"It's Easter in the beach house of a Chilean well-to-do and nowadays family. A self-centered and successful father, a disoriented mother and a son overshadowed by his successful father. The three of them, wait for the arrival of the son's first official girlfriend; a disturbing and rebellious young lady who will invade the house with her powerful sexual load and other ""gifts"", breaking loose an emotional cataclysm with no stepping back.",es,https://image.tmdb.org/t/p/w500/q9quwwH5h4C45kOQ4J7jVsMnepZ.jpg,5.5,Sebastián Lelio,Horamágica
Rascals on the Road,2005,"10751, 35","Four kids - Eugen, Wrigley, Bäschteli and Eduard - leave for an adventure around Switzerland, searching for the fabulous treasure of Titicaca Lake, discovered by Fritzli Bühler.",de,https://image.tmdb.org/t/p/w500/7JLNNHUkgIOB4feanZiv8KSxgCx.jpg,6.5,Michael Steiner,"Impuls Pictures, Kontraproduktion AG, Schweizer Fernsehen (FS)"
Scratched,2005,18,"Five university students in North Queensland, Australia, spend one insane summer night tearing their share house apart looking for a hidden million-dollar scratch lottery ticket, as outside, a catastrophic tropical cyclone looms.",en,https://image.tmdb.org/t/p/w500/uvIxrCixSz2aLEakPYNiil4ViC7.jpg,0,Travis Bain,Sapphire Pictures
Coisa de Mulher,2005,"35, 10749",,pt,https://image.tmdb.org/t/p/w500/vlouLY4YUa6KK1RfzFa9vqk6EY1.jpg,0,Eliana Fonseca,"SBT Filmes, Diler & Associados, TeleImage, Warner Bros. Pictures"
O Cárcere e a Rua,2004,99,,pt,https://image.tmdb.org/t/p/w500/c8TQ4bQgtcCNIgwHsEc5i8iCbTE.jpg,10,Liliana Sulzbach,
Geochilmaru,2005,"28, 18",Eight martial arts masters trained in a variety of different fighting styles are summoned to the mountains for a fierce competition.,ko,https://image.tmdb.org/t/p/w500/5auGrB8e0COaYyRwG16VAiMXV4v.jpg,4.8,Kim Jin-sung,
Joy,2005,"18, 35","Joy Levine lives in an old apartment that, in complete contrast to her, is shabby and worn-out on the outside while well-kept and filled with joy on the inside. Her life changes when she auditions for a TV show called ""Gotta Be Happy"". To her astonishment, she is chosen, and her mission is to throw a surprise party for her parents on the upcoming show. However, there is a price to pay for all this: she has to let the viewers into her private inner world and share with them an event that has been overshadowing her family's life and hers for the past 22 years; an event that made a tight-knit bunch of friends shun her parents, Chaya and Yitzhak Levine.",he,https://image.tmdb.org/t/p/w500/7GjMYSZ6NpA2MEnlMZHdgSJHwKU.jpg,0,Julie Shles,
The Lovers of Marona,2006,"18, 10749",The movie is based on Iwaszkiewicz's autobiographic story and focuses on main character's (Janek's) close relationship with a woman named Ola and a man named Arek. It takes place in a small village called Marona which is situated by the beautiful lake.,pl,https://image.tmdb.org/t/p/w500/3xjaoreQU4dAyL1R6E0xvmaVLHb.jpg,4.4,Izabella Cywińska,"Agencja Produkcji Filmowej, Agencja Media Plus"
A Trip to Karabakh,2005,"80, 18","A group of teenage boys from Tbilisi take a trip to Azerbaijan to buy drugs, and end up fighting in the Nagorno-Karabakh War, when they are captured by Azerbaijani militants, with one subsequently being captured by the Armenians. During the course of events, the main character has flashbacks to his relationship with his father, as well as a depressive prostitute.",ka,https://image.tmdb.org/t/p/w500/1Zr9Dg57FUBUQ7ZmaJy4NgVNN1l.jpg,5.8,Levan Tutberidze,Film Studio Remka
Ode to Joy,2006,18,Three stories of young disillusioned Poles of different background and region of origin. What binds them together is that they all meet on the bus to London shortly after Poland's entry into EU.,pl,https://image.tmdb.org/t/p/w500/e70dn1PGbcgECKhjM5fluckbahg.jpg,6,Jan Komasa,"Akson Studio, Canal+ Polska, Telewizyjna Agencja Produkcji Teatralnej i Filmowej"
Polyeucte,2005,,,fr,N/A,0,Christophe Atabekian,
Seven Nights,2005,,Chinese horror film directed by Zhang Jing.,zh,https://image.tmdb.org/t/p/w500/95tXDaU6x8uRsFSdQpix7Hnqsmt.jpg,4,Zhang Jing,
Die Zombiejäger,2005,"27, 28, 35","Sometimes mentioned as a modern Bad Taste.""During a time in the near future, Gothenburg has been invaded by zombies. The police are powerless and a team of German zombie hunters are called in to solve the problem and clean up the city and find out what is causing the zombe epidemic. On their way through the streets of Gothenburg, they run into several obstacles. For example, they come across an Italian assassin and some Swedish reporters on the wrong side of the barricades.""",sv,https://image.tmdb.org/t/p/w500/Ac5eXzAxgUTPdO3JgQE0vuVh2us.jpg,2.6,Jonas Wolcher,Dino Publishing JW
Filmmakers vs. Tycoons,2005,99,"How the cinema industry does not respect the author's work as it was conceived, how manipulates the motion pictures in order to make them easier to watch by an undemanding audience or even how mutilates them to adapt the original formats and runtimes to the restrictive frame of the television screen and the abusive requirements of advertising. (Followed by “Filmmakers in Action.”)",ca,https://image.tmdb.org/t/p/w500/2AanByW21v9XFPzaG1SBsQaYRCX.jpg,6.2,Carlos Benpar,Producciones Kilimanjaro
Monamour,2005,18,"Marta is a young housewife, married to Dario, a successful book publisher. Although she still loves her husband, Marta hasn't been able to achieve sexual satisfaction for months due to their dull and predictable love life. While staying in Mantua for the Festivaletteratura, a book fair, Marta follows the advice of her scheming friend Sylvia and pursues an affair with a handsome and mysterious artist named Leon, which leads to surprising results regarding her failing marriage with Dario.",it,https://image.tmdb.org/t/p/w500/iawNYRx8Owywrk6dRuYIWA47TZx.jpg,5.6,Tinto Brass,Carla Cipriani per Monamour
Christmas in Miami,2005,35,"In Christmastime Miami, heartbroken divorcée Giorgio invites himself to stay at his best friend Mario's — unaware that the latter is having an affair with his ex-wife — and ends up pursued by Mario's barely-of-age daughter; nosy and out-of-touch Ranuccio crashes his son's sex-themed holidays before ending up in a series of mishaps with Giorgio.",it,https://image.tmdb.org/t/p/w500/c2mo0g4w7QMMyp7BJv4OFlHQbo2.jpg,5.1,Neri Parenti,Filmauro
Never Again as Before,2005,"18, 35","Six schoolmates, after their final exams, decide to go together on holiday in the Dolomites, in what will probably be their last summer together before taking different ways. In that time they will learn to know themselves and others better, facing and trying to overcome their fears.",it,https://image.tmdb.org/t/p/w500/1csaiGPzFbghzCJGhicsghhShGB.jpg,5.9,Giacomo Campiotti,Medusa Film
Schwartz Dynasty,2005,"35, 18, 10749",The Schwartz Dinasty belong to a long tradition of Jewish rabbis. The grandfathers took their faith and turned it into deeds coming to the Land of Israel to start a new life and build a country. Where are their descendants and how are they doing in the Israel of today?,he,https://image.tmdb.org/t/p/w500/nQvt7gLgQnqTrwrBEMG7oEPaWd0.jpg,6,Amir Hasfari,
Angry Monk - Reflections on Tibet,2005,99,"Schaedler's film tells the fascinating story of Tibetan monk Gendun Choephel whose robes ultimately proved to be too constricting for his imagination and intellect. Born in 1903, Choephel left an indelible mark on Tibetan culture and became an icon for young Tibetans today. Because of his political views he was persecuted by the Tibetan government and died a broken man in 1951. The film follows in the footsteps of the rebel monk whose intellect challenged the ancient traditions of old Tibet. Journeying through Tibet and India, “Angry Monk” provides a vivid picture of Tibet that is in refreshing contrast to its often idealized and esoteric image.",en,https://image.tmdb.org/t/p/w500/gaYegy5c4EMUFDecPQH3T8xFHqe.jpg,10,Luc Schaedler,go between films GmbH
Carmen & Geoffrey,2005,,"This intimate documentary follows careers of two remarkable personalities: Carmen de Lavallade, a dynamic dancer and choreographer from California who moved to New York with Alvin Ailey and began a legacy of modern dance in America, and her husband Geoffrey Holder, a Trinidad-born choreographer, set and costume designer, painter and man about town with productions such as The Wiz. Features interviews and performance footage of friends and colleagues: dancers Judith Jamison, Gus Solomons, Jr., Dudley Williams, Ulysses Dove and Alvin Ailey.",en,N/A,0,Nick Doob,
A Luz na Ria Formosa,2005,,"The journey begins in the Roman ruins of Milreu in Portugal, where a mother reads to her son Seneca's advice on the importance of reading. It then takes them through villages and shores where light reigns.",pt,https://image.tmdb.org/t/p/w500/e2EXet0mZsZQPSxefvPH8oNe19z.jpg,0,João Botelho,
Gitmo,2005,99,Looks at the link between Guantanomo Bay and the torture methods used in Iraq. How US forces handle the task of retrieving information from the detainees. Ex detainee Mehdi from Sweden breaks his vow of silence.,sv,https://image.tmdb.org/t/p/w500/1iEJYCOJvrR5tFHJBLrCAj4cpuZ.jpg,5.8,Erik Gandini,
Hari ng Sablay,2005,"10749, 35","Venus and Mars are neighbors born during a rare planetary alignment, but while Venus grows up blessed by good fortune, Mars seems destined to bring nothing but bad luck to his friends and family. Just when everything looks hopeless for Mars, he discovers he has a rare gift and also that he's in love with the beautiful Venus. Is romance in the stars for Mars, or will his rotten fate break his heart again?",tl,https://image.tmdb.org/t/p/w500/8VxzyV4NxQpuJVflpoOMSVtkpXU.jpg,0,Mac Alejandre,Regal Entertainment Inc.
The İmam,2005,18,A young and successful entrepreneur has difficulty in coming to terms with his religious upbringing. One day he is pushed into substitute for his ailing friend as the Imam of a small village.,tr,https://image.tmdb.org/t/p/w500/nBkmr0DY4D8eJoBIYJaa6GSYp5A.jpg,5.8,İsmail Güneş,Coloni Yapım
Chère Jacqueline,2005,99,,fr,N/A,0,Dominique de Rivaz,"VPS prod, RSI, RTS"
Hogtown,2005,99,Hogtown: The Politics of Policing is an unblinking look at political pressures and their impact on the operations of the Toronto Police Services Board.,en,https://image.tmdb.org/t/p/w500/3pHUlNi70J64O5PX5pRAdkNeC9f.jpg,0,Min Sook Lee,City State Productions Ltd.
Luscious Johnny: The Wrestler,2005,99,The story of WWF Hall of Fame wrestler Johnny Valiant.,en,N/A,0,Nick Oddo,
Naked In Ashes,2005,,Among India's one billion people exists a passionate and (to Western minds) eccentric community of 13 million Yogis. They live in a world never seen on film.,en,https://image.tmdb.org/t/p/w500/cSl7tsBWkjfeZFBhCU1tIaqQbx2.jpg,0,Paula Fouce,
Operation Spring,2005,99,"""Operation Spring"" is a documentary thriller about a police investigation and court proceedings against Africans suspected of belonging to a Nigerian drug ring. New laws were implemented and new methods of investigation were put to the test for the first time.  The film poses the question of whether the defendants ever stood a chance of receiving a fair trial.",de,https://image.tmdb.org/t/p/w500/wgpMiFRtn87qAlEubj8RKGsncWv.jpg,0,Angelika Schuster,"Schnittpunkt - Sindelgruber Tristan, Film- & Multimediaproduktion"
The Prince of Chess,2005,99,Follow the brilliant mind of 13 year old Chess Grand Master Magnus Carlsen,no,https://image.tmdb.org/t/p/w500/uReonO1r7KHsGRNhnWMZSBfLAyp.jpg,0,Øyvind Asbjørnsen,Main Island Production
The Retreat,2005,27,"A group of college students travels to the cottage of their psychology professor Barren in an isolated island as a reward of their teamwork in the research of Barren. They expect to spend the weekend with lots of sex, but a serial-killer turns their party in a nightmare.",en,https://image.tmdb.org/t/p/w500/oZA8YEkRchRFzZTevbi6cM3VmU3.jpg,4,Matt Cantu,"Freetown Entertainment, Mainline Releasing, Charity Island Pictures"
Under the Ceiling,2005,18,"As far as one can remember, water has been dropping from this ceiling. One drop after another, slowly, like an ever-repeating dream that spreads all-over and changes the rhythm of life, creating a partition in-between the internal and the external. One camera for Nidal Debs, another for his hero Marwan, One camera shooting what the other sees. who makes the film?. Marwan lives in Damascus since a long time, since when refugees arrived and filled the city, since hardship was even harder. He & his friends lived those times when life was different, when dreams were bouncing in the streets. Something is happening today, the friends awaken as Ahmad passes away, a life-time of silence has passed, a life-time of frustration and loneliness must end, dreams are searching for a few minutes, for last moments, there is still a little time left. There is a new space today.",ar,https://image.tmdb.org/t/p/w500/fmNT6Wyndai9zLWtlA6T6pSpUDi.jpg,10,Nidal Al-Dibs,المؤسسة العامة للسينما
Vocal Parallels,2006,18,"Vocal Parallels is a surreal, impressionistic concert of classical opera pieces performed by several retired Soviet opera divas: Roza Dzhamanova, Araksiia Davtian, Bibigul’ Tulegenova, and the late Erik Salim-Meriuert (Kurmangaliev), a fantastic countertenor.",kk,https://image.tmdb.org/t/p/w500/wO4EhakXYPf43zp4PnmO3nu68kM.jpg,6.1,Rustam Khamdamov,GALA TV Productions
Zur falschen Zeit am falschen Ort,2005,99,Documentary film.,de,https://image.tmdb.org/t/p/w500/7vZefJldAe0r9q15ZpKMip2JF07.jpg,0,Tamara Milosevic,
Blossom Again,2005,"18, 10749","Thirty year-old teacher In-young falls in love with her own student, Suk. What attracted her to the boy was the fact that he resembled her first love in every way, and even shared the same name. But with the sudden return of her long-lost love, and the appearance of a cute high school girl who confesses her love towards the boy Suk, In-young finds herself lost among the two first loves.",ko,https://image.tmdb.org/t/p/w500/b3QvdwV9e5hudH0SXSpa2QgX4tb.jpg,6,Jung Ji-woo,"CJ Entertainment, Cinema Service"
Into the Picture Scroll: The Tale of Yamanaka Tokiwa,2004,99,This extraordinary film presents Japanese classical scroll painting as never before. The Yamanaka Tokiwa comprises twelve scrolls painted by Matabei Iwasa some 400 years ago. Haneda redefines the art documentary and demonstrated that a film about a masterpiece can be equally masterful.,ja,https://image.tmdb.org/t/p/w500/mZoRSOTllQLXWubddXXMRHBGHpx.jpg,0,Sumiko Haneda,Jiyu Kobo
"Muxes. Authentic, Fearless Seekers of Danger",2005,,"Shows the lives of a group of homosexuals in Juchitán, a part of the isthmus of Oaxaca, in southern Mexico, who defend their right to be different through transgressions, ethnic identity and the pleasure of celebrating life intensely. A community that enjoys sensuality, has fun and laughs at itself, but also dares to face the rejection of family members.",es,https://image.tmdb.org/t/p/w500/uMGsDi2kF91NAiPRaCcB87h5VaF.jpg,5,Alejandra Islas,
